first_name,last_name,suffix,ssn,gender,dob,applying,address,unit,city,state,zip_code,county,mailing_address,mailing_city,mailing_state,mailing_zip_code,phone,email,plan,csr_level,metal_level,issuer,effective_date,premium,subsidy,net_premium,applicant_count,out_of_pocket_max,deductible,submitted,submission_date,agent,npn_used,npn_reason,last_comment,premium_paid,followup_docs,app_fee,ffm_app_id,ffm_subscriber_id,plan_name,gross_premium,plan_hios_id,street_address,initial_utm_source,initial_utm_campaign,effectuated,date_effectuated,date_cancelled,expiration_date,policy_status,household_size,household_income,preferred_language,ethnicity,dmi_outstanding_count,dmi_expired_count,dmi_completed_count,svi_outstanding_count,svi_expired_count,svi_completed_count,renewal,alliance_id,external_id,last_submission_date,spouse_first_name,spouse_last_name,spouse_suffix,spouse_ssn,spouse_gender,spouse_dob,spouse_applying,other_1_first_name,other_1_last_name,other_1_suffix,other_1_ssn,other_1_gender,other_1_dob,other_1_applying,other_2_first_name,other_2_last_name,other_2_suffix,other_2_ssn,other_2_gender,other_2_dob,other_2_applying,other_3_first_name,other_3_last_name,other_3_suffix,other_3_ssn,other_3_gender,other_3_dob,other_3_applying,other_4_first_name,other_4_last_name,other_4_suffix,other_4_ssn,other_4_gender,other_4_dob,other_4_applying,other_5_first_name,other_5_last_name,other_5_suffix,other_5_ssn,other_5_gender,other_5_dob,other_5_applying,other_6_first_name,other_6_last_name,other_6_suffix,other_6_ssn,other_6_gender,other_6_dob,other_6_applying,other_7_first_name,other_7_last_name,other_7_suffix,other_7_ssn,other_7_gender,other_7_dob,other_7_applying,other_8_first_name,other_8_last_name,other_8_suffix,other_8_ssn,other_8_gender,other_8_dob,other_8_applying,other_9_first_name,other_9_last_name,other_9_suffix,other_9_ssn,other_9_gender,other_9_dob,other_9_applying,other_10_first_name,other_10_last_name,other_10_suffix,other_10_ssn,other_10_gender,other_10_dob,other_10_applying,is_renewable,renew_resume_link,last_ede_sync,broker_bonus_amount,referral_bonus_amount
Maria,Martinez,,***-**-1249,female,2/27/1966,TRUE,6643 Spring Hollow Dr,,San Antonio,TX,78249-2710,Bexar,FALSE,FALSE,FALSE,FALSE,2103504489,mariamartinez2766@icloud.com,Ambetter Value Silver 32,share94,Silver,Ambetter from Superior Health Plan,1/1/2022,730.27,697,33.27,0,1575,0,Yes,11/1/2021,"Rodriguez, Yaneisy",17420949,agent_override,,Cancelled,completed,,4148160235,9828256,Focused VALUE Silver,730.27,87226TX0080009,6643 Spring Hollow Dr,,,FALSE,,3/30/2022,12/31/2022,Cancelled,1,18000,Spanish,,0,0,1,0,0,0,FALSE,,,2021-12-27 22:50:59 UTC,,,,,,,,,,,,,,,,,,,,,,,,,,,,,,,,,,,,,,,,,,,,,,,,,,,,,,,,,,,,,,,,,,,,,,,,,,,,,,Yes,https://www.healthsherpa.com/access/462598900608,8/19/2022 16:54,$75.00 ,
Miguel,Perales,,***-**-5379,male,11/25/1965,TRUE,500 Apache Loop,,Cherokee,TX,76832-2206,San Saba,FALSE,FALSE,FALSE,FALSE,3252052551,,Ambetter Balanced Care 32,,Silver,Ambetter from Superior HealthPlan,1/1/2022,995.16,857,138.16,0,,,Yes,11/1/2021,"Rodriguez, Yaneisy",17420949,agent_override,,Terminated,expired,,4171631139,9489808,Ambetter Balanced Care 32,995.16,29418TX0140101,500 Apache Loop,,,FALSE,11/9/2021,1/27/2022,1/26/2022,Terminated,1,15000,Spanish,,0,1,0,0,0,0,FALSE,,,2021-11-01 16:45:22 UTC,,,,,,,,,,,,,,,,,,,,,,,,,,,,,,,,,,,,,,,,,,,,,,,,,,,,,,,,,,,,,,,,,,,,,,,,,,,,,,Yes,https://www.healthsherpa.com/access/214557743164,11/11/2022 0:17,$0.00 ,
Raul,Escobedo,,***-**-6935,male,11/14/1982,TRUE,145 Tierra Verde Run,,Dale,TX,78616,Caldwell,FALSE,FALSE,FALSE,FALSE,5127381008,,Ambetter Balanced Care 32,share94,Silver,Ambetter from Superior HealthPlan,9/1/2022,942.78,826,116.78,2,1575,0,Yes,11/1/2021,"Borges, Mario",17420949,agent,,PendingEffectuation,action_needed,,4172193700,8464024,Ambetter Balanced Care 32,942.78,29418TX0140101,145 Tierra Verde Run,,,FALSE,,,9/30/2022,PendingEffectuation,2,18001,Spanish,,2,0,0,0,0,0,TRUE,,,2022-02-02 18:00:52 UTC,,,,,,,,Salva,Escobedo,,,female,5/5/2007,TRUE,,,,,,,,,,,,,,,,,,,,,,,,,,,,,,,,,,,,,,,,,,,,,,,,,,,,,,,,,,,,,,,,Yes,https://www.healthsherpa.com/access/536378199321,9/29/2022 21:19,$75.00 ,
Hilda,Aranda Rangel,,***-**-3486,female,12/23/1970,TRUE,600 N Carolina Dr,Apt 86,El Paso,TX,79915-2616,El Paso,FALSE,FALSE,FALSE,FALSE,9154491665,hildaaranda9828@gmail.com,Ambetter Balanced Care 32,share94,Silver,Ambetter from Superior HealthPlan,1/1/2022,664.82,608,56.82,0,1575,0,Yes,11/1/2021,"Borges, Mario",17420949,agent,,Cancelled,,,4171843192,4844810,Focused Silver,664.82,29418TX0140100,600 N Carolina Dr,,,FALSE,,1/5/2022,12/31/2022,Cancelled,2,18000,Spanish,,0,0,0,0,0,0,FALSE,,,2021-11-01 21:44:59 UTC,,,,,,,,Viviana,Lopez,,,female,2/22/2006,FALSE,,,,,,,,,,,,,,,,,,,,,,,,,,,,,,,,,,,,,,,,,,,,,,,,,,,,,,,,,,,,,,,,Yes,https://www.healthsherpa.com/access/876764431163,11/22/2022 21:19,$0.00 ,
Lidy,Flores Morales,,***-**-8889,female,12/19/1985,TRUE,301 Tiffany Loop,,Davenport,FL,33837-3589,Polk,FALSE,FALSE,FALSE,FALSE,4074083219,lidygiron19@gmail.com,Ambetter Essential Care: $0 Medical Deductible,share94,Expanded Bronze,Ambetter from Sunshine Health,1/1/2022,436.66,436.66,0,1,8700,0,Yes,11/2/2021,"Borges, Mario",17420949,agent,,Effectuated,expired,,4145337624,13192590,Elite Bronze,436.66,21663FL0130106,301 Tiffany Loop,,,TRUE,11/2/2021,,12/31/2022,Effectuated,4,32000,Spanish,,1,1,0,0,0,0,TRUE,,,2021-11-02 15:54:40 UTC,,,,,,,,Bradley,Giron,,,male,12/29/2014,FALSE,Brandon,Giron,,,male,5/28/2010,FALSE,Aitana,GIRON,,,female,8/15/2020,FALSE,,,,,,,,,,,,,,,,,,,,,,,,,,,,,,,,,,,,,,,,,,,,,,,,,,Yes,https://www.healthsherpa.com/access/485831492169,6/23/2022 12:38,$0.00 ,
Irma,Lopez Ordaz,,***-**-9190,female,3/1/1995,TRUE,215 15th St W,Duplex,Palmetto,FL,34221-3919,Manatee,FALSE,FALSE,FALSE,FALSE,9415808337,,Ambetter Balanced Care 32,none,Silver,Ambetter from Sunshine Health,1/18/2022,356.97,356.97,0,0,8700,8100,Yes,11/2/2021,"Rodriguez, Yaneisy",17420949,agent_override,,Effectuated,insufficient_documentation,,4175032537,10677100,Focused Silver,356.97,21663FL0130112,215 15th St W,,,TRUE,1/26/2022,,6/30/2022,Effectuated,3,22500,Spanish,,1,0,0,0,0,0,FALSE,,,2022-01-26 19:08:15 UTC,,,,,,,,STEPHANIE,ORDAZ,,,female,5/7/2015,FALSE,ASHLEY,ORDAZ,,,female,7/8/2013,FALSE,,,,,,,,,,,,,,,,,,,,,,,,,,,,,,,,,,,,,,,,,,,,,,,,,,,,,,,,,Yes,https://www.healthsherpa.com/access/794256855805,6/16/2022 16:39,$0.00 ,
Maricela,Cardona,,,female,12/31/1959,TRUE,1602 Maple St,,Irving,TX,75060,Dallas,FALSE,FALSE,FALSE,FALSE,2142265048,cardonamaricela87@gmail.com,Ambetter Value Silver 32,share94,Silver,Ambetter from Superior Health Plan,1/1/2022,978.26,888,90.26,1,1575,0,Yes,11/2/2021,"Borges, Mario",17420949,agent,,Effectuated,completed,,4149041121,9011776,Focused VALUE Silver,978.26,87226TX0060009,1602 Maple St,,,TRUE,5/10/2022,,12/31/2022,Effectuated,1,18000,Spanish,,0,0,1,0,0,0,FALSE,,,2022-05-10 18:22:22 UTC,,,,,,,,,,,,,,,,,,,,,,,,,,,,,,,,,,,,,,,,,,,,,,,,,,,,,,,,,,,,,,,,,,,,,,,,,,,,,,Yes,https://www.healthsherpa.com/access/810101376561,6/16/2022 16:22,$0.00 ,
Luz,Leal,,***-**-5092,female,5/11/1959,TRUE,9448 Kelvin Ln,Apt 3225,Schiller Park,IL,60176-1162,Cook,FALSE,FALSE,FALSE,FALSE,7732304637,lealuz1@yahoo.com,Ambetter Balanced Care 32,share94,Silver, Ambetter of Illinois,1/1/2022,719.54,697,22.54,1,1575,0,Yes,11/3/2021,"Borges, Mario",17420949,agent,,Effectuated,,,4124295150,3867155,Focused Silver,719.54,27833IL0140063,9448 Kelvin Ln,,,TRUE,11/3/2021,,12/31/2022,Effectuated,1,18000,Spanish,,0,0,0,0,0,0,TRUE,,,2021-11-03 17:54:41 UTC,,,,,,,,,,,,,,,,,,,,,,,,,,,,,,,,,,,,,,,,,,,,,,,,,,,,,,,,,,,,,,,,,,,,,,,,,,,,,,Yes,https://www.healthsherpa.com/access/948055878350,9/29/2022 21:18,$0.00 ,
Mercedes,Zuniga,,***-**-9926,female,9/24/2002,TRUE,9053 Green Cir,,Labelle,FL,33935-5481,Hendry,FALSE,FALSE,FALSE,FALSE,8635178106,zmercedes957@gmail.com,"Aetna CVS Silver 2: $0 MinuteClinic Visits, Telehealth, South FL",share94,Silver,Aetna CVS Health,9/1/2022,398.36,398.36,0,1,1000,200,Yes,11/3/2021,"Rodriguez, Yaneisy",18141564,agent,,Effectuated,completed,,4161303198,14847582,Silver 2: Aetna network of doctors & hospitals + $0 walk-in & telemedicine via MinuteClinic at CVS,398.36,92120FL0080007,9053 Green Cir,,,TRUE,10/4/2022,,12/31/2022,Effectuated,1,18001,Spanish,,0,0,1,0,0,0,TRUE,,,2022-08-29 19:47:06 UTC,,,,,,,,,,,,,,,,,,,,,,,,,,,,,,,,,,,,,,,,,,,,,,,,,,,,,,,,,,,,,,,,,,,,,,,,,,,,,,Yes,https://www.healthsherpa.com/access/412200072091,11/7/2022 16:19,$0.00 ,
Jose,Portillo Esquivel,,***-**-9805,male,2/29/1960,TRUE,369 N Apache Rd,,Fort Hancock,TX,79839-3902,Hudspeth,FALSE,FALSE,FALSE,FALSE,9152034550,joseportillo2960@icloud.com,Blue Advantage Silver HMO℠ 205,share94,Silver,Blue Cross and Blue Shield of Texas,1/1/2022,1143.62,1143.62,0,1,900,0,Yes,11/3/2021,"Rodriguez, Yaneisy",18141564,agent,,Effectuated,,,4177746986,9568867,Blue Advantage Silver HMO℠ 205,1143.62,33602TX0460704,369 N Apache Rd,,,TRUE,12/23/2021,,12/31/2022,Effectuated,1,13000,Spanish,,0,0,0,0,0,0,TRUE,,,2021-11-03 19:25:07 UTC,,,,,,,,,,,,,,,,,,,,,,,,,,,,,,,,,,,,,,,,,,,,,,,,,,,,,,,,,,,,,,,,,,,,,,,,,,,,,,Yes,https://www.healthsherpa.com/access/298503861775,12/13/2022 18:19,$0.00 ,
YENESI,DAVID,,***-**-1899,female,4/21/1997,TRUE,345 Blue Lake Cir,,Kissimmee,FL,34758-4337,Osceola,FALSE,FALSE,FALSE,FALSE,2673107610,,Ambetter Balanced Care 32,share94,Silver,Ambetter from Sunshine Health,3/1/2022,378.47,360,18.47,1,1575,0,Yes,11/3/2021,"Rodriguez, Yaneisy",18141564,agent,,Effectuated,,,4177284301,13850962,Focused Silver,378.47,21663FL0130112,345 Blue Lake Cir,,,TRUE,,,12/31/2022,Effectuated,1,15600,Spanish,,0,0,0,0,0,0,FALSE,,,2021-11-03 19:31:01 UTC,,,,,,,,,,,,,,,,,,,,,,,,,,,,,,,,,,,,,,,,,,,,,,,,,,,,,,,,,,,,,,,,,,,,,,,,,,,,,,Yes,https://www.healthsherpa.com/access/26820904153,8/18/2022 21:20,$0.00 ,
Sebastian,Castanon Castanon,,***-**-1082,male,12/5/1981,TRUE,1468 SE 15 TH AVE,Trailer,Arcadia,FL,34266,DeSoto,FALSE,FALSE,FALSE,FALSE,8632458037,sebastian@yti.com,"Ambetter Essential Care: $1,500 Medical Deductible",none,Expanded Bronze,Ambetter from Sunshine Health,3/1/2022,864.79,864.79,0,2,8700,1500,Yes,11/3/2021,"Rodriguez, Yaneisy",17420949,agent_override,,Terminated,expired,,4153337235,12664910,"Ambetter Essential Care: $1,500 Medical Deductible",864.79,21663FL0130104,1468 SE 15 TH AVE,,,FALSE,,5/9/2022,3/7/2022,Terminated,2,18000,Spanish,,0,2,0,0,0,0,TRUE,,,2021-11-03 22:29:10 UTC,Paloma,Betancourt,,***-**-4777,female,4/13/1990,TRUE,,,,,,,,,,,,,,,,,,,,,,,,,,,,,,,,,,,,,,,,,,,,,,,,,,,,,,,,,,,,,,,,,,,,,,,Yes,https://www.healthsherpa.com/access/13533241457,6/16/2022 17:13,$0.00 ,
Veronica,Ramirez,,***-**-8525,female,10/18/1991,TRUE,3046 County Road,Trailer 3479B,Cleveland,TX,77327,Liberty,FALSE,FALSE,FALSE,FALSE,8324802384,vero18oct@gmail.com,Ambetter Balanced Care 32,share94,Silver,Ambetter from Superior HealthPlan,6/1/2022,416.67,404,12.67,1,1575,0,Yes,11/3/2021,"Rodriguez, Yaneisy",17420949,agent_override,,Effectuated,,,4152625447,8211951,Focused Silver,416.67,29418TX0140100,3046 County Road,,,TRUE,,,12/31/2022,Effectuated,2,19200,Spanish,,0,0,0,0,0,0,TRUE,,,2022-01-19 22:02:16 UTC,,,,,,,,Sergio,Vega,,,male,9/4/2017,FALSE,,,,,,,,,,,,,,,,,,,,,,,,,,,,,,,,,,,,,,,,,,,,,,,,,,,,,,,,,,,,,,,,Yes,https://www.healthsherpa.com/access/427998070480,6/16/2022 22:37,$0.00 ,
JESSENIA,CAMACHO Perez,,***-**-5495,female,11/14/1991,TRUE,1400 Banana Rd,lote 145,Lakeland,FL,33810,Hillsborough,FALSE,FALSE,FALSE,FALSE,4077010986,jessinaiil1422@gmail.com,Ambetter Balanced Care 32,share94,Silver,Ambetter from Sunshine Health,1/1/2022,402.21,396,6.21,0,1575,0,Yes,11/3/2021,"Rodriguez, Yaneisy",17420949,agent_override,,Cancelled,action_needed,,4143892311,13507026,Focused Silver,402.21,21663FL0130112,1400 Banana Rd,,,FALSE,,,12/31/2022,Cancelled,1,18000,Spanish,,1,0,0,0,0,0,TRUE,,,2021-11-03 23:02:46 UTC,,,,,,,,,,,,,,,,,,,,,,,,,,,,,,,,,,,,,,,,,,,,,,,,,,,,,,,,,,,,,,,,,,,,,,,,,,,,,,Yes,https://www.healthsherpa.com/access/587964818477,8/22/2022 18:04,$0.00 ,
PEDRO,HERNANDEZ,,***-**-7468,male,7/1/1957,TRUE,10640 Steppington Dr,Apt 1108,Dallas,TX,75230,Dallas,FALSE,FALSE,FALSE,FALSE,2147145857,pedro213fernandez@gmail.com,MyBlue Health Bronze℠ 402,share94,Expanded Bronze,Blue Cross and Blue Shield of Texas,1/1/2022,789.36,789.36,0,1,8700,7400,Yes,11/4/2021,"Rodriguez, Yaneisy",18141564,agent,,Effectuated,,,4137438887,9751370,MyBlue Health Bronze 402,789.36,33602TX0860002,10640 Steppington Dr,,,TRUE,11/4/2021,,12/31/2022,Effectuated,1,19000,Spanish,,0,0,0,0,0,0,TRUE,,,2021-11-04 16:12:16 UTC,,,,,,,,,,,,,,,,,,,,,,,,,,,,,,,,,,,,,,,,,,,,,,,,,,,,,,,,,,,,,,,,,,,,,,,,,,,,,,Yes,https://www.healthsherpa.com/access/79052663097,6/16/2022 16:53,$0.00 ,
MARIA,LAZCANO,,***-**-9402,female,9/16/1958,TRUE,3577 Chime Tower Pl,,El Paso,TX,79936-0679,El Paso,FALSE,FALSE,FALSE,FALSE,9153289414,maria@yti.com,Ambetter Balanced Care 32,share87,Silver,Ambetter from Superior HealthPlan,5/1/2022,1052.31,921,131.31,1,2900,0,Yes,11/4/2021,"Rodriguez, Yaneisy",17420949,agent_override,,,,,4138116265,4010914,Focused Silver,1052.31,29418TX0140100,3577 Chime Tower Pl,,,TRUE,,,12/31/2022,Effectuated,1,25500,Spanish,,0,0,0,0,0,0,FALSE,,,2021-11-04 21:53:07 UTC,,,,,,,,,,,,,,,,,,,,,,,,,,,,,,,,,,,,,,,,,,,,,,,,,,,,,,,,,,,,,,,,,,,,,,,,,,,,,,Yes,https://www.healthsherpa.com/access/138310639767,5/10/2022 20:28,$0.00 ,
Maria,Ramos,,***-**-5968,female,1/6/1959,TRUE,209 Main St,,Tuleta,TX,78162,Bee,FALSE,FALSE,FALSE,FALSE,3612543259,marichelobarrera@gmail.com,Blue Advantage Silver HMO℠ 205,share94,Silver,Blue Cross and Blue Shield of Texas,1/1/2022,1169.26,1169.26,0,1,900,0,Yes,11/4/2021,"Rodriguez, Yaneisy",18141564,agent,,Effectuated,,,4152887022,8517111,Blue Advantage Silver HMO℠ 205,1169.26,33602TX0460704,209 Main St,,,TRUE,11/4/2021,,12/31/2022,Effectuated,1,19000,Spanish,,0,0,0,0,0,0,TRUE,,,2021-11-04 22:53:37 UTC,,,,,,,,,,,,,,,,,,,,,,,,,,,,,,,,,,,,,,,,,,,,,,,,,,,,,,,,,,,,,,,,,,,,,,,,,,,,,,Yes,https://www.healthsherpa.com/access/482297259798,9/29/2022 17:29,$0.00 ,
Nancy,Viera Velazquez,,***-**-6646,female,8/29/1997,TRUE,5267 Road 5210,,Cleveland,TX,77327,Liberty,FALSE,FALSE,FALSE,FALSE,7138513039,nancyviera36@gmail.com,Ambetter Balanced Care 30,share94,Silver,Ambetter from Superior HealthPlan,1/1/2022,355.12,355.12,0,1,625,625,Yes,11/4/2021,"Rodriguez, Yaneisy",17420949,agent_override,,Effectuated,completed,,4146944088,9328773,Clear Silver,355.12,29418TX0140096,5267 Road 5210,,,TRUE,,,12/31/2022,Effectuated,3,24000,Spanish,,0,0,1,0,0,0,FALSE,,,2021-11-04 23:01:23 UTC,,,,,,,,Eric,Farinas Viera,,***-**-4016,male,3/30/2019,FALSE,Erica,Farinas Viera,,***-**-9725,female,3/30/2019,FALSE,,,,,,,,,,,,,,,,,,,,,,,,,,,,,,,,,,,,,,,,,,,,,,,,,,,,,,,,,Yes,https://www.healthsherpa.com/access/608539562637,6/16/2022 17:08,$0.00 ,
Yunisley,Gonzalez Roldan,,***-**-6629,female,3/29/1984,TRUE,934 Grand Junction Dr,,Katy,TX,77450-3805,Harris,FALSE,FALSE,FALSE,FALSE,7137266203,Yunisley.GonzalezRoldan@GMAIL.COM,Ambetter Value Silver 31,share94,Silver,Ambetter from Superior Health Plan,8/1/2022,1008.19,992,16.19,2,775,400,Yes,11/4/2021,"Borges, Mario",17420949,agent,,Effectuated,,,4124897654,8969067,Ambetter Value Silver 31,1008.19,87226TX0100008,934 Grand Junction Dr,,,TRUE,,,12/31/2022,Effectuated,4,30000,Spanish,,0,0,0,0,0,0,TRUE,,,2021-11-05 04:51:47 UTC,Mario,Juviel Alvarez,,***-**-4917,male,7/10/1968,TRUE,ana,duardo gonzalez,,,female,1/15/2002,FALSE,michael,juviel gonzalez,,,male,8/14/2017,FALSE,,,,,,,,,,,,,,,,,,,,,,,,,,,,,,,,,,,,,,,,,,,,,,,,,,,,,,,,,Yes,https://www.healthsherpa.com/access/131017214502,9/29/2022 21:13,$0.00 ,
OLGA,TERRAZAS,,***-**-7731,female,12/17/1967,TRUE,5310 Castle Cv,,San Antonio,TX,78242,Bexar,FALSE,FALSE,FALSE,FALSE,2104091779,olga.terrazas12@hotmail.com,Ambetter Value Silver 32,share94,Silver,Ambetter from Superior Health Plan,1/1/2022,699.16,667,32.16,1,1575,0,Yes,11/5/2021,"Borges, Mario",17420949,agent,,Effectuated,expired,,4140776402,9638121,Focused VALUE Silver,699.16,87226TX0080009,5310 Castle Cv,,,TRUE,1/28/2022,,12/31/2022,Effectuated,2,17000,Spanish,,0,1,3,0,0,0,TRUE,,,2021-11-05 16:49:23 UTC,,,,,,,,GEOVANY JESUS,MERAZ,,,male,9/7/2001,TRUE,,,,,,,,,,,,,,,,,,,,,,,,,,,,,,,,,,,,,,,,,,,,,,,,,,,,,,,,,,,,,,,,Yes,https://www.healthsherpa.com/access/519514648834,8/9/2022 21:23,$0.00 ,
David,Esquilin Corteguera,,***-**-4388,male,7/29/1977,TRUE,3512 Kathy Ct,,Lakeland,FL,33810,Polk,FALSE,FALSE,FALSE,FALSE,8632152864,davidesquilin37@gmail.com,Ambetter Essential Care: $0 Medical Deductible,share94,Expanded Bronze,Ambetter from Sunshine Health,1/1/2022,495.94,495.94,0,1,8700,0,Yes,11/5/2021,"Borges, Mario",17420949,agent,,Effectuated,,,4137933517,11183160,Elite Bronze,495.94,21663FL0130106,3512 Kathy Ct,,,TRUE,11/5/2021,,12/31/2022,Effectuated,1,18000,Spanish,,0,0,0,0,0,0,TRUE,,,2021-11-05 18:03:26 UTC,,,,,,,,,,,,,,,,,,,,,,,,,,,,,,,,,,,,,,,,,,,,,,,,,,,,,,,,,,,,,,,,,,,,,,,,,,,,,,Yes,https://www.healthsherpa.com/access/910321567093,6/16/2022 16:30,$0.00 ,
MARIA,PELALLO,,***-**-0631,female,12/30/1958,TRUE,657 W Dublin St,,Chandler,AZ,85225,Maricopa,FALSE,FALSE,FALSE,FALSE,6028208042,pelallomarialuz58@yahoo.com,Ambetter Balanced Care 32,share94,Silver,Ambetter,3/1/2022,919.97,784,135.97,1,1575,0,Yes,11/5/2021,"Borges, Mario",17420949,agent,,PendingEffectuation,completed,,4154581788,2871473,Focused Silver,919.97,91450AZ0080099,657 W Dublin St,,,FALSE,,,12/31/2022,PendingEffectuation,3,31000,Spanish,,0,0,1,0,0,0,TRUE,,,2022-02-02 17:36:57 UTC,,,,,,,,REBECA,GARIBAY,,,female,6/8/1979,FALSE,VANESSA,GARIBAY,,***-**-0580,female,7/18/1998,FALSE,,,,,,,,,,,,,,,,,,,,,,,,,,,,,,,,,,,,,,,,,,,,,,,,,,,,,,,,,Yes,https://www.healthsherpa.com/access/131883617242,6/16/2022 16:13,$0.00 ,
Miguel,Martinez,,***-**-5930,male,9/13/1985,TRUE,4946 County Road EE,,Hereford,TX,79045-7253,Deaf Smith,FALSE,FALSE,FALSE,FALSE,8063442776,miguelmartinezblue@gmail.com,Blue Advantage Silver HMO 205,share94,Silver,Blue Cross and Blue Shield of Texas,12/1/2021,1944.32,1850,94.32,6,900,0,Yes,11/5/2021,"Insurance, Yes to",18141564,agent_override,,Terminated,completed,,3971345728,9062048,Blue Advantage Silver HMO℠ 205,1944.32,33602TX0460704,4946 County Road EE,,,FALSE,,1/5/2022,12/31/2021,Terminated,6,40000,Spanish,,1,0,1,0,0,0,FALSE,,,2021-11-05 18:53:41 UTC,Petra,Martinez,,***-**-7492,female,2/28/1983,TRUE,Isabella,Martinez,,***-**-3908,female,11/3/2016,TRUE,Natalie,Martinez,,***-**-0732,female,8/28/2008,TRUE,David,Martinez,,***-**-6149,male,7/9/2009,TRUE,Joshua,Martinez,,,male,2/5/2003,TRUE,,,,,,,,,,,,,,,,,,,,,,,,,,,,,,,,,,,,,,,,,,,Yes,https://www.healthsherpa.com/access/814346281334,8/19/2022 16:29,$0.00 ,
Manuela,Cervantes Villalobos,,***-**-5290,female,10/8/1979,TRUE,153 Oak View Dr,,La Vernia,TX,78121,Wilson,FALSE,FALSE,FALSE,FALSE,2102026509,,Blue Advantage Plus Silver℠ 202,share94,Silver,Blue Cross and Blue Shield of Texas,1/1/2022,583.13,583.13,0,1,750,0,Yes,11/8/2021,"Rodriguez, Yaneisy",18141564,agent,,Effectuated,completed,,4145840916,8659796,Blue Advantage Plus Silver℠ 202,583.13,33602TX0770174,153 Oak View Dr,,,TRUE,11/8/2021,,12/31/2022,Effectuated,1,13008,Spanish,,0,0,1,0,0,0,TRUE,,,2021-11-08 17:15:11 UTC,,,,,,,,,,,,,,,,,,,,,,,,,,,,,,,,,,,,,,,,,,,,,,,,,,,,,,,,,,,,,,,,,,,,,,,,,,,,,,Yes,https://www.healthsherpa.com/access/93756719778,8/19/2022 16:40,$0.00 ,
Aleida,Espinoza,,,female,5/24/2002,TRUE,1057 Oak Ave,,Haines City,FL,33844,Polk,FALSE,FALSE,FALSE,FALSE,8634581488,gyanez0424@gmail.com,Ambetter Balanced Care 32,share94,Silver,Ambetter from Sunshine Health,2/1/2022,350.92,346,4.92,1,1575,0,Yes,11/8/2021,"Rodriguez, Yaneisy",17420949,agent_override,,Terminated,expired,,4186052350,11438121,Focused Silver,350.92,21663FL0130112,1057 Oak Ave,,,FALSE,,5/9/2022,2/28/2022,Terminated,1,17000,Spanish,,0,1,1,0,0,0,FALSE,,,2022-01-19 23:16:54 UTC,,,,,,,,,,,,,,,,,,,,,,,,,,,,,,,,,,,,,,,,,,,,,,,,,,,,,,,,,,,,,,,,,,,,,,,,,,,,,,Yes,https://www.healthsherpa.com/access/80066857613,8/19/2022 15:08,$0.00 ,
LEIDIS,LASTRE,,***-**-1291,female,5/16/1974,TRUE,10762 n kendall dr,I9,Miami,FL,33176,Miami-Dade,FALSE,FALSE,FALSE,FALSE,3056844562,Leidislastre45@icloud.com,Ambetter Select Silver 32,share94,Silver,Ambetter from Sunshine Health,8/1/2022,621.29,574,47.29,1,1575,0,Yes,11/9/2021,"Rodriguez, Yaneisy",17420949,agent_override,,Effectuated,expired,,4152015580,13780320,Focused SELECT Silver with Select Providers,621.29,86382FL0040009,10762 n kendall dr,,,TRUE,,,12/31/2022,Effectuated,1,13008,Spanish,,1,0,0,0,0,0,TRUE,,,2021-11-09 17:58:54 UTC,,,,,,,,CARLOS JESUS,LASTRE,,,male,11/27/2001,FALSE,,,,,,,,,,,,,,,,,,,,,,,,,,,,,,,,,,,,,,,,,,,,,,,,,,,,,,,,,,,,,,,,Yes,https://www.healthsherpa.com/access/19626071128,8/19/2022 17:05,$0.00 ,
Enmanuel,Bacallao,,***-**-7238,male,2/15/1996,TRUE,815 Walden Pond Dr,,Jackson,MS,39208,Rankin,FALSE,FALSE,FALSE,FALSE,6018504498,emmanuelbacallaosilvia@yahoo.com,Ambetter Balanced Care 32 with Walgreens,none,Silver,Ambetter from Magnolia Health,1/1/2022,359.57,349,10.57,1,8700,8100,Yes,11/9/2021,"Rodriguez, Yaneisy",17420949,agent_override,,Cancelled,expired,,4145474311,2350568,Focused Silver with Walgreens,359.57,90714MS0010059,815 Walden Pond Dr,,,FALSE,,,12/31/2022,Cancelled,1,16000,Spanish,,0,1,0,0,0,0,FALSE,,,2021-11-09 17:04:20 UTC,,,,,,,,,,,,,,,,,,,,,,,,,,,,,,,,,,,,,,,,,,,,,,,,,,,,,,,,,,,,,,,,,,,,,,,,,,,,,,Yes,https://www.healthsherpa.com/access/413236372116,11/17/2022 17:04,$0.00 ,
Phillip,James,,***-**-8414,male,1/11/1964,TRUE,1121 NE 211th Ter,,Miami,FL,33179,Miami-Dade,FALSE,FALSE,FALSE,FALSE,3055888211,pjiinc@bellsouth.net,Ambetter Value Silver 11,share87,Silver,Ambetter from Sunshine Health,1/1/2022,921.28,814,107.28,1,2900,0,Yes,11/9/2021,"Khouri, Violeta",17420949,agent_override,,Effectuated,,,4146517013,13308624,Complete VALUE Silver,921.28,86382FL0050006,1121 NE 211th Ter,,,TRUE,2/13/2022,,12/31/2022,Effectuated,1,25500,English,,0,0,0,0,0,0,TRUE,,,2021-11-09 17:12:26 UTC,,,,,,,,,,,,,,,,,,,,,,,,,,,,,,,,,,,,,,,,,,,,,,,,,,,,,,,,,,,,,,,,,,,,,,,,,,,,,,Yes,https://www.healthsherpa.com/access/348496358181,8/18/2022 18:52,$0.00 ,
Osiris,Verde,,***-**-7379,female,4/24/1966,TRUE,10401 NW 30th Ave,,Miami,FL,33147,Miami-Dade,FALSE,FALSE,FALSE,FALSE,3053167228,yasmanychirino@yahoo.com,Ambetter Value Silver 32,share94,Silver,Ambetter from Sunshine Health,1/1/2022,803.56,782,21.56,1,1575,0,Yes,11/9/2021,"Borges, Mario",17420949,agent,,Effectuated,completed,,4130554524,13628776,Focused VALUE Silver,803.56,86382FL0050009,10401 NW 30th Ave,,,TRUE,2/3/2022,,12/31/2022,Effectuated,2,17500,Spanish,,0,0,1,0,0,0,TRUE,,,2021-11-09 22:14:12 UTC,,,,,,,,Erika,Chirino,,,female,12/24/2005,FALSE,,,,,,,,,,,,,,,,,,,,,,,,,,,,,,,,,,,,,,,,,,,,,,,,,,,,,,,,,,,,,,,,Yes,https://www.healthsherpa.com/access/900692536240,11/17/2022 20:31,$0.00 ,
Jose,Romero,,,male,8/19/1950,TRUE,367 Pine Loop,Trailer 367,Frostproof,FL,33843,Polk,FALSE,FALSE,FALSE,FALSE,8635282596,,Ambetter Essential Care: $0 Medical Deductible,none,Expanded Bronze,Ambetter from Sunshine Health,6/1/2022,1065.01,1065.01,0,0,8700,0,Yes,11/9/2021,"Borges, Mario",17420949,agent,,Effectuated,expired,,4189844978,12979443,Elite Bronze,1065.01,21663FL0130106,367 Pine Loop,,,TRUE,,,9/30/2022,Effectuated,2,27001,Spanish,,0,4,0,0,0,0,TRUE,,,2022-02-01 17:20:57 UTC,Soly,Romero,,,female,3/6/1959,TRUE,,,,,,,,,,,,,,,,,,,,,,,,,,,,,,,,,,,,,,,,,,,,,,,,,,,,,,,,,,,,,,,,,,,,,,,Yes,https://www.healthsherpa.com/access/750401042961,9/20/2022 17:40,$0.00 ,
Jassel,Rivas,,,female,3/6/1984,TRUE,13521 Aldine Westfield Rd,,Houston,TX,79763,Ector,FALSE,FALSE,FALSE,FALSE,7864819217,Mrrivas1984@yahoo.com,Blue Advantage Gold HMO℠ 206,share94,Gold,Blue Cross and Blue Shield of Texas,1/1/2022,447.29,447.29,0,1,8700,750,Yes,11/10/2021,"Rodriguez, Yaneisy",17420949,agent_override,,Effectuated,expired,,4192879913,8966009,Blue Advantage Gold HMO℠ 206,447.29,33602TX0460570,13521 Aldine Westfield Rd,,,TRUE,2/7/2022,,12/31/2022,Effectuated,1,13020,Spanish,,0,1,0,0,0,0,TRUE,,,2022-02-07 18:55:10 UTC,,,,,,,,,,,,,,,,,,,,,,,,,,,,,,,,,,,,,,,,,,,,,,,,,,,,,,,,,,,,,,,,,,,,,,,,,,,,,,Yes,https://www.healthsherpa.com/access/471729004690,8/22/2022 21:08,$0.00 ,
Aurora,Guevara,,,female,10/15/1977,TRUE,6017 Pecan Cir,,Alvarado,TX,76009,Johnson,FALSE,FALSE,FALSE,FALSE,2144784609,aurora.guevara@yahoo.com,Blue Advantage Bronze HMO℠ 204,none,Expanded Bronze,Blue Cross and Blue Shield of Texas,1/1/2022,467.93,467.93,0,0,8700,6000,Yes,11/10/2021,"Rodriguez, Yaneisy",17420949,agent_override,,Terminated,expired,,4192575038,9100945,Blue Advantage Bronze HMO℠ 204,467.93,33602TX0460711,6017 Pecan Cir,,,FALSE,2/7/2022,8/19/2022,6/30/2022,Terminated,5,53016,Spanish,,0,2,0,0,0,0,TRUE,,,2022-02-07 20:58:47 UTC,Jorge,Guevara,,,male,2/16/1980,FALSE,Angel,Guevara,,,male,3/23/2015,FALSE,Jorge,Guevara,,,male,7/28/2004,FALSE,Kipzia,Guevara,,,female,4/24/2002,FALSE,,,,,,,,,,,,,,,,,,,,,,,,,,,,,,,,,,,,,,,,,,,,,,,,,,Yes,https://www.healthsherpa.com/access/100413956844,8/19/2022 17:16,$0.00 ,
Marcial,Gutierrez,,***-**-6195,male,6/9/1966,TRUE,1305 N Washington Ave,,Karnes City,TX,78118,Karnes,FALSE,FALSE,FALSE,FALSE,5129951194,GutierrezMarcial@gmail.com,Blue Advantage Gold HMO℠ 206,none,Gold,Blue Cross and Blue Shield of Texas,3/1/2022,855.11,855.11,0,0,8700,750,Yes,11/11/2021,"Rodriguez, Yaneisy",18141564,agent,,Terminated,expired,,4194801532,9082610,Blue Advantage Gold HMO℠ 206,855.11,33602TX0460579,1305 N Washington Ave,,,FALSE,3/2/2022,6/16/2022,5/31/2022,Terminated,1,25000,Spanish,,0,2,0,0,0,0,TRUE,,,2021-11-11 22:07:00 UTC,,,,,,,,,,,,,,,,,,,,,,,,,,,,,,,,,,,,,,,,,,,,,,,,,,,,,,,,,,,,,,,,,,,,,,,,,,,,,,Yes,https://www.healthsherpa.com/access/739857030751,11/30/2022 0:17,$0.00 ,
Jose,Hernandez,,***-**-9007,male,9/1/1994,TRUE,6126 Darlinghurst Dr,,Houston,TX,77085,Harris,FALSE,FALSE,FALSE,FALSE,8327553466,jhernandez9401@gmail.com,Ambetter Balanced Care 32,none,Silver,Ambetter from Superior HealthPlan,6/1/2022,384.73,235,149.73,2,8700,8100,Yes,11/11/2021,"Borges, Mario",17420949,agent,,Terminated,completed,,4195004497,11494102,Focused Silver,384.73,29418TX0140100,6126 Darlinghurst Dr,,,FALSE,,,12/31/2022,Cancelled,3,40000,Spanish,,0,0,2,0,0,0,TRUE,,,2021-11-11 22:54:56 UTC,,,,,,,,,,,,,,,,,,,,,,,,,,,,,,,,,,,,,,,,,,,,,,,,,,,,,,,,,,,,,,,,,,,,,,,,,,,,,,Yes,https://www.healthsherpa.com/access/71519468455,11/25/2022 20:37,$0.00 ,
Rufino,Osorio,,***-**-8452,male,4/7/1963,TRUE,3201 Rifle Range Rd,,Wahneta,FL,33880,Polk,FALSE,FALSE,FALSE,FALSE,8635957422,rufinoosorio496@gmail.com,Ambetter Balanced Care 32,share94,Silver,Ambetter from Sunshine Health,1/1/2022,1781.83,1753,28.83,2,1575,0,Yes,11/12/2021,"Borges, Mario",17420949,agent,,Effectuated,completed,,4138816190,8889311,Focused Silver,1781.83,21663FL0130112,3201 Rifle Range Rd,,,TRUE,11/12/2021,,12/31/2022,Effectuated,2,25000,Spanish,,0,0,1,0,0,0,TRUE,,,2021-11-12 18:05:27 UTC,Alicia,Jaimes Hernandez,,,female,9/10/1966,TRUE,,,,,,,,,,,,,,,,,,,,,,,,,,,,,,,,,,,,,,,,,,,,,,,,,,,,,,,,,,,,,,,,,,,,,,,Yes,https://www.healthsherpa.com/access/861809869661,6/16/2022 16:50,$0.00 ,
Radames,Adorno,,***-**-6935,male,12/14/1963,TRUE,19 Leaner St,,Sebring,FL,33870,Highlands,FALSE,FALSE,FALSE,FALSE,8637349936,radamesadorno@care305.co,Ambetter Essential Care: $0 Medical Deductible,none,Expanded Bronze,Ambetter from Sunshine Health,9/1/2022,907.6,0,907.6,1,8700,0,Yes,11/12/2021,"Borges, Mario",17420949,agent,,Effectuated,expired,,4132335218,11905268,Elite Bronze,907.6,21663FL0130106,19 Leaner St,,,TRUE,,,12/31/2022,Effectuated,1,13020,Spanish,,0,1,0,0,0,0,FALSE,,,2022-02-07 22:39:17 UTC,,,,,,,,,,,,,,,,,,,,,,,,,,,,,,,,,,,,,,,,,,,,,,,,,,,,,,,,,,,,,,,,,,,,,,,,,,,,,,Yes,https://www.healthsherpa.com/access/792765368017,9/27/2022 16:26,$0.00 ,
RIGOBERTO,LUIS,,***-**-7745,male,6/6/1976,TRUE,121 Red Pine Dr,,Sebring,FL,33872-3331,Highlands,FALSE,FALSE,FALSE,FALSE,8632123282,rll06061976@outlook.com,Ambetter Balanced Care 32,share94,Silver,Ambetter from Sunshine Health,1/1/2022,1555.85,1531,24.85,2,1575,0,Yes,11/12/2021,"Borges, Mario",17420949,agent,,Effectuated,completed,,4150141350,11914492,Focused Silver,1555.85,21663FL0130112,121 Red Pine Dr,,,TRUE,,,12/31/2022,Effectuated,2,18000,Spanish,,0,0,1,0,0,0,TRUE,,,2021-11-12 20:24:36 UTC,JULIE,LUIS,,***-**-9542,female,1/11/1961,TRUE,,,,,,,,,,,,,,,,,,,,,,,,,,,,,,,,,,,,,,,,,,,,,,,,,,,,,,,,,,,,,,,,,,,,,,,Yes,https://www.healthsherpa.com/access/125303702266,6/16/2022 16:33,$0.00 ,
Angel,Luna,,***-**-2709,male,1/3/1990,TRUE,20923 Southvine Ct,,Houston,TX,77073,Harris,FALSE,FALSE,FALSE,FALSE,2815135497,luisluna200069@gmail.com,MyBlue Health Bronze℠ 402,share94,Expanded Bronze,Blue Cross and Blue Shield of Texas,7/1/2022,292.74,292.74,0,1,8700,7400,Yes,11/12/2021,"Rodriguez, Yaneisy",17420949,agent_override,,Effectuated,,,4149889321,11169747,MyBlue Health Bronze 402,292.74,33602TX0860005,20923 Southvine Ct,,,TRUE,,,12/31/2022,Effectuated,1,13008,Spanish,,0,0,0,0,0,0,FALSE,,,2021-11-12 20:53:38 UTC,,,,,,,,,,,,,,,,,,,,,,,,,,,,,,,,,,,,,,,,,,,,,,,,,,,,,,,,,,,,,,,,,,,,,,,,,,,,,,Yes,https://www.healthsherpa.com/access/58730002445,8/17/2022 19:41,$0.00 ,
Jesus,Alvarado,,***-**-0643,male,7/21/1998,TRUE,4022 Avalon Pl,,Flowery Branch,GA,30542-2979,Hall,FALSE,FALSE,FALSE,FALSE,6789104337,roti5o@yahoo.com,Anthem Silver Pathway X HMO 3000 S05,share87,Silver,Blue Cross Blue Shield Healthcare Plan of Georgia,1/1/2022,320.11,232,88.11,1,2500,525,Yes,11/12/2021,"Rodriguez, Yaneisy",17420949,agent_override,,Effectuated,,,4139074077,2083538,Anthem Silver Pathway X HMO 3000($0 Virtual PCP+$0 Select Drugs),320.11,49046GA0410023,4022 Avalon Pl,,,TRUE,1/6/2022,,12/31/2022,Effectuated,3,38000,Spanish,,0,0,0,0,0,0,FALSE,,,2021-11-12 21:30:09 UTC,,,,,,,,Amy,Alvarado,,,female,3/13/2007,FALSE,Owen,Alvarado,,,male,10/2/2011,FALSE,,,,,,,,,,,,,,,,,,,,,,,,,,,,,,,,,,,,,,,,,,,,,,,,,,,,,,,,,Yes,https://www.healthsherpa.com/access/244605366555,8/22/2022 22:26,$0.00 ,
Maria,Chavez Salazar,,***-**-9427,female,8/13/1974,TRUE,7506 Stafford Rd,Lote 9,Charleston,SC,29406,Charleston,FALSE,FALSE,FALSE,FALSE,8435687045,chavezmaria084@gmail.com,Ambetter Balanced Care 30,,Silver,Ambetter from Absolute Total Care,1/1/2022,459.84,459.84,0,0,,,Yes,11/13/2021,"Borges, Mario",17420949,agent,,Terminated,expired,,4197988838,2971950,Clear Silver,459.84,79222SC0010023,7506 Stafford Rd,,,FALSE,12/30/2021,5/9/2022,4/30/2022,Terminated,2,18000,Spanish,,0,1,0,0,0,0,FALSE,,,2021-12-23 15:41:33 UTC,,,,,,,,Elisa,Avila,,,female,2/28/2005,FALSE,ELIZA,AVILA,,,female,2/28/2005,FALSE,,,,,,,,,,,,,,,,,,,,,,,,,,,,,,,,,,,,,,,,,,,,,,,,,,,,,,,,,Yes,https://www.healthsherpa.com/access/64321030281,6/16/2022 16:33,$0.00 ,
Antuan,Hernandez,,,male,1/12/1982,TRUE,2980 NW 26th St,2980,Miami,FL,33142-6466,Miami-Dade,FALSE,FALSE,FALSE,FALSE,3053010771,antuanclementehernandez@gmail.com,Ambetter Value Silver 11,,Silver,Ambetter from Sunshine Health,1/1/2022,477.09,443,34.09,1,,,Yes,11/15/2021,"Borges, Mario",17420949,agent,,Cancelled,expired,,4198913527,13532199,Complete VALUE Silver,477.09,86382FL0050006,2980 NW 26th St,,,FALSE,,12/23/2021,12/31/2022,Cancelled,1,15000,Spanish,,0,1,1,0,0,0,FALSE,,,2021-11-15 14:51:18 UTC,,,,,,,,,,,,,,,,,,,,,,,,,,,,,,,,,,,,,,,,,,,,,,,,,,,,,,,,,,,,,,,,,,,,,,,,,,,,,,Yes,https://www.healthsherpa.com/access/438690836674,8/18/2022 16:06,$0.00 ,
VICTOR,SALAZAR,,***-**-6864,male,3/6/1959,TRUE,16015 1st St,,Channelview,TX,77530-4331,Harris,FALSE,FALSE,FALSE,FALSE,7135625354,tuasesorsalud2019@gmail.com,MyBlue Health Bronze℠ 402,share87,Expanded Bronze,Blue Cross and Blue Shield of Texas,5/1/2022,977.95,977.95,0,2,8700,7400,Yes,11/15/2021,"Borges, Mario",17420949,agent,,Effectuated,completed,,4125256386,11316907,MyBlue Health Bronze 402,977.95,33602TX0860005,16015 1st St,,,TRUE,,,12/31/2022,Effectuated,3,33000,Spanish,,0,0,1,0,0,0,FALSE,,,2022-02-03 21:30:13 UTC,Carolina,Salazar,,,female,11/5/1965,FALSE,Martin,Salazar,,***-**-2431,male,12/30/2000,TRUE,,,,,,,,,,,,,,,,,,,,,,,,,,,,,,,,,,,,,,,,,,,,,,,,,,,,,,,,,,,,,,,,Yes,https://www.healthsherpa.com/access/831718587053,6/16/2022 16:05,$0.00 ,
Jose,Ramirez,,***-**-0657,male,9/2/1972,TRUE,2207 NW 59th Ave,,Lauderhill,FL,33313,Broward,FALSE,FALSE,FALSE,FALSE,9543471262,JOSERAMIREZ7725@GMAIL.COM,"Ambetter Select Bronze: $1,500 Medical Deductible",share94,Expanded Bronze,Ambetter from Sunshine Health,6/1/2022,534.36,534.36,0,1,8700,1500,Yes,11/15/2021,"Rodriguez, Yaneisy",18141564,agent,,Effectuated,completed,,4151237158,15157343,"Ambetter Select Bronze: $1,500 Medical Deductible",534.36,86382FL0040004,2207 NW 59th Ave,,,TRUE,,,12/31/2022,Effectuated,1,15000,Spanish,,0,0,1,0,0,0,FALSE,,,2021-11-15 15:34:25 UTC,,,,,,,,,,,,,,,,,,,,,,,,,,,,,,,,,,,,,,,,,,,,,,,,,,,,,,,,,,,,,,,,,,,,,,,,,,,,,,Yes,https://www.healthsherpa.com/access/765841929083,9/27/2022 17:42,$0.00 ,
Gustavo,Hernandez,,***-**-7924,male,10/6/1968,TRUE,100 Pecan Cir,,Trenton,TX,75490,Fannin,FALSE,FALSE,FALSE,FALSE,9728041829,,Blue Advantage Silver HMO℠ 205,share94,Silver,Blue Cross and Blue Shield of Texas,1/1/2022,830.24,830.24,0,1,900,0,Yes,11/22/2021,"Rodriguez, Yaneisy",17420949,agent_override,,Effectuated,action_needed,,4200299022,8577625,Blue Advantage Silver HMO℠ 205,830.24,33602TX0460704,100 Pecan Cir,,,TRUE,8/1/2022,,12/31/2022,Effectuated,2,22022.4,Spanish,,2,0,0,0,0,0,TRUE,,,2022-08-01 17:05:03 UTC,,,,,,,,Angel,Hernandez,,***-**-7711,male,6/24/2004,FALSE,,,,,,,,,,,,,,,,,,,,,,,,,,,,,,,,,,,,,,,,,,,,,,,,,,,,,,,,,,,,,,,,Yes,https://www.healthsherpa.com/access/163325908947,9/26/2022 21:12,$0.00 ,
Any,Medina Hernandez,,***-**-4480,female,2/14/1974,TRUE,126 SW 5th Ct,,Dania Beach,FL,33004-3513,Broward,FALSE,FALSE,FALSE,FALSE,3059634926,,Ambetter Select Silver 11,share87,Silver,Ambetter from Sunshine Health,2/15/2022,938.84,837,101.84,2,2900,0,Yes,11/15/2021,"Borges, Mario",17420949,agent,,Effectuated,completed,,4142276287,13710259,Complete SELECT Silver with Select Providers,938.84,86382FL0040006,126 SW 5th Ct,,,TRUE,,,12/31/2022,Effectuated,3,34900,Spanish,,0,0,2,0,0,0,TRUE,,,2021-11-15 16:36:20 UTC,Julio,Miranda,,,male,12/17/1936,FALSE,Melvin,Medina,,***-**-8657,male,2/16/2000,TRUE,,,,,,,,,,,,,,,,,,,,,,,,,,,,,,,,,,,,,,,,,,,,,,,,,,,,,,,,,,,,,,,,Yes,https://www.healthsherpa.com/access/406793737745,6/16/2022 16:16,$0.00 ,
Ian,Carrasco,,***-**-8821,male,4/5/1998,TRUE,915 W 26th St,,Odessa,TX,79763,Ector,FALSE,FALSE,FALSE,FALSE,4322026347,iancarrasco98@gmail.com,Blue Advantage Silver HMO℠ 205,share94,Silver,Blue Cross and Blue Shield of Texas,1/1/2022,379.95,362,17.95,1,900,0,Yes,11/15/2021,"Rodriguez, Yaneisy",17420949,agent_override,,Terminated,,,4139975576,2754133,Blue Advantage Silver HMO℠ 205,379.95,33602TX0460695,915 W 26th St,,,FALSE,12/22/2021,5/9/2022,2/28/2022,Terminated,1,13000,Spanish,,0,0,0,0,0,0,TRUE,,,2021-12-22 19:14:10 UTC,,,,,,,,,,,,,,,,,,,,,,,,,,,,,,,,,,,,,,,,,,,,,,,,,,,,,,,,,,,,,,,,,,,,,,,,,,,,,,Yes,https://www.healthsherpa.com/access/845246171331,6/16/2022 17:06,$0.00 ,
Irving,Carrasco Juarez,,***-**-3213,male,7/8/1988,TRUE,511 Alpines,,Presidio,TX,79845,Presidio,PO Box 882,Presidio,TX,79845,4322084174,jimycs@live.com.mx,Blue Advantage Silver HMO℠ 205,share94,Silver,Blue Cross and Blue Shield of Texas,6/1/2022,487.56,0,487.56,1,900,0,Yes,11/15/2021,"Rodriguez, Yaneisy",18141564,agent,,Terminated,expired,,4200927107,8820073,Blue Advantage Silver HMO℠ 205,487.56,33602TX0460704,511 Alpines,,,FALSE,,,12/31/2022,Unknown,1,13008,Spanish,,0,1,0,0,0,0,TRUE,,,2021-11-15 22:20:56 UTC,,,,,,,,,,,,,,,,,,,,,,,,,,,,,,,,,,,,,,,,,,,,,,,,,,,,,,,,,,,,,,,,,,,,,,,,,,,,,,Yes,https://www.healthsherpa.com/access/556990023126,8/30/2022 21:09,$0.00 ,
ERIC,VILLA ESPINOZA,,***-**-1831,male,2/3/1989,TRUE,511 Alpines St,,Presidio,TX,79845,Presidio,PO Box 882,Presidio,TX,79845-0882,4322084174,jimycs@live.com.mx,Blue Advantage Silver HMO℠ 205,share94,Silver,Blue Cross and Blue Shield of Texas,2/11/2022,481.46,481.46,0,1,900,0,Yes,11/15/2021,"Rodriguez, Yaneisy",17420949,agent_override,,Effectuated,action_needed,,4131782431,8903881,Blue Advantage Silver HMO℠ 205,481.46,33602TX0460704,511 Alpines St,,,TRUE,2/11/2022,,12/31/2022,Effectuated,1,13050,Spanish,,1,0,0,0,0,0,TRUE,,,2022-02-11 18:05:10 UTC,,,,,,,,,,,,,,,,,,,,,,,,,,,,,,,,,,,,,,,,,,,,,,,,,,,,,,,,,,,,,,,,,,,,,,,,,,,,,,Yes,https://www.healthsherpa.com/access/524446417050,7/15/2022 20:02,$0.00 ,
Jose,Juarez,,***-**-6291,male,6/26/1991,TRUE,511 Alpines St,,Presidio,TX,79845,Presidio,PO Box 514,Presidio,TX,79845-0514,4322084174,jimycs@live.com.mx,Blue Advantage Silver HMO℠ 205,share94,Silver,Blue Cross and Blue Shield of Texas,1/1/2022,,461.92,0,1,900,0,No,,"Rodriguez, Yaneisy",17420949,agent_override,,Effectuated,action_needed,,4146609853,8335624,Blue Advantage Silver HMO℠ 205,,33602TX0460704,511 Alpines St,,,TRUE,7/15/2022,,12/31/2022,Effectuated,1,15000.1,Spanish,,1,0,0,0,0,0,TRUE,,,2022-07-15 20:05:02 UTC,,,,,,,,,,,,,,,,,,,,,,,,,,,,,,,,,,,,,,,,,,,,,,,,,,,,,,,,,,,,,,,,,,,,,,,,,,,,,,No,https://www.healthsherpa.com/access/212750307136,9/20/2022 16:26,$0.00 ,
David,Armendares,,***-**-5299,male,7/28/1991,TRUE,511 Alpines St,,Presidio,TX,79845,Presidio,PO Box 514,Presidio,TX,79845-0514,4322084174,,Blue Advantage Silver HMO℠ 205,share94,Silver,Blue Cross and Blue Shield of Texas,1/1/2022,461.92,461.92,0,1,900,0,Yes,11/15/2021,"Rodriguez, Yaneisy",18141564,agent,,Effectuated,expired,,4200708018,10151478,Blue Advantage Silver HMO℠ 205,461.92,33602TX0460704,511 Alpines St,,,TRUE,12/22/2021,,12/31/2022,Effectuated,1,14001,Spanish,,0,1,1,0,0,0,FALSE,,,2021-11-15 22:49:14 UTC,,,,,,,,,,,,,,,,,,,,,,,,,,,,,,,,,,,,,,,,,,,,,,,,,,,,,,,,,,,,,,,,,,,,,,,,,,,,,,Yes,https://www.healthsherpa.com/access/297997024749,6/16/2022 16:42,$0.00 ,
Jose,Botello,,***-**-7299,male,9/17/1979,TRUE,2817 3rd St W,,Lehigh Acres,FL,33971,Lee,FALSE,FALSE,FALSE,FALSE,2392402282,jabotello79@gmail.com,Ambetter Essential Care: $0 Medical Deductible,none,Expanded Bronze,Ambetter from Sunshine Health,6/1/2022,560.55,396,164.55,1,8700,0,Yes,11/15/2021,"Borges, Mario",17420949,agent,,PendingEffectuation,completed,,4201697762,13264023,Elite Bronze,560.55,21663FL0130106,2817 3rd St W,,,FALSE,,,12/31/2022,PendingEffectuation,2,45000,Spanish,,1,0,2,0,0,0,TRUE,,,2021-12-23 17:05:25 UTC,,,,,,,,Sylir,Botello,,,male,10/23/2011,FALSE,,,,,,,,,,,,,,,,,,,,,,,,,,,,,,,,,,,,,,,,,,,,,,,,,,,,,,,,,,,,,,,,Yes,https://www.healthsherpa.com/access/515677530304,6/16/2022 16:55,$0.00 ,
Victoria,Morales,,***-**-1328,female,5/6/1999,TRUE,150 Alameda Ave,,Fort Myers,FL,33905-2639,Lee,FALSE,FALSE,FALSE,FALSE,2398519635,SELENAMORALES@GMAIL.COM,"Ambetter Essential Care: $1,500 Medical Deductible",share94,Expanded Bronze,Ambetter from Sunshine Health,5/1/2022,398.73,398.73,0,1,8700,1500,Yes,11/16/2021,"Rodriguez, Yaneisy",18141564,agent,,Effectuated,,,4202641695,15012138,"Ambetter Essential Care: $1,500 Medical Deductible",398.73,21663FL0130104,150 Alameda Ave,,,TRUE,,,12/31/2022,Effectuated,1,14000,Spanish,,0,0,0,0,0,0,FALSE,,,2021-11-16 16:05:03 UTC,,,,,,,,,,,,,,,,,,,,,,,,,,,,,,,,,,,,,,,,,,,,,,,,,,,,,,,,,,,,,,,,,,,,,,,,,,,,,,Yes,https://www.healthsherpa.com/access/12166446871,8/18/2022 17:00,$0.00 ,
Glenda,Torres,,***-**-7328,female,4/10/1982,TRUE,1624 Perdido Ct,,Kissimmee,FL,34759,Polk,FALSE,FALSE,FALSE,FALSE,4076555928,gltorres0410@gmail.com,Ambetter Balanced Care 32,share87,Silver,Ambetter from Sunshine Health,4/1/2022,470.63,441,29.63,1,2900,0,Yes,11/17/2021,"Borges, Mario",17420949,agent,,Effectuated,,,4133186634,9923976,Focused Silver,470.63,21663FL0130112,1624 Perdido Ct,,,TRUE,3/8/2022,,12/31/2022,Effectuated,2,30000,Spanish,,0,0,0,0,0,0,TRUE,,,2022-03-08 19:39:19 UTC,,,,,,,,Anibal,Torres,,,male,10/27/1961,FALSE,,,,,,,,,,,,,,,,,,,,,,,,,,,,,,,,,,,,,,,,,,,,,,,,,,,,,,,,,,,,,,,,Yes,https://www.healthsherpa.com/access/15634541801,11/18/2022 22:18,$0.00 ,
ALDO,RIVAS ESPINOSA,,***-**-8215,male,11/3/1967,TRUE,703 S 78th St,,Tampa,FL,33619-4228,Hillsborough,FALSE,FALSE,FALSE,FALSE,8134472828,mirnarivas1997@gmail.com,Ambetter Balanced Care 32,share73,Silver,Ambetter from Sunshine Health,4/1/2022,756.57,649,107.57,1,6000,5100,Yes,11/17/2021,"Borges, Mario",17420949,agent,,Effectuated,action_needed,,4133469387,5345862,Focused Silver,756.57,21663FL0130112,703 S 78th St,,,TRUE,,,12/31/2022,Effectuated,1,32000,Spanish,,1,0,0,0,0,0,FALSE,,,2022-01-11 21:19:37 UTC,MIRNA,RIVAS SALINAS,,***-**-8219,female,5/30/1971,TRUE,,,,,,,,,,,,,,,,,,,,,,,,,,,,,,,,,,,,,,,,,,,,,,,,,,,,,,,,,,,,,,,,,,,,,,,Yes,https://www.healthsherpa.com/access/243573945594,11/8/2022 22:12,$0.00 ,
Karly,Chirinos Ortiz,,,female,11/6/2002,TRUE,2055 Mount Zion Rd,,Carrollton,GA,30117-7565,Carroll,FALSE,FALSE,FALSE,FALSE,5164239073,danielachirino@icloud.com,Anthem Bronze Pathway X HMO 5000,share87,Expanded Bronze,Blue Cross Blue Shield Healthcare Plan of Georgia,1/1/2022,266.52,266.52,0,1,8700,5000,Yes,11/18/2021,"Rodriguez, Yaneisy",,agent_healthsherpa_referral,,Effectuated,expired,,4207593714,4729410,Anthem Bronze Pathway X HMO 5000($0 Virtual PCP+$0 Select Drugs),266.52,49046GA0410114,2055 Mount Zion Rd,,,TRUE,2/14/2022,,12/31/2022,Effectuated,1,25001,Spanish,,0,1,0,0,0,0,FALSE,,,2022-02-14 17:37:21 UTC,,,,,,,,,,,,,,,,,,,,,,,,,,,,,,,,,,,,,,,,,,,,,,,,,,,,,,,,,,,,,,,,,,,,,,,,,,,,,,Yes,https://www.healthsherpa.com/access/969252127630,6/17/2022 20:23,$0.00 ,$50.00 
Luis,Enriquez,,,male,11/18/1977,TRUE,3220 W Illinois Ave,,Midland,TX,79701-6230,Midland,FALSE,FALSE,FALSE,FALSE,8324280506,lael111877@gmail.com,Blue Advantage Silver HMO℠ 205,share94,Silver,Blue Cross and Blue Shield of Texas,1/1/2022,504.14,504.14,0,0,900,0,Yes,11/18/2021,"Borges, Mario",18141564,agent_override,,Cancelled,expired,,4131074226,9637494,Blue Advantage Silver HMO℠ 205,504.14,33602TX0460694,3220 W Illinois Ave,,,FALSE,11/18/2021,1/27/2022,12/31/2022,Cancelled,1,19008,Spanish,,0,2,0,0,0,0,FALSE,,,2021-11-18 19:14:59 UTC,,,,,,,,,,,,,,,,,,,,,,,,,,,,,,,,,,,,,,,,,,,,,,,,,,,,,,,,,,,,,,,,,,,,,,,,,,,,,,Yes,https://www.healthsherpa.com/access/894064687028,9/29/2022 21:04,$0.00 ,
Miguel,Cruz,,***-**-9126,male,8/18/1984,TRUE,1380 N Battlebell Rd,,Highlands,TX,77562,Harris,FALSE,FALSE,FALSE,FALSE,8322985561,miguelmarincruz@yahoo.com,Ambetter Value Silver 32,share94,Silver,Ambetter from Superior Health Plan,1/1/2022,393.08,364,29.08,1,1575,0,Yes,11/18/2021,"Borges, Mario",17420949,agent,,Effectuated,completed,,4208285145,10075756,Focused VALUE Silver,393.08,87226TX0100009,1380 N Battlebell Rd,,,TRUE,2/14/2022,,12/31/2022,Effectuated,1,15001,English,,0,0,2,0,0,0,TRUE,,,2022-02-14 18:23:40 UTC,,,,,,,,,,,,,,,,,,,,,,,,,,,,,,,,,,,,,,,,,,,,,,,,,,,,,,,,,,,,,,,,,,,,,,,,,,,,,,Yes,https://www.healthsherpa.com/access/462937662767,8/22/2022 19:11,$0.00 ,
Veronica,Lopez Aranda,,***-**-7389,female,8/28/1998,TRUE,209 ballyhaugh pl,,el paso,TX,79928,El Paso,FALSE,FALSE,FALSE,FALSE,9153210740,veronicalopez.vl468@gmail.com,Ambetter Balanced Care 32,none,Silver,Ambetter from Superior HealthPlan,1/1/2022,356.48,326,30.48,0,8700,8100,Yes,11/18/2021,"Borges, Mario",17420949,agent,,Effectuated,completed,,4143424678,8714623,Focused Silver,356.48,29418TX0140100,209 ballyhaugh pl,,,TRUE,11/18/2021,,12/31/2022,Effectuated,1,13000,English,,0,0,1,0,0,0,TRUE,,,2021-11-18 21:57:43 UTC,,,,,,,,,,,,,,,,,,,,,,,,,,,,,,,,,,,,,,,,,,,,,,,,,,,,,,,,,,,,,,,,,,,,,,,,,,,,,,Yes,https://www.healthsherpa.com/access/438959053845,8/19/2022 21:58,$0.00 ,
Matias,Bonilla Lopez,,,male,9/1/1970,TRUE,62697 TX-20,,Fort Hancock,TX,79839,Hudspeth,PO Box 595,Tornillo,TX,79853-0595,9158735693,iselasilva0373@gmail.com,Blue Advantage Silver HMO℠ 205,share87,Silver,Blue Cross and Blue Shield of Texas,2/14/2022,1424.43,1424.43,0,0,2900,100,Yes,11/18/2021,"Rodriguez, Yaneisy",17420949,agent_override,,Terminated,expired,,4207794197,8623774,Blue Advantage Silver HMO℠ 205,1424.43,33602TX0460704,62697 TX-20,,,FALSE,2/14/2022,9/28/2022,8/31/2022,Terminated,2,29001,Spanish,,0,3,0,0,0,0,FALSE,,,2022-02-14 19:21:51 UTC,Isela,Silva,,,female,2/2/1973,TRUE,,,,,,,,,,,,,,,,,,,,,,,,,,,,,,,,,,,,,,,,,,,,,,,,,,,,,,,,,,,,,,,,,,,,,,,Yes,https://www.healthsherpa.com/access/718423484427,9/28/2022 16:36,$0.00 ,
MANUEL,RUIZ,,***-**-4125,male,2/11/1970,TRUE,8006 Peale,,San Antonio,TX,78239,Bexar,FALSE,FALSE,FALSE,FALSE,9999999210,manuelruiz7702@gmail.com,Ambetter Value Silver 32,share94,Silver,Ambetter from Superior Health Plan,1/1/2022,1134.05,1095,39.05,3,1575,0,Yes,11/18/2021,"Borges, Mario",17420949,agent,,Effectuated,,,4150321233,9685775,Focused VALUE Silver,1134.05,87226TX0080009,8006 Peale,,,TRUE,2/3/2022,,12/31/2022,Effectuated,4,35004,Spanish,,0,0,0,0,0,0,TRUE,,,2021-11-18 23:56:33 UTC,GLADIS,PONCE PAZ,,,female,1/9/1975,FALSE,OSCAR,ALARCON PONCE,,***-**-3165,male,9/12/2006,TRUE,AMERICA,RUIZ,,***-**-8894,female,6/16/2012,TRUE,,,,,,,,,,,,,,,,,,,,,,,,,,,,,,,,,,,,,,,,,,,,,,,,,,,,,,,,,Yes,https://www.healthsherpa.com/access/263562277644,11/21/2022 18:43,$0.00 ,
Esther,Rivera Figueroa,,***-**-5476,female,6/18/1962,TRUE,4006 Great Egret Dr,,Winter Haven,FL,33881-7302,Polk,FALSE,FALSE,FALSE,FALSE,4077973235,esther.rf.62@gmail.com,Ambetter Balanced Care 32,share94,Silver,Ambetter from Sunshine Health,1/1/2022,970.73,955,15.73,1,1575,0,Yes,11/19/2021,"Rodriguez, Yaneisy",17420949,agent_override,,Effectuated,,,4141444788,10324851,Focused Silver,970.73,21663FL0130112,4006 Great Egret Dr,,,TRUE,11/19/2021,,12/31/2022,Effectuated,1,15000,Spanish,,0,0,0,0,0,0,FALSE,,,2021-11-19 18:11:11 UTC,,,,,,,,,,,,,,,,,,,,,,,,,,,,,,,,,,,,,,,,,,,,,,,,,,,,,,,,,,,,,,,,,,,,,,,,,,,,,,Yes,https://www.healthsherpa.com/access/831135476109,12/13/2022 22:59,$0.00 ,
Juan,Paramo Quiroz,,***-**-5489,male,11/20/1964,TRUE,204 S Young St,,Fort Stockton,TX,79735,Pecos,FALSE,FALSE,FALSE,FALSE,4322518766,,Blue Advantage Silver HMO℠ 205,,Silver,Blue Cross and Blue Shield of Texas,1/1/2022,,991.81,0,1,,,No,,"Borges, Mario",17420949,agent,,Effectuated,expired,,4210152524,9995157,Blue Advantage Silver HMO℠ 205,,33602TX0460704,204 S Young St,,,TRUE,8/1/2022,,12/31/2022,Effectuated,1,19011.6,Spanish,,2,0,0,0,0,0,FALSE,,,2022-08-01 18:57:11 UTC,,,,,,,,,,,,,,,,,,,,,,,,,,,,,,,,,,,,,,,,,,,,,,,,,,,,,,,,,,,,,,,,,,,,,,,,,,,,,,No,https://www.healthsherpa.com/access/735000669136,9/9/2022 20:50,$0.00 ,
Eddy,Hernandez Chavez,,***-**-9130,female,2/2/1960,TRUE,17050 Imperial Valley Dr,apt 19,Houston,TX,77038,Harris,FALSE,FALSE,FALSE,FALSE,7139271704,ESPER54@GMAIL.COM,MyBlue Health Silver℠ 405,,Silver,Blue Cross and Blue Shield of Texas,1/1/2022,878.88,825,53.88,1,,,Yes,11/19/2021,"Borges, Mario",17420949,agent,,Cancelled,insufficient_documentation,,4161952383,9913670,MyBlue Health Silver 405,878.88,33602TX0860008,17050 Imperial Valley Dr,,,FALSE,,2/3/2022,12/31/2022,Cancelled,3,28000,Spanish,,1,0,0,0,0,0,FALSE,,,2021-11-20 00:02:28 UTC,,,,,,,,Hector,Murillo Ortiz,,,male,8/13/2013,FALSE,Matheus,Murillo Ortiz,,,male,9/12/2019,FALSE,,,,,,,,,,,,,,,,,,,,,,,,,,,,,,,,,,,,,,,,,,,,,,,,,,,,,,,,,Yes,https://www.healthsherpa.com/access/847929116144,6/16/2022 16:58,$0.00 ,
Ana,Duarte,,***-**-0984,female,2/17/1967,TRUE,231 SW 54th Ave,,Coral Gables,FL,33134,Miami-Dade,FALSE,FALSE,FALSE,FALSE,3053164990,anaisaduarte0217@gmail.com,Ambetter Value Silver 32,share87,Silver,Ambetter from Sunshine Health,3/1/2022,803.56,778,25.56,1,2900,0,Yes,11/19/2021,"Rodriguez, Yaneisy",17420949,agent_override,,Effectuated,,,4145314133,14855243,Focused VALUE Silver,803.56,86382FL0050009,231 SW 54th Ave,,,TRUE,7/28/2022,,12/31/2022,Effectuated,1,20200.08,Spanish,,0,0,0,0,0,0,FALSE,,,2022-07-28 18:12:01 UTC,,,,,,,,,,,,,,,,,,,,,,,,,,,,,,,,,,,,,,,,,,,,,,,,,,,,,,,,,,,,,,,,,,,,,,,,,,,,,,Yes,https://www.healthsherpa.com/access/148897928142,8/18/2022 16:07,$0.00 ,
ADRIANA,RODRIGUEZ ORTIZ,,***-**-2751,female,5/23/1964,TRUE,162 Tara Ln,,Haines City,FL,33844,Polk,FALSE,FALSE,FALSE,FALSE,6465715860,aro201126@hotmail.com,Ambetter Balanced Care 32,share94,Silver,Ambetter from Sunshine Health,1/1/2022,1920.94,1890,30.94,2,1575,0,Yes,11/22/2021,"Borges, Mario",17420949,agent,,Effectuated,,,4147301480,10228781,Focused Silver,1920.94,21663FL0130112,162 Tara Ln,,,TRUE,11/22/2021,,12/31/2022,Effectuated,2,25000,Spanish,,0,0,0,0,0,0,TRUE,,,2021-11-22 15:09:58 UTC,OSCAR,SEQUERA SUAREZ,,***-**-7306,male,10/27/1961,TRUE,,,,,,,,,,,,,,,,,,,,,,,,,,,,,,,,,,,,,,,,,,,,,,,,,,,,,,,,,,,,,,,,,,,,,,,Yes,https://www.healthsherpa.com/access/343332720414,11/21/2022 17:05,$0.00 ,
Silvia,Baldera Martinez,,,female,2/10/1981,TRUE,1306 Mobile St Big,,Spring,TX,79720,Howard,FALSE,FALSE,FALSE,FALSE,9152418151,,Blue Advantage Silver HMO℠ 205,share94,Silver,Blue Cross and Blue Shield of Texas,6/1/2022,520.12,0,520.12,1,900,0,Yes,11/22/2021,"Rodriguez, Yaneisy",17420949,agent_override,,Terminated,action_needed,,4145120704,8608580,Blue Advantage Silver HMO℠ 205,520.12,33602TX0460704,1306 Mobile St Big,,,FALSE,,,12/31/2022,Unknown,2,17500,Spanish,,2,1,0,0,0,0,TRUE,,,2022-02-14 18:22:33 UTC,,,,,,,,Vanessa,Ruiz Baldera,,,female,2/12/2008,FALSE,,,,,,,,,,,,,,,,,,,,,,,,,,,,,,,,,,,,,,,,,,,,,,,,,,,,,,,,,,,,,,,,Yes,https://www.healthsherpa.com/access/743740422149,6/24/2022 20:58,$0.00 ,
Hector,Roman Rodriguez,,***-**-0471,male,3/17/1992,TRUE,7015 S Rockwell St,APT 1,Chicago,IL,60629,Cook,FALSE,FALSE,FALSE,FALSE,4074562095,,Ambetter Balanced Care 31,share94,Silver, Ambetter of Illinois,1/1/2022,271.78,270.78,1,1,775,400,Yes,11/22/2021,"Borges, Mario",17420949,agent,,Terminated,completed,,4136726417,3848702,Ambetter Balanced Care 31,271.78,27833IL0140062,7015 S Rockwell St,,,FALSE,,,12/31/2022,Cancelled,2,25008,Spanish,,0,0,1,0,0,0,TRUE,,,2021-11-22 21:20:32 UTC,,,,,,,,Yarianit,Roman Garcia,,,female,10/22/2015,FALSE,,,,,,,,,,,,,,,,,,,,,,,,,,,,,,,,,,,,,,,,,,,,,,,,,,,,,,,,,,,,,,,,Yes,https://www.healthsherpa.com/access/425535632524,6/16/2022 16:20,$0.00 ,
EVA,CISNEROS,,***-**-6849,female,7/2/1974,TRUE,4405 S Shary Rd,Apt 431,Mission,TX,78572,Hidalgo,FALSE,FALSE,FALSE,FALSE,9569607140,evacisneros956@icluoud.com,Ambetter Balanced Care 32,share94,Silver,Ambetter from Superior HealthPlan,4/1/2022,876.3,834.93,41.37,3,1575,0,Yes,11/22/2021,"Rodriguez, Yaneisy",17420949,agent_override,,Effectuated,,,4137455415,10325482,Ambetter Balanced Care 32,876.3,29418TX0140101,4405 S Shary Rd,,,TRUE,3/30/2022,,12/31/2022,Effectuated,3,25000,Spanish,,0,0,0,0,0,0,TRUE,,,2022-03-30 19:10:29 UTC,,,,,,,,JULIO,RAMIREZ,,***-**-5189,male,6/19/1997,TRUE,KARLA,RAMIREZ,,***-**-1601,female,4/20/1996,TRUE,,,,,,,,,,,,,,,,,,,,,,,,,,,,,,,,,,,,,,,,,,,,,,,,,,,,,,,,,Yes,https://www.healthsherpa.com/access/646245254928,11/2/2022 19:46,$0.00 ,
Sara,Hernandez,,***-**-6890,female,2/16/1964,TRUE,6864 Santa Paula Dr,Lote 14,Brownsville,TX,78521,Cameron,FALSE,FALSE,FALSE,FALSE,9567471806,,Blue Advantage Gold HMO℠ 206,none,Gold,Blue Cross and Blue Shield of Texas,9/1/2022,770.07,0,770.07,1,8700,750,Yes,11/23/2021,"Borges, Mario",17420949,agent,,Effectuated,expired,,4216585780,9834319,Blue Advantage Gold HMO℠ 206,770.07,33602TX0460558,6864 Santa Paula Dr,,,TRUE,,,12/31/2022,Effectuated,1,13008,Spanish,,0,1,1,0,0,0,TRUE,,,2022-02-14 15:49:10 UTC,,,,,,,,,,,,,,,,,,,,,,,,,,,,,,,,,,,,,,,,,,,,,,,,,,,,,,,,,,,,,,,,,,,,,,,,,,,,,,Yes,https://www.healthsherpa.com/access/181000793503,9/29/2022 21:41,$0.00 ,
Paula,Tellez Mejia,,***-**-8605,female,2/6/1988,TRUE,7930 W Hwy 68,,Golden Valley,AZ,86413,Mohave,FALSE,FALSE,FALSE,FALSE,2199169141,patellez2012@gmail.com,Blue Portfolio HSA Bronze (Free Preventive Care),share87,Expanded Bronze,"Blue Cross Blue Shield of Arizona,",1/1/2022,1789.01,1789.01,0,4,7000,7000,Yes,11/23/2021,"Borges, Mario",,agent_healthsherpa_referral,,Terminated,completed,,4216270279,2320938,Blue Portfolio HSA Bronze (Free Preventive Care),1789.01,53901AZ1420067,7930 W Hwy 68,,,FALSE,,2/3/2022,1/31/2022,Terminated,4,40008,Spanish,,0,0,1,0,0,0,FALSE,,,2021-12-27 22:37:33 UTC,Arnaldo,Caballero,,***-**-0301,male,1/27/1978,TRUE,Armando,Caballero,,***-**-6148,male,7/31/2012,TRUE,Paola,Caballero Tellez,,***-**-3610,female,3/31/2015,TRUE,,,,,,,,,,,,,,,,,,,,,,,,,,,,,,,,,,,,,,,,,,,,,,,,,,,,,,,,,Yes,https://www.healthsherpa.com/access/407325646580,6/16/2022 16:29,$0.00 ,$140.00 
Andrea,Martinez,,***-**-5939,female,12/28/2001,TRUE,4489 Sue Ellen Dr,,Royse City,TX,75189-8097,Rockwall,FALSE,FALSE,FALSE,FALSE,469-826-9462,andreamartinez122801@gmail.com,Ambetter Value Silver 32,,Silver,Ambetter from Superior Health Plan,1/1/2022,330.29,320,10.29,1,,,Yes,11/23/2021,"Rodriguez, Yaneisy",17420949,agent_override,,Cancelled,,,4216831781,10477201,Focused VALUE Silver,330.29,87226TX0060009,4489 Sue Ellen Dr,,,FALSE,,12/23/2021,12/31/2022,Cancelled,1,13000,,,0,0,0,0,0,0,FALSE,,,2021-11-23 22:06:31 UTC,,,,,,,,,,,,,,,,,,,,,,,,,,,,,,,,,,,,,,,,,,,,,,,,,,,,,,,,,,,,,,,,,,,,,,,,,,,,,,Yes,https://www.healthsherpa.com/access/421546853619,9/29/2022 17:20,$0.00 ,
Jaime Alonso,Ruiz,,***-**-2954,male,11/15/1969,FALSE,10430 Pine Glade,,San Antonio,TX,78245-3141,Bexar,FALSE,FALSE,FALSE,FALSE,2104452310,wilsonico7799@yahoo.com,MyBlue Health Silver℠ 405,,Silver,Blue Cross and Blue Shield of Texas,1/1/2022,476.99,409,67.99,0,,,Yes,11/24/2021,"Borges, Mario",17420949,agent,,Cancelled,completed,,4217855751,,MyBlue Health Silver 405,476.99,33602TX0860012,10430 Pine Glade,,,FALSE,,1/10/2022,12/31/2022,Cancelled,4,47000,Spanish,,0,0,5,0,0,0,FALSE,,,2021-11-24 17:39:21 UTC,Aidee,Gonzales Ruiz,,***-**-7192,female,12/30/1976,TRUE,Brian,Ruiz Gonzales,,***-**-4380,male,6/28/2006,FALSE,Moises,Ruiz Gonzales,,***-**-7830,male,11/13/2013,FALSE,,,,,,,,,,,,,,,,,,,,,,,,,,,,,,,,,,,,,,,,,,,,,,,,,,,,,,,,,Yes,https://www.healthsherpa.com/access/939165418285,8/19/2022 16:56,$0.00 ,
Marlen,Mayen,,***-**-6515,female,2/21/1982,TRUE,455 NE 24th St,513,Miami,FL,33137-4798,Miami-Dade,FALSE,FALSE,FALSE,FALSE,843-615-3515,marlenmayen41@gmail.com,Ambetter Value Silver 32,share94,Silver,Ambetter from Sunshine Health,1/1/2022,454.75,443,11.75,1,1575,0,Yes,11/24/2021,"Rodriguez, Yaneisy",17420949,agent_override,,Cancelled,completed,,4133963709,13593876,Focused VALUE Silver,454.75,86382FL0050009,455 NE 24th St,,,FALSE,,5/9/2022,12/31/2022,Cancelled,3,22008,,,0,0,1,0,0,0,FALSE,,,2021-11-24 17:40:33 UTC,,,,,,,,,,,,,,,,,,,,,,,,,,,,,,,,,,,,,,,,,,,,,,,,,,,,,,,,,,,,,,,,,,,,,,,,,,,,,,Yes,https://www.healthsherpa.com/access/57474161844,8/19/2022 17:45,$0.00 ,
Luz,Buendia Castro,,***-**-0683,female,3/2/1987,TRUE,12828 Dairy Brook Dr,,Houston,TX,77099-1222,Harris,FALSE,FALSE,FALSE,FALSE,7135847415,mbuendia6@gmail.com,Ambetter Value Silver 32,share94,Silver,Ambetter from Superior Health Plan,1/1/2022,385.46,357,28.46,1,1575,0,Yes,11/24/2021,"Rodriguez, Yaneisy",17420949,agent_override,,Effectuated,completed,,4132997332,10146304,Focused VALUE Silver,385.46,87226TX0100009,12828 Dairy Brook Dr,,,TRUE,2/13/2022,,12/31/2022,Effectuated,3,28000,Spanish,,0,0,1,0,0,0,FALSE,,,2021-11-24 17:57:11 UTC,,,,,,,,Nathan,Pacheco,,,male,10/28/2014,FALSE,William,Pacheco,,,male,8/2/2018,FALSE,,,,,,,,,,,,,,,,,,,,,,,,,,,,,,,,,,,,,,,,,,,,,,,,,,,,,,,,,Yes,https://www.healthsherpa.com/access/844632686349,8/22/2022 22:39,$0.00 ,
Fernanda,Garcia Gonzalez,,***-**-1046,female,11/3/1972,TRUE,125 Road 5255,,Cleveland,TX,77327,Liberty,FALSE,FALSE,FALSE,FALSE,2815137513,mfxgdp1@gmail.com,Ambetter Balanced Care 32,none,Silver,Ambetter from Superior HealthPlan,1/1/2022,907.13,890,17.13,1,8700,8100,Yes,11/24/2021,"Rodriguez, Yaneisy",17420949,agent_override,,Effectuated,completed,,4131510710,8306624,Focused Silver,907.13,29418TX0140100,125 Road 5255,,,TRUE,12/23/2021,,12/31/2022,Effectuated,2,18000,Spanish,,0,0,2,0,0,0,TRUE,,,2021-11-24 18:17:10 UTC,,,,,,,,Maria,Amador Garcia,,***-**-8125,female,8/26/2007,TRUE,,,,,,,,,,,,,,,,,,,,,,,,,,,,,,,,,,,,,,,,,,,,,,,,,,,,,,,,,,,,,,,,Yes,https://www.healthsherpa.com/access/504302409506,9/29/2022 15:02,$0.00 ,
Pedro,Chavarria Bonilla,,***-**-4744,male,12/20/1993,TRUE,2244 SW Morris Dr,,Lees Summit,MO,64082-4131,Jackson,FALSE,FALSE,FALSE,FALSE,9137171779,erikaestokes@gmail.com,Ambetter Balanced Care 32,share94,Silver,Ambetter HomeState Health,3/1/2022,382.66,372,10.66,1,1575,0,Yes,11/24/2021,"Borges, Mario",17420949,agent,,Effectuated,expired,,4218200709,3244543,Focused Silver,382.66,99723MO0090059,2244 SW Morris Dr,,,TRUE,,,12/31/2022,Effectuated,3,31000,Spanish,,0,1,0,0,0,0,FALSE,,,2021-11-24 20:38:01 UTC,,,,,,,,Itan,Chavarria,,,male,1/13/2019,FALSE,Novaly,Chavarria,,,female,4/23/2020,FALSE,,,,,,,,,,,,,,,,,,,,,,,,,,,,,,,,,,,,,,,,,,,,,,,,,,,,,,,,,Yes,https://www.healthsherpa.com/access/125185912068,6/16/2022 16:13,$0.00 ,
Alejandro,Chavarria Bonilla,,***-**-9411,male,12/23/1999,TRUE,2244 SW Morris Dr,,Lees Summit,MO,64082-4131,Jackson,FALSE,FALSE,FALSE,FALSE,9137171779,erikaestokes@gmail.com,Ambetter Balanced Care 32,none,Silver,Ambetter HomeState Health,3/1/2022,352.04,342,10.04,0,8700,8100,Yes,11/24/2021,"Rodriguez, Yaneisy",17420949,agent_override,,Effectuated,expired,,4218435611,2319072,Focused Silver,352.04,99723MO0090059,2244 SW Morris Dr,,,TRUE,5/9/2022,,6/30/2022,Effectuated,2,25000,Spanish,,0,2,0,0,0,0,FALSE,,,2022-02-16 23:15:35 UTC,,,,,,,,Jiana,Chavarria,,,female,1/24/2021,FALSE,,,,,,,,,,,,,,,,,,,,,,,,,,,,,,,,,,,,,,,,,,,,,,,,,,,,,,,,,,,,,,,,Yes,https://www.healthsherpa.com/access/279339138814,6/16/2022 16:36,$0.00 ,
Florencio,Sanchez,,***-**-6664,male,11/10/1959,TRUE,708 N E 4th St,,Knox City,TX,79529,Knox,PO BOX 489,Knox City,TX,79529,9402031194,sanchezlencho4@gmail.com,Blue Advantage Silver HMO℠ 205,share94,Silver,Blue Cross and Blue Shield of Texas,1/1/2022,2273.81,2273.81,0,2,900,0,Yes,11/24/2021,"Rodriguez, Yaneisy",17420949,agent_override,,Effectuated,completed,,4161774218,8533349,Blue Advantage Silver HMO℠ 205,2273.81,33602TX0460704,708 N E 4th St,,,TRUE,11/24/2021,,12/31/2022,Effectuated,4,36000,Spanish,,0,0,2,0,0,0,TRUE,,,2021-11-24 22:29:40 UTC,Maria,Sanchez,,***-**-8551,female,6/11/1961,TRUE,Cristal,Sanchez,,,female,9/18/2007,FALSE,Cielo,Sanchez,,,female,2/18/2006,FALSE,,,,,,,,,,,,,,,,,,,,,,,,,,,,,,,,,,,,,,,,,,,,,,,,,,,,,,,,,Yes,https://www.healthsherpa.com/access/904574934530,8/19/2022 21:12,$0.00 ,
YASMANI,MORGADO,,***-**-4440,male,8/2/1990,TRUE,1151 Co Rd 2145,Trailer 2145,Cleveland,TX,77327,Liberty,FALSE,FALSE,FALSE,FALSE,3055057274,yasmanimorgado@yahoo.com,Ambetter Balanced Care 31,share94,Silver,Ambetter from Superior HealthPlan,4/1/2022,412.15,412.15,0,1,775,400,Yes,11/24/2021,"Rodriguez, Yaneisy",17420949,agent_override,,Effectuated,,,4145108259,9057182,Ambetter Balanced Care 31,412.15,29418TX0140098,1151 Co Rd 2145,,,TRUE,,,12/31/2022,Effectuated,1,13000,Spanish,,0,0,0,0,0,0,FALSE,,,2021-12-28 18:35:57 UTC,,,,,,,,,,,,,,,,,,,,,,,,,,,,,,,,,,,,,,,,,,,,,,,,,,,,,,,,,,,,,,,,,,,,,,,,,,,,,,Yes,https://www.healthsherpa.com/access/659639584049,8/18/2022 18:25,$0.00 ,
Manuel,Bacallao,,***-**-8770,male,9/6/1966,TRUE,2928 SW 2nd Ave,,Cape Coral,FL,33914,Lee,FALSE,FALSE,FALSE,FALSE,2393083236,manuelbacallao.1@yopmail.com,Ambetter Balanced Care 32,share87,Silver,Ambetter from Sunshine Health,1/1/2022,991.04,903,88.04,1,2900,0,Yes,11/26/2021,"Rodriguez, Yaneisy",18141564,agent,,Cancelled,insufficient_documentation,,4219689783,13219137,Focused Silver,991.04,21663FL0130112,2928 SW 2nd Ave,,,FALSE,,11/8/2022,12/31/2022,Cancelled,1,25000,Spanish,,1,0,0,0,0,0,FALSE,,,2021-11-26 16:19:43 UTC,,,,,,,,,,,,,,,,,,,,,,,,,,,,,,,,,,,,,,,,,,,,,,,,,,,,,,,,,,,,,,,,,,,,,,,,,,,,,,Yes,https://www.healthsherpa.com/access/455104023099,11/8/2022 22:13,$0.00 ,
Reina,Lazo,,***-**-2120,female,11/19/1962,TRUE,6408 Blossom Ave,,Tampa,FL,33614-4809,Hillsborough,FALSE,FALSE,FALSE,FALSE,8138630679,greysisrod7@gmail.com,Ambetter Balanced Care 32,share94,Silver,Ambetter from Sunshine Health,1/1/2022,922.42,908,14.42,1,1575,0,Yes,11/26/2021,"Rodriguez, Yaneisy",17420949,agent_override,,Effectuated,completed,,4211825521,12390234,Focused Silver,922.42,21663FL0130112,6408 Blossom Ave,,,TRUE,12/23/2021,,12/31/2022,Effectuated,1,14000.04,Spanish,,0,0,1,0,0,0,FALSE,,,2021-11-26 19:18:00 UTC,,,,,,,,,,,,,,,,,,,,,,,,,,,,,,,,,,,,,,,,,,,,,,,,,,,,,,,,,,,,,,,,,,,,,,,,,,,,,,Yes,https://www.healthsherpa.com/access/244937091626,12/8/2022 15:41,$0.00 ,
Mario,Romero,,***-**-0703,male,11/11/1965,TRUE,4514 Kleinway Dr,,Houston,TX,77066-4395,Harris,FALSE,FALSE,FALSE,FALSE,8323120521,shelbyromero@icloud.com,MyBlue Health Bronze℠ 402,share87,Expanded Bronze,Blue Cross and Blue Shield of Texas,5/1/2022,1129.15,1129.15,0,2,8700,7400,Yes,11/26/2021,"Rodriguez, Yaneisy",17420949,agent_override,,Effectuated,completed,,4146022908,9359647,MyBlue Health Bronze 402,1129.15,33602TX0860005,4514 Kleinway Dr,,,TRUE,,,12/31/2022,Effectuated,2,30000,Spanish,,0,0,2,0,0,0,TRUE,,,2021-11-26 22:56:09 UTC,Shelvy,Romero,,***-**-5182,female,10/27/1966,TRUE,,,,,,,,,,,,,,,,,,,,,,,,,,,,,,,,,,,,,,,,,,,,,,,,,,,,,,,,,,,,,,,,,,,,,,,Yes,https://www.healthsherpa.com/access/581036403935,6/16/2022 17:16,$0.00 ,
Victor,Garcia,,***-**-3612,male,4/26/1959,TRUE,1446 NW 66th Ave,,Margate,FL,33063,Broward,FALSE,FALSE,FALSE,FALSE,9545622539,A@COMCAST.COM,Ambetter Select Silver 32,share94,Silver,Ambetter from Sunshine Health,1/1/2022,1817.72,1721,96.72,2,1575,0,Yes,11/28/2021,"Cieza, Patricia",469972,agent,,Effectuated,completed,,4221823217,12729307,Focused SELECT Silver with Select Providers,1817.72,86382FL0040009,1446 NW 66th Ave,,,TRUE,2/13/2022,,12/31/2022,Effectuated,3,28000,Spanish,,0,0,2,0,0,0,TRUE,,,2021-11-29 03:56:38 UTC,Maria,Ortega,,***-**-2295,female,8/2/1965,TRUE,Jonathan,Vanega,,,male,9/13/1997,FALSE,,,,,,,,,,,,,,,,,,,,,,,,,,,,,,,,,,,,,,,,,,,,,,,,,,,,,,,,,,,,,,,,Yes,https://www.healthsherpa.com/access/123389491439,12/13/2022 18:59,$0.00 ,
ADALBERTO,BLANCO,,***-**-4157,male,4/23/1954,FALSE,11942 SW 176 TER,,MIAMI,FL,33177,Miami-Dade,FALSE,FALSE,FALSE,FALSE,7869701452,milibp@live.com,Ambetter Balanced Care 32,share94,Silver,Ambetter from Sunshine Health,1/1/2022,1091.13,952,139.13,1,1575,0,Yes,11/30/2021,"Khouri, Violeta",17420949,agent_override,,Effectuated,,,4137551429,10620528,Focused Silver,1091.13,21663FL0130113,11942 SW 176 TER,,,TRUE,11/30/2021,,12/31/2022,Effectuated,2,24000,Spanish,,0,0,0,0,0,0,TRUE,,,2021-11-30 15:50:07 UTC,MILAGROS,BLANCO,,***-**-3573,female,7/2/1961,TRUE,,,,,,,,,,,,,,,,,,,,,,,,,,,,,,,,,,,,,,,,,,,,,,,,,,,,,,,,,,,,,,,,,,,,,,,Yes,https://www.healthsherpa.com/access/750348591245,11/18/2022 15:20,$0.00 ,
OSCAR,CRUZ Lanuza,,***-**-4031,male,11/3/1969,TRUE,345 E Palm Dr,,Florida City,FL,33034-3509,Miami-Dade,FALSE,FALSE,FALSE,FALSE,7862468775,cruzoscar11@gmail.com,"Aetna CVS Silver 2: $0 MinuteClinic Visits, Telehealth, South FL",share94,Silver,Aetna CVS Health,4/1/2022,707.69,685,22.69,1,1000,200,Yes,11/30/2021,"Rodriguez, Yaneisy",18141564,agent,,Effectuated,,,4159646573,14572746,Silver 2: Aetna network of doctors & hospitals + $0 walk-in & telemedicine via MinuteClinic at CVS,707.69,92120FL0080007,345 E Palm Dr,,,TRUE,,,12/31/2022,Effectuated,1,18000,Spanish,,0,0,0,0,0,0,TRUE,,,2021-11-30 21:05:19 UTC,,,,,,,,,,,,,,,,,,,,,,,,,,,,,,,,,,,,,,,,,,,,,,,,,,,,,,,,,,,,,,,,,,,,,,,,,,,,,,Yes,https://www.healthsherpa.com/access/682666476857,8/18/2022 17:57,$0.00 ,
Armando,Lara,,***-**-4936,male,5/18/1969,TRUE,987 Crawfordville hwy,,Crawfordville,FL,32327,Wakulla,FALSE,FALSE,FALSE,FALSE,8502940069,armando@yti.com,"Ambetter Essential Care: $1,500 Medical Deductible",share94,Expanded Bronze,Ambetter from Sunshine Health,5/1/2022,716.26,716.26,0,1,8700,1500,Yes,11/30/2021,"Borges, Mario",18141564,agent_override,,Effectuated,action_needed,,4227812689,14048759,"Ambetter Essential Care: $1,500 Medical Deductible",716.26,21663FL0130104,987 Crawfordville hwy,,,TRUE,,,12/31/2022,Effectuated,1,13008,Spanish,,1,0,1,0,0,0,FALSE,,,2021-12-28 18:16:22 UTC,,,,,,,,,,,,,,,,,,,,,,,,,,,,,,,,,,,,,,,,,,,,,,,,,,,,,,,,,,,,,,,,,,,,,,,,,,,,,,Yes,https://www.healthsherpa.com/access/118251427145,8/17/2022 20:19,$0.00 ,
Jose,Botello,,***-**-7299,male,9/17/1979,TRUE,2817 3rd St W,,Lehigh Acres,FL,33971,Lee,FALSE,FALSE,FALSE,FALSE,2392402282,jabotello79@gmail.com,Ambetter Essential Care: $0 Medical Deductible,none,Expanded Bronze,Ambetter from Sunshine Health,6/1/2022,560.55,396,164.55,1,8700,0,Yes,11/30/2021,"Rodriguez, Yaneisy",18141564,agent,,PendingEffectuation,completed,,4201697762,13264023,Elite Bronze,560.55,21663FL0130106,2817 3rd St W,,,FALSE,,,12/31/2022,PendingEffectuation,2,45000,Spanish,,1,0,2,0,0,0,FALSE,,,2021-11-30 22:44:31 UTC,,,,,,,,Sylir,Botello,,,male,10/23/2011,FALSE,,,,,,,,,,,,,,,,,,,,,,,,,,,,,,,,,,,,,,,,,,,,,,,,,,,,,,,,,,,,,,,,Yes,https://www.healthsherpa.com/access/265867625398,8/17/2022 22:08,$0.00 ,
Daurin,Perez,,***-**-2229,male,12/1/2001,TRUE,8745 Palm Breeze Rd,Apt 708,Jacksonville,FL,32256-3750,Duval,FALSE,FALSE,FALSE,FALSE,407-683-7598,itsdavrjn@gmail.com,Ambetter Balanced Care 32,share94,Silver,Ambetter from Sunshine Health,1/1/2022,338.41,333,5.41,1,1575,0,Yes,12/1/2021,"Rodriguez, Yaneisy",17420949,agent_override,,Effectuated,,,4125642707,9896511,Focused Silver,338.41,21663FL0130112,8745 Palm Breeze Rd,,,TRUE,12/1/2021,,12/31/2022,Effectuated,1,16000,,,0,0,0,0,0,0,FALSE,,,2021-12-01 15:09:45 UTC,,,,,,,,,,,,,,,,,,,,,,,,,,,,,,,,,,,,,,,,,,,,,,,,,,,,,,,,,,,,,,,,,,,,,,,,,,,,,,Yes,https://www.healthsherpa.com/access/979529548518,8/19/2022 18:05,$0.00 ,
Jean,Hernandez,,,male,11/15/1988,TRUE,1703 Gibsonia Galloway Rd,,Lakeland,FL,33810,Polk,FALSE,FALSE,FALSE,FALSE,8133235295,HJEANCARLOS912@GMAIL.COM,Ambetter Essential Care: $0 Medical Deductible,share94,Expanded Bronze,Ambetter from Sunshine Health,8/1/2022,425.3,425.3,0,1,8700,0,Yes,12/1/2021,"Rodriguez, Yaneisy",17420949,agent_override,,Effectuated,expired,,4151112780,13376485,Elite Bronze,425.3,21663FL0130106,1703 Gibsonia Galloway Rd,,,TRUE,,,12/31/2022,Effectuated,1,18000,Spanish,,2,0,0,0,0,0,FALSE,,,2022-05-06 20:02:46 UTC,,,,,,,,,,,,,,,,,,,,,,,,,,,,,,,,,,,,,,,,,,,,,,,,,,,,,,,,,,,,,,,,,,,,,,,,,,,,,,Yes,https://www.healthsherpa.com/access/645159398417,8/19/2022 16:06,$0.00 ,
Orlando,Martinez,,***-**-8938,male,12/17/2002,TRUE,400 Southwest Pkwy,apt 921,College Station,TX,77840-7147,Brazos,FALSE,FALSE,FALSE,FALSE,4698268640,orlandomartinez017@gmail.com,Ambetter Balanced Care 32,share94,Silver,Ambetter from Superior HealthPlan,1/1/2022,358.13,346,12.13,1,1575,0,Yes,12/1/2021,"Rodriguez, Yaneisy",17420949,agent_override,,Effectuated,,,4125595701,7805039,Ambetter Balanced Care 32,358.13,29418TX0140101,400 Southwest Pkwy,,,TRUE,12/1/2021,,12/31/2022,Effectuated,1,13000,Spanish,,0,0,0,0,0,0,FALSE,,,2021-12-01 20:36:54 UTC,,,,,,,,,,,,,,,,,,,,,,,,,,,,,,,,,,,,,,,,,,,,,,,,,,,,,,,,,,,,,,,,,,,,,,,,,,,,,,Yes,https://www.healthsherpa.com/access/574917125209,8/22/2022 20:54,$0.00 ,
Hilda,Vasquez,,,female,9/3/1977,TRUE,651 Mable Dr,,La Vergne,TN,37086,Rutherford,FALSE,FALSE,FALSE,FALSE,6152909197,hilda3sep@hotmail.com,Ambetter Balanced Care 32,share94,Silver,Ambetter of Tennessee,6/1/2022,505.78,493,12.78,1,1575,0,Yes,12/1/2021,"Rodriguez, Yaneisy",17420949,agent_override,,Terminated,expired,,4231496758,3886213,Focused Silver,505.78,70111TN0110029,651 Mable Dr,,,FALSE,,8/17/2022,12/31/2022,Cancelled,1,12880,Spanish,,0,1,0,0,0,0,FALSE,,,2022-02-28 17:36:22 UTC,,,,,,,,,,,,,,,,,,,,,,,,,,,,,,,,,,,,,,,,,,,,,,,,,,,,,,,,,,,,,,,,,,,,,,,,,,,,,,Yes,https://www.healthsherpa.com/access/982019029507,8/30/2022 19:51,$0.00 ,
Brenda,Hernandez,,***-**-7602,female,11/28/1992,TRUE,6126 Darlinghurst Dr,,Houston,TX,77085,Harris,FALSE,FALSE,FALSE,FALSE,8325667502,brindiz2892@gmail.com,Ambetter Value Silver 32,share94,Silver,Ambetter from Superior Health Plan,4/1/2022,700.44,648,52.44,2,1575,0,Yes,12/2/2021,"Borges, Mario",17420949,agent,,Effectuated,completed,,4151722279,11245096,Focused VALUE Silver,700.44,87226TX0100009,6126 Darlinghurst Dr,,,TRUE,,,12/31/2022,Effectuated,2,18000,Spanish,,0,0,4,0,0,0,FALSE,,,2021-12-02 17:06:13 UTC,German,Castillo Baltierrez,,***-**-5933,female,8/24/1993,TRUE,,,,,,,,,,,,,,,,,,,,,,,,,,,,,,,,,,,,,,,,,,,,,,,,,,,,,,,,,,,,,,,,,,,,,,,Yes,https://www.healthsherpa.com/access/562101998255,8/18/2022 22:13,$0.00 ,
FELIPE,HERNANDEZ BERASTAIN,,***-**-9677,male,8/18/1998,TRUE,7410 Warner Dr,,Jacksonville,FL,32244-4738,Duval,FALSE,FALSE,FALSE,FALSE,9045051564,fhb98@yahoo.com,Ambetter Essential Care: $0 Medical Deductible,share94,Expanded Bronze,Ambetter from Sunshine Health,9/1/2022,332.12,332.12,0,1,8700,0,Yes,12/2/2021,"Borges, Mario",18141564,agent_override,,PendingEffectuation,expired,,4145459841,12429924,Elite Bronze,332.12,21663FL0130106,7410 Warner Dr,,,FALSE,,,12/31/2022,PendingEffectuation,1,13008,Spanish,,1,0,0,0,0,0,TRUE,,,2021-12-02 15:54:56 UTC,,,,,,,,,,,,,,,,,,,,,,,,,,,,,,,,,,,,,,,,,,,,,,,,,,,,,,,,,,,,,,,,,,,,,,,,,,,,,,Yes,https://www.healthsherpa.com/access/470304452351,8/22/2022 18:04,$0.00 ,
Reymundo,Perdomo,,,male,1/6/1969,TRUE,4512 Winchester Ln,,Robstown,TX,78380,Nueces,FALSE,FALSE,FALSE,FALSE,3612059500,,Blue Advantage Plus Bronze℠ 303,none,Expanded Bronze,Blue Cross and Blue Shield of Texas,6/1/2022,695.33,0,695.33,0,8700,5500,Yes,12/2/2021,"Borges, Mario",17420949,agent,,Terminated,expired,,4152858869,9672806,Blue Advantage Plus Bronze℠ 303,695.33,33602TX0770190,4512 Winchester Ln,,,FALSE,,,12/31/2022,Unknown,1,18000,Spanish,,0,2,0,0,0,0,TRUE,,,2022-02-28 21:51:41 UTC,,,,,,,,,,,,,,,,,,,,,,,,,,,,,,,,,,,,,,,,,,,,,,,,,,,,,,,,,,,,,,,,,,,,,,,,,,,,,,Yes,https://www.healthsherpa.com/access/904306101664,8/30/2022 21:26,$0.00 ,
Jose,Ulin Acosta,,***-**-7934,male,5/1/1997,TRUE,8702 Nairn St,,Houston,TX,77074-2608,Harris,FALSE,FALSE,FALSE,FALSE,3462475135,RODRIGOACOSTA20@YAHOO.COM,MyBlue Health Silver℠ 405,share94,Silver,Blue Cross and Blue Shield of Texas,2/1/2022,312.77,294,18.77,1,1000,0,Yes,12/2/2021,"Rodriguez, Yaneisy",17420949,agent_override,,Terminated,,,4125510648,9090542,MyBlue Health Silver 405,312.77,33602TX0860008,8702 Nairn St,,,FALSE,2/13/2022,8/19/2022,5/31/2022,Terminated,1,13008,Spanish,,0,0,0,0,0,0,FALSE,,,2021-12-02 16:44:42 UTC,,,,,,,,,,,,,,,,,,,,,,,,,,,,,,,,,,,,,,,,,,,,,,,,,,,,,,,,,,,,,,,,,,,,,,,,,,,,,,Yes,https://www.healthsherpa.com/access/174620754439,8/19/2022 16:55,$0.00 ,
Brandon,Ontiveros,,***-**-3633,male,9/21/1999,TRUE,1217 S Glenwood Blvd,,Tyler,TX,75701-2739,Smith,FALSE,FALSE,FALSE,FALSE,9039443121,rr911805@gmail.com,Blue Advantage Silver HMO℠ 205,share94,Silver,Blue Cross and Blue Shield of Texas,1/1/2022,379.47,379.47,0,1,900,0,Yes,12/2/2021,"Rodriguez, Yaneisy",17420949,agent_override,,Effectuated,,,4140672569,6635082,Blue Advantage Silver HMO℠ 205,379.47,33602TX0460700,1217 S Glenwood Blvd,,,TRUE,12/23/2021,,12/31/2022,Effectuated,1,13000,Spanish,,0,0,0,0,0,0,FALSE,,,2021-12-02 17:24:18 UTC,,,,,,,,,,,,,,,,,,,,,,,,,,,,,,,,,,,,,,,,,,,,,,,,,,,,,,,,,,,,,,,,,,,,,,,,,,,,,,Yes,https://www.healthsherpa.com/access/760907497122,8/22/2022 18:06,$0.00 ,
Patricia,Zaragoza,,***-**-1070,female,11/19/1966,TRUE,1050 W Washington St Apt C1,,Brownsville,TX,78520,Cameron,FALSE,FALSE,FALSE,FALSE,9569088558,patricia1zaragoza@gmail.com,Blue Advantage Gold HMO℠ 206,share94,Gold,Blue Cross and Blue Shield of Texas,3/1/2022,,1020.65,0,2,8700,750,No,,"Rodriguez, Yaneisy",17420949,agent_override,,Effectuated,completed,,4138833755,10520372,Blue Advantage Gold HMO℠ 206,,33602TX0460558,1050 W Washington St Apt C1,,,TRUE,6/20/2022,,12/31/2022,Effectuated,2,18000,Spanish,,1,0,1,0,0,0,FALSE,,,2022-06-20 14:08:00 UTC,,,,,,,,Alejandra,Rodriguez,,***-**-9284,female,1/8/2000,TRUE,,,,,,,,,,,,,,,,,,,,,,,,,,,,,,,,,,,,,,,,,,,,,,,,,,,,,,,,,,,,,,,,No,https://www.healthsherpa.com/access/37251843283,9/5/2022 21:21,$0.00 ,
Gonzalo,Gonzalez,,***-**-8907,male,11/7/1990,TRUE,231 SW 54 AVE,,Coral Gable,FL,33134,Miami-Dade,FALSE,FALSE,FALSE,FALSE,3053164990,marsibila83@gmail.com,Ambetter Balanced Care 12,share94,Silver,Ambetter from Sunshine Health,1/1/2022,482.09,407,75.09,1,1400,0,Yes,12/2/2021,"Rodriguez, Yaneisy",18141564,agent,,Effectuated,completed,,4140384615,12093601,Everyday SIlver,482.09,21663FL0130040,231 SW 54 AVE,,,TRUE,,,12/31/2022,Effectuated,1,19000,Spanish,,0,0,1,0,0,0,FALSE,,,2021-12-02 23:55:23 UTC,,,,,,,,,,,,,,,,,,,,,,,,,,,,,,,,,,,,,,,,,,,,,,,,,,,,,,,,,,,,,,,,,,,,,,,,,,,,,,Yes,https://www.healthsherpa.com/access/898542672041,8/22/2022 15:10,$0.00 ,
Griselda,Vargas,,,female,8/22/1975,TRUE,411 Griner St,Apt 3,Del Rio,TX,78840,Val Verde,FALSE,FALSE,FALSE,FALSE,2103165700,,Ambetter Balanced Care 30,share94,Silver,Ambetter from Superior HealthPlan,11/1/2022,644.93,644.93,0,1,625,625,Yes,12/3/2021,"Rodriguez, Yaneisy",17420949,agent_override,,PendingEffectuation,action_needed,,4226953832,12289125,Ambetter Balanced Care 30,644.93,29418TX0140097,411 Griner St,,,FALSE,,,12/31/2022,PendingEffectuation,2,19999.92,Spanish,,1,0,0,0,0,0,TRUE,,,2021-12-29 18:58:17 UTC,,,,,,,,Salvador,Garcias,,,male,8/9/2001,FALSE,Julian,Garcias,,,male,6/6/2010,FALSE,Salvador,Garcia,,,male,8/9/2001,TRUE,Julian,Garcia,,,male,6/6/2010,TRUE,,,,,,,,,,,,,,,,,,,,,,,,,,,,,,,,,,,,,,,,,,,Yes,https://www.healthsherpa.com/access/147891720946,10/31/2022 18:50,$0.00 ,
Jose,Ornelas,,,male,3/19/1976,FALSE,1206 Mesquite St,,Big Spring,TX,79720-3922,Howard,FALSE,FALSE,FALSE,FALSE,8326097970,aliciabrivera8@icloud.com,Blue Advantage Silver HMO℠ 205,share94,Silver,Blue Cross and Blue Shield of Texas,2/16/2022,972.28,972.28,0,5,900,0,Yes,12/6/2021,"Rodriguez, Yaneisy",17420949,agent_override,,Effectuated,action_needed,,4239539020,9362059,Blue Advantage Silver HMO℠ 205,972.28,33602TX0460704,1206 Mesquite St,,,TRUE,3/4/2022,,12/31/2022,Effectuated,6,45001.2,Spanish,,1,0,0,0,0,0,FALSE,,,2022-03-04 17:44:40 UTC,,,,,,,,Paris,Ornelas,,***-**-4817,female,2/18/2013,TRUE,Brandon,Ornelas,,***-**-0900,male,2/18/2013,TRUE,Jackelin,Ornelas,,***-**-2746,female,9/3/2005,TRUE,Stephen,Calderon,,***-**-9622,male,10/6/2007,TRUE,Allison,Ornelas,,***-**-1624,female,12/14/2010,TRUE,Ashley,Ornela,,***-**-8301,female,12/10/2002,TRUE,,,,,,,,,,,,,,,,,,,,,,,,,,,,,Yes,https://www.healthsherpa.com/access/829116816993,11/10/2022 5:57,$0.00 ,
JOSE,PEREZ,,***-**-9159,male,4/18/1999,TRUE,8745 Palm Breeze Rd,708,Jacksonville,FL,32256,Duval,FALSE,FALSE,FALSE,FALSE,4076833674,jayvasquez175th@gmail.com,Ambetter Balanced Care 32,share94,Silver,Ambetter from Sunshine Health,1/1/2022,348.88,344,4.88,1,1575,0,Yes,12/6/2021,"Borges, Mario",17420949,agent,,Effectuated,,,4125834080,10556916,Focused Silver,348.88,21663FL0130112,8745 Palm Breeze Rd,,,TRUE,12/6/2021,,12/31/2022,Effectuated,1,13000,Spanish,,0,0,0,0,0,0,TRUE,,,2021-12-06 17:31:11 UTC,,,,,,,,,,,,,,,,,,,,,,,,,,,,,,,,,,,,,,,,,,,,,,,,,,,,,,,,,,,,,,,,,,,,,,,,,,,,,,Yes,https://www.healthsherpa.com/access/857831900984,11/14/2022 21:38,$0.00 ,
Martha,Gomez,,***-**-0259,female,4/27/1959,TRUE,23115 S Waterlily Dr,,Richmond,TX,77406-8619,Fort Bend,FALSE,FALSE,FALSE,FALSE,8322651885,,Ambetter Value Silver 32,share94,Silver,Ambetter from Superior Health Plan,1/1/2022,1229.73,1173,56.73,2,1575,0,Yes,12/6/2021,"Rodriguez, Yaneisy",17420949,agent_override,,Effectuated,,,4143415392,10932642,Focused VALUE Silver,1229.73,87226TX0100009,23115 S Waterlily Dr,,,TRUE,2/3/2022,,12/31/2022,Effectuated,3,25000,Spanish,,0,0,0,0,0,0,FALSE,,,2021-12-06 17:51:47 UTC,Jose,Gomez Diaz,,***-**-1556,male,1/10/1956,FALSE,Mark,Gomez,,***-**-1145,male,10/14/1999,TRUE,,,,,,,,,,,,,,,,,,,,,,,,,,,,,,,,,,,,,,,,,,,,,,,,,,,,,,,,,,,,,,,,Yes,https://www.healthsherpa.com/access/913223826647,8/22/2022 19:38,$0.00 ,
Santos,Avila,,***-**-7753,male,4/24/1966,TRUE,1085 Malone Dr,Apt D,Devine,TX,78016-1120,Medina,FALSE,FALSE,FALSE,FALSE,2818020919,,Blue Advantage Gold HMO℠ 206,share94,Gold,Blue Cross and Blue Shield of Texas,1/1/2022,834.97,834.97,0,0,8700,750,Yes,12/6/2021,"Rodriguez, Yaneisy",17420949,agent_override,,Terminated,expired,,4132182479,10528181,Blue Advantage Gold HMO℠ 206,834.97,33602TX0460572,1085 Malone Dr,,,FALSE,12/23/2021,9/28/2022,6/30/2022,Terminated,1,15000,Spanish,,0,3,0,0,0,0,FALSE,,,2021-12-06 18:33:45 UTC,,,,,,,,,,,,,,,,,,,,,,,,,,,,,,,,,,,,,,,,,,,,,,,,,,,,,,,,,,,,,,,,,,,,,,,,,,,,,,Yes,https://www.healthsherpa.com/access/784645639940,9/28/2022 22:50,$0.00 ,
Reynaldo,Hernandez,,***-**-3087,male,12/30/1988,TRUE,2522 Auburndale St,,Houston,TX,77023,Harris,FALSE,FALSE,FALSE,FALSE,7135981492,reyhernandez1987@icloud.com,MyBlue Health Silver℠ 405,share94,Silver,Blue Cross and Blue Shield of Texas,6/1/2022,383.63,352,31.63,1,1000,0,Yes,12/6/2021,"Rodriguez, Yaneisy",17420949,agent_override,,PendingEffectuation,expired,,4146898788,8552475,MyBlue Health Silver 405,383.63,33602TX0860008,2522 Auburndale St,,,FALSE,,,12/31/2022,PendingEffectuation,1,13000,Spanish,,1,0,0,0,0,0,FALSE,,,2022-02-21 17:27:12 UTC,,,,,,,,,,,,,,,,,,,,,,,,,,,,,,,,,,,,,,,,,,,,,,,,,,,,,,,,,,,,,,,,,,,,,,,,,,,,,,Yes,https://www.healthsherpa.com/access/182967744624,6/16/2022 17:17,$0.00 ,
Julian,Ambriz,,,male,7/30/1970,TRUE,1036 Rd 3406,casa,Cleveland,TX,77327,Liberty,FALSE,FALSE,FALSE,FALSE,9365202322,NOTIENE@GMAIL.COM,Ambetter Balanced Care 30,,Silver,Ambetter from Superior HealthPlan,1/1/2022,662.28,662.28,0,0,,,Yes,2/28/2022,"Rodriguez, Yaneisy",17420949,agent_override,,Terminated,expired,,4138310154,8882840,Clear Silver,662.28,29418TX0140096,1036 Rd 3406,,,FALSE,,2/28/2022,12/31/2022,Cancelled,1,13008,Spanish,,0,1,0,0,0,0,TRUE,,,2022-02-28 21:12:11 UTC,,,,,,,,,,,,,,,,,,,,,,,,,,,,,,,,,,,,,,,,,,,,,,,,,,,,,,,,,,,,,,,,,,,,,,,,,,,,,,Yes,https://www.healthsherpa.com/access/802049069407,8/19/2022 21:13,$0.00 ,
Julian,Ambriz,,,male,7/30/1970,TRUE,1036 Rd 3406,casa,Cleveland,TX,77327,Liberty,FALSE,FALSE,FALSE,FALSE,9365202322,NOTIENE@GMAIL.COM,Ambetter Balanced Care 30,share94,Silver,Ambetter from Superior HealthPlan,1/1/2022,662.28,662.28,0,0,625,625,Yes,12/6/2021,"Rodriguez, Yaneisy",17420949,agent_override,,Terminated,expired,,4138310154,8882840,Clear Silver,662.28,29418TX0140096,1036 Rd 3406,,,FALSE,,,12/31/2022,Cancelled,1,13008,Spanish,,0,1,0,0,0,0,TRUE,,,2021-12-06 23:46:31 UTC,,,,,,,,,,,,,,,,,,,,,,,,,,,,,,,,,,,,,,,,,,,,,,,,,,,,,,,,,,,,,,,,,,,,,,,,,,,,,,Yes,https://www.healthsherpa.com/access/238109810039,6/16/2022 17:06,$0.00 ,
Sonia,Galvan,,***-**-3798,female,1/13/1973,TRUE,278 County Road 6500,casa,Dayton,TX,77535,Liberty,FALSE,FALSE,FALSE,FALSE,7135161379,soniagalvan1301@gmail.com,Ambetter Balanced Care 30,share94,Silver,Ambetter from Superior HealthPlan,6/1/2022,605.82,605.82,0,1,625,625,Yes,12/7/2021,"Rodriguez, Yaneisy",17420949,agent_override,,Effectuated,completed,,4134877282,9039795,Clear Silver,605.82,29418TX0140096,278 County Road 6500,,,TRUE,,,12/31/2022,Effectuated,3,22000,Spanish,,0,0,1,0,0,0,TRUE,,,2021-12-07 15:11:54 UTC,,,,,,,,Angel,Sanchez,,,male,7/24/2008,FALSE,Adam,Sanchez,,,male,10/9/2002,FALSE,,,,,,,,,,,,,,,,,,,,,,,,,,,,,,,,,,,,,,,,,,,,,,,,,,,,,,,,,Yes,https://www.healthsherpa.com/access/387135689508,6/16/2022 16:51,$0.00 ,
SANDRA,OLDERSON,,***-**-4256,female,9/12/1962,TRUE,309 Manor Rd,,Laredo,TX,78041,Webb,FALSE,FALSE,FALSE,FALSE,4692332537,,Ambetter Balanced Care 32,share94,Silver,Ambetter from Superior HealthPlan,6/1/2022,901.94,868,33.94,1,1575,0,Yes,12/7/2021,"Borges, Mario",17420949,agent,,Effectuated,,,4144644520,9551035,Focused Silver,901.94,29418TX0140100,309 Manor Rd,,,TRUE,,,12/31/2022,Effectuated,2,17500,Spanish,,0,0,0,0,0,0,FALSE,,,2021-12-07 16:12:56 UTC,,,,,,,,Lidya,Hernandez De Mozqueda,,,female,1/23/1939,FALSE,,,,,,,,,,,,,,,,,,,,,,,,,,,,,,,,,,,,,,,,,,,,,,,,,,,,,,,,,,,,,,,,Yes,https://www.healthsherpa.com/access/565716672081,8/17/2022 21:24,$0.00 ,
ROBERTO,LOPEZ,,***-**-2192,male,12/12/1965,TRUE,2735 SW 36th Ave,,Miami,FL,33133,Miami-Dade,FALSE,FALSE,FALSE,FALSE,3054842284,lopezrobe@hotmail.com,Ambetter Value Bronze: $0 Medical Deductible,share73,Expanded Bronze,Ambetter from Sunshine Health,1/1/2022,800.21,765,35.21,1,8700,0,Yes,12/7/2021,"Borges, Mario",17420949,agent,,Effectuated,completed,,4148670866,13608994,Elite VALUE Bronze,800.21,86382FL0050005,2735 SW 36th Ave,,,TRUE,2/13/2022,,12/31/2022,Effectuated,1,27000,Spanish,,0,0,1,0,0,0,TRUE,,,2021-12-07 17:39:18 UTC,,,,,,,,,,,,,,,,,,,,,,,,,,,,,,,,,,,,,,,,,,,,,,,,,,,,,,,,,,,,,,,,,,,,,,,,,,,,,,Yes,https://www.healthsherpa.com/access/105692560273,9/29/2022 20:49,$0.00 ,
YADIRA,PEREZ,,***-**-3814,female,6/16/1976,TRUE,13301 SW 272nd Ln,,Homestead,FL,33032-8585,Miami-Dade,FALSE,FALSE,FALSE,FALSE,3058771976,,Ambetter Value Silver 32,share94,Silver,Ambetter from Sunshine Health,1/1/2022,880.68,857,23.68,2,1575,0,Yes,12/7/2021,"Cieza, Patricia",469972,agent,,Terminated,expired,,4143669459,13596773,Focused VALUE Silver,880.68,86382FL0050009,13301 SW 272nd Ln,,,FALSE,1/14/2022,5/10/2022,3/3/2022,Terminated,2,22000,Spanish,,0,1,3,0,0,0,FALSE,,,2021-12-07 17:49:08 UTC,,,,,,,,MARIA,PEREZ,,***-**-8111,female,10/4/1998,TRUE,,,,,,,,,,,,,,,,,,,,,,,,,,,,,,,,,,,,,,,,,,,,,,,,,,,,,,,,,,,,,,,,Yes,https://www.healthsherpa.com/access/706864102352,6/29/2022 14:16,$0.00 ,
Maria,Garcia,,***-**-1715,female,6/4/1977,TRUE,17650 NW 67th Ave Apt 1403,,Hialeah,FL,33015,Miami-Dade,FALSE,FALSE,FALSE,FALSE,7862957847,mariajuliagarcia@yahoo.com,Ambetter Balanced Care 30,share94,Silver,Ambetter from Sunshine Health,3/1/2022,551.28,490,61.28,1,625,625,Yes,12/7/2021,"Borges, Mario",17420949,agent,,Effectuated,completed,,4138691769,13165572,Clear Silver,551.28,21663FL0130109,17650 NW 67th Ave Apt 1403,,,TRUE,,,12/31/2022,Effectuated,1,18000,Spanish,,0,0,1,0,0,0,FALSE,,,2021-12-07 18:16:02 UTC,,,,,,,,,,,,,,,,,,,,,,,,,,,,,,,,,,,,,,,,,,,,,,,,,,,,,,,,,,,,,,,,,,,,,,,,,,,,,,Yes,https://www.healthsherpa.com/access/402709598463,11/2/2022 18:58,$0.00 ,
Mario,Posada,,,male,1/7/1960,TRUE,3313 Balboa Ave,,McAllen,TX,78503,Hidalgo,FALSE,FALSE,FALSE,FALSE,7135399212,marioposada@yti.com,Blue Advantage Plus Bronze℠ 303,none,Expanded Bronze,Blue Cross and Blue Shield of Texas,2/28/2022,862.9,862.9,0,0,8700,5500,Yes,12/7/2021,"Borges, Mario",17420949,agent,,Effectuated,expired,,4139386890,10914315,Blue Advantage Plus Bronze 303,862.9,33602TX0770198,3313 Balboa Ave,,,TRUE,2/28/2022,,8/31/2022,Effectuated,1,13032,Spanish,,0,2,0,0,0,0,TRUE,,,2022-02-28 21:34:10 UTC,,,,,,,,,,,,,,,,,,,,,,,,,,,,,,,,,,,,,,,,,,,,,,,,,,,,,,,,,,,,,,,,,,,,,,,,,,,,,,Yes,https://www.healthsherpa.com/access/401981205581,8/18/2022 21:44,$0.00 ,
Martin,Pahua Guzman,,***-**-6185,male,3/21/1964,TRUE,1207 E 25th Ave,,Tampa,FL,33605,Hillsborough,FALSE,FALSE,FALSE,FALSE,8135255568,martinpahuaguzman@gmail.com,Ambetter Essential Care 22,none,Expanded Bronze,Ambetter from Sunshine Health,2/28/2022,754.15,754.15,0,0,8700,2500,Yes,12/7/2021,"Rodriguez, Yaneisy",17420949,agent_override,,Effectuated,expired,,4125125718,10853494,Ambetter Essential Care 22,754.15,21663FL0130102,1207 E 25th Ave,,,TRUE,2/28/2022,,8/31/2022,Effectuated,1,30072,Spanish,,0,2,0,0,0,0,FALSE,,,2022-02-28 21:30:06 UTC,,,,,,,,,,,,,,,,,,,,,,,,,,,,,,,,,,,,,,,,,,,,,,,,,,,,,,,,,,,,,,,,,,,,,,,,,,,,,,Yes,https://www.healthsherpa.com/access/352384901209,8/18/2022 21:30,$0.00 ,
Carlos,Santa Cruz Morales,,***-**-9716,male,3/15/1963,TRUE,1715 S Civitan Ave,,Lakeland,FL,33801,Polk,FALSE,FALSE,FALSE,FALSE,8632597873,carlosantacruz.45@gmail.com,"Ambetter Essential Care: $1,500 Medical Deductible",none,Expanded Bronze,Ambetter from Sunshine Health,4/1/2022,1961,1961,0,0,8700,1500,Yes,12/7/2021,"Rodriguez, Yaneisy",17420949,agent_override,,Terminated,expired,,4244979220,13931634,"Ambetter Essential Care: $1,500 Medical Deductible",1961,21663FL0130104,1715 S Civitan Ave,,,FALSE,,5/9/2022,4/30/2022,Terminated,2,34000,Spanish,,0,2,0,0,0,0,TRUE,,,2021-12-07 21:17:08 UTC,,,,,,,,Karla,Santa Cruz Reyes,,,female,11/9/2009,TRUE,,,,,,,,,,,,,,,,,,,,,,,,,,,,,,,,,,,,,,,,,,,,,,,,,,,,,,,,,,,,,,,,Yes,https://www.healthsherpa.com/access/607563510660,8/18/2022 17:40,$0.00 ,
Patricia,Mosqueda de Guajardo,,***-**-7609,female,12/19/1975,TRUE,309 Manor Rd,,Laredo,TX,78041,Webb,FALSE,FALSE,FALSE,FALSE,9566522126,mospa88@gmail.com,Ambetter Balanced Care 32,,Silver,Ambetter from Superior HealthPlan,1/1/2022,1351.35,1314,37.35,3,,,Yes,12/7/2021,"Rodriguez, Yaneisy",17420949,agent_override,,Cancelled,completed,,4244764412,9551055,Focused Silver,1351.35,29418TX0140100,309 Manor Rd,,,FALSE,,1/27/2022,12/31/2022,Cancelled,3,33000,Spanish,,2,0,5,0,0,0,FALSE,,,2021-12-27 16:48:27 UTC,Jesus,Guajardo,,***-**-3497,male,9/10/1973,TRUE,Diego,Guajardo,,***-**-0489,male,4/25/2007,TRUE,,,,,,,,,,,,,,,,,,,,,,,,,,,,,,,,,,,,,,,,,,,,,,,,,,,,,,,,,,,,,,,,Yes,https://www.healthsherpa.com/access/727308283368,8/19/2022 18:42,$0.00 ,
BRENDA,FRAYRE,,***-**-3243,female,7/4/1973,TRUE,2427 Avenue B SW,,Winter Haven,FL,33880,Polk,FALSE,FALSE,FALSE,FALSE,8639346428,lucerorodriguez073@gmail.com,Ambetter Balanced Care 32,none,Silver,Ambetter from Sunshine Health,3/1/2022,1225.06,1225.06,0,3,8700,8100,Yes,12/7/2021,"Rodriguez, Yaneisy",17420949,agent_override,,Terminated,expired,,4240706815,14171247,Focused Silver,1225.06,21663FL0130112,2427 Avenue B SW,,,FALSE,,5/9/2022,3/31/2022,Terminated,4,30000,Spanish,,0,2,0,0,0,0,TRUE,,,2021-12-07 23:22:12 UTC,MANUEL,RODRIGUEZ,,,male,9/5/1981,FALSE,EMANUEL,RODRIGUEZ,,,male,12/21/2007,TRUE,LUCERO,RODRIGUEZ,,***-**-5334,female,2/18/2004,TRUE,,,,,,,,,,,,,,,,,,,,,,,,,,,,,,,,,,,,,,,,,,,,,,,,,,,,,,,,,Yes,https://www.healthsherpa.com/access/146300159142,8/18/2022 20:05,$0.00 ,
Gladis,Garcia,,***-**-6350,female,5/14/1961,FALSE,602 Avenue L,,South Houston,TX,77587-5010,Harris,FALSE,FALSE,FALSE,FALSE,7137020057,ggarcia602@yahoo.com,Ambetter Value Silver 32,share94,Silver,Ambetter from Superior Health Plan,4/1/2022,2071.46,1845,226.46,2,1575,0,Yes,12/7/2021,"Insurance, Yes to",17420949,agent_override,,Terminated,,,4151062657,10517706,Focused VALUE Silver,2071.46,87226TX0100009,602 Avenue L,,,FALSE,,,5/2/2022,Terminated,3,43492,Spanish,,0,0,0,0,0,0,TRUE,,,2022-03-22 19:23:27 UTC,Raul,Garcia,,***-**-6023,male,12/29/1960,TRUE,Stephanie,Garcia,,***-**-1574,female,6/6/1998,TRUE,,,,,,,,,,,,,,,,,,,,,,,,,,,,,,,,,,,,,,,,,,,,,,,,,,,,,,,,,,,,,,,,Yes,https://www.healthsherpa.com/access/481611640193,5/10/2022 20:27,$0.00 ,
GERSY,RODRIGUEZ,,***-**-5215,female,11/27/1990,TRUE,6718 Willow Spring Ct,,Tampa,FL,33615,Hillsborough,FALSE,FALSE,FALSE,FALSE,8138460563,lachuli64@gmail.com,Ambetter Balanced Care 32,share94,Silver,Ambetter from Sunshine Health,1/1/2022,681.8,678,3.8,2,1575,0,Yes,12/14/2021,"Cieza, Patricia",469972,agent,,Effectuated,,,4151111451,9127973,Focused Silver,681.8,21663FL0130112,6718 Willow Spring Ct,,,TRUE,12/15/2021,,12/31/2022,Effectuated,2,25000,Spanish,,0,0,0,0,0,0,TRUE,,,2021-12-15 07:13:46 UTC,,,,,,,,ALEX,ALPIZAR,,***-**-4137,male,12/4/2012,TRUE,,,,,,,,,,,,,,,,,,,,,,,,,,,,,,,,,,,,,,,,,,,,,,,,,,,,,,,,,,,,,,,,Yes,https://www.healthsherpa.com/access/979212177912,11/4/2022 22:38,$0.00 ,
Joel,Berrios Ortiz,,***-**-7131,male,11/16/1975,TRUE,1624 Perdido Ct,,Poinciana,FL,34759,Polk,FALSE,FALSE,FALSE,FALSE,7873941817,jjmate615@gmail.com,Ambetter Balanced Care 32,share94,Silver,Ambetter from Sunshine Health,8/1/2022,559.39,551,8.39,1,1575,0,Yes,12/7/2021,"Cieza, Patricia",469972,agent,,Effectuated,,,4147191383,10472510,Focused Silver,559.39,21663FL0130112,1624 Perdido Ct,,,TRUE,,,12/31/2022,Effectuated,1,15000,Spanish,,0,0,0,0,0,0,TRUE,,,2021-12-08 05:02:02 UTC,,,,,,,,,,,,,,,,,,,,,,,,,,,,,,,,,,,,,,,,,,,,,,,,,,,,,,,,,,,,,,,,,,,,,,,,,,,,,,Yes,https://www.healthsherpa.com/access/79456154261,11/8/2022 16:46,$0.00 ,
WENDY,VASQUEZ,,***-**-0396,female,11/23/1979,TRUE,8745 Palm Breeze Rd,Apt 708,Jacksonville,FL,32256,Duval,FALSE,FALSE,FALSE,FALSE,9212618242,,Ambetter Balanced Care 32,share94,Silver,Ambetter from Sunshine Health,1/1/2022,462.26,455,7.26,1,1575,0,Yes,12/7/2021,"Cieza, Patricia",469972,agent,,Effectuated,,,4141744493,10415455,Focused Silver,462.26,21663FL0130112,8745 Palm Breeze Rd,,,TRUE,12/8/2021,,12/31/2022,Effectuated,3,22000,Spanish,,0,0,0,0,0,0,TRUE,,,2021-12-08 05:24:53 UTC,,,,,,,,JALINDSEY,ALMANZAR,,,female,6/16/2007,FALSE,OZIEL,SANCHEZ,,,male,7/30/2013,FALSE,,,,,,,,,,,,,,,,,,,,,,,,,,,,,,,,,,,,,,,,,,,,,,,,,,,,,,,,,Yes,https://www.healthsherpa.com/access/370377192828,2/23/2022 21:48,$0.00 ,
FRANCISCO,SANCHEZ,,***-**-2228,male,2/19/1976,TRUE,8745 Palm Breeze Rd,Apt 708,Jacksonville,FL,32256,Duval,FALSE,FALSE,FALSE,FALSE,9292618242,,Ambetter Balanced Care 32,share94,Silver,Ambetter from Sunshine Health,1/1/2022,503.77,496,7.77,1,1575,0,Yes,12/7/2021,"Cieza, Patricia",469972,agent,,Effectuated,completed,,4132405039,10262760,Focused Silver,503.77,21663FL0130112,8745 Palm Breeze Rd,,,TRUE,12/8/2021,,12/31/2022,Effectuated,1,18999.96,Spanish,,0,0,2,0,0,0,TRUE,,,2021-12-08 05:30:32 UTC,,,,,,,,,,,,,,,,,,,,,,,,,,,,,,,,,,,,,,,,,,,,,,,,,,,,,,,,,,,,,,,,,,,,,,,,,,,,,,Yes,https://www.healthsherpa.com/access/648550348413,2/23/2022 21:50,$0.00 ,
Mario,Romero,,***-**-0703,male,11/11/1965,TRUE,4514 Kleinway Dr,,Houston,TX,77066-4395,Harris,FALSE,FALSE,FALSE,FALSE,8323120521,shelbyromero@icloud.com,MyBlue Health Bronze℠ 402,share87,Expanded Bronze,Blue Cross and Blue Shield of Texas,5/1/2022,1129.15,1129.15,0,2,8700,7400,Yes,12/8/2021,"Rodriguez, Yaneisy",17420949,agent_override,,Effectuated,completed,,4146022908,9359647,MyBlue Health Bronze 402,1129.15,33602TX0860005,4514 Kleinway Dr,,,TRUE,,,12/31/2022,Effectuated,2,30000,Spanish,,0,0,2,0,0,0,FALSE,,,2021-12-08 16:45:40 UTC,Shelvy,Romero,,***-**-5182,female,10/27/1966,TRUE,,,,,,,,,,,,,,,,,,,,,,,,,,,,,,,,,,,,,,,,,,,,,,,,,,,,,,,,,,,,,,,,,,,,,,,Yes,https://www.healthsherpa.com/access/584818846439,8/18/2022 15:15,$0.00 ,
America,Villareal,,***-**-9141,female,10/12/1962,TRUE,1018 Market St,,Laredo,TX,78040-6252,Webb,FALSE,FALSE,FALSE,FALSE,9569990596,tuasesorsalud2019@gmail.com,Ambetter Virtual Access Bronze ($0 Virtual Primary Care + $0 Virtual Urgent Care + $0 Preferred Labs),,Expanded Bronze,Ambetter from Superior Health Plan,1/1/2022,845.82,845.82,0,1,8550,7000,Yes,12/8/2021,"Rodriguez, Yaneisy",17420949,agent_override,,Terminated,,,4135282572,7532000,Ambetter Virtual Access Bronze ($0 Virtual Primary Care + $0 Virtual Urgent Care + $0 Preferred Labs),845.82,87226TX0050001,1018 Market St,,,FALSE,,,12/31/2022,Cancelled,1,12999.96,Spanish,,0,0,0,0,0,0,FALSE,,,2021-12-08 18:29:56 UTC,,,,,,,,,,,,,,,,,,,,,,,,,,,,,,,,,,,,,,,,,,,,,,,,,,,,,,,,,,,,,,,,,,,,,,,,,,,,,,Yes,https://www.healthsherpa.com/access/569461875989,8/19/2022 18:37,$0.00 ,
MAYRA,CAMPANO SANCHEZ,,***-**-6255,female,11/3/1960,TRUE,4400 SW 112th Pl,,Miami,FL,33165-5562,Miami-Dade,FALSE,FALSE,FALSE,FALSE,7863953470,campanomayra@gmail.com,Ambetter Value Silver 32,share94,Silver,Ambetter from Sunshine Health,2/1/2022,1012.55,985,27.55,1,1575,0,Yes,12/8/2021,"Borges, Mario",18141564,agent_override,,Effectuated,,,4160268516,13118803,Focused VALUE Silver,1012.55,86382FL0050009,4400 SW 112th Pl,,,TRUE,,,12/31/2022,Effectuated,1,13000,Spanish,,0,0,0,0,0,0,TRUE,,,2021-12-08 19:31:25 UTC,,,,,,,,,,,,,,,,,,,,,,,,,,,,,,,,,,,,,,,,,,,,,,,,,,,,,,,,,,,,,,,,,,,,,,,,,,,,,,Yes,https://www.healthsherpa.com/access/903656675164,11/18/2022 17:29,$0.00 ,
Daniela,Arencibia,,***-**-2571,female,12/3/1983,TRUE,2511 SW 129th Ave,,Miami,FL,33175-1833,Miami-Dade,FALSE,FALSE,FALSE,FALSE,3053181953,,Ambetter Value Silver 32,share94,Silver,Ambetter from Sunshine Health,1/1/2022,1469.46,1440,29.46,4,1575,0,Yes,12/8/2021,"Rodriguez, Yaneisy",17420949,agent_override,,Terminated,,,4140942575,5460811,Focused VALUE Silver,1469.46,86382FL0050009,2511 SW 129th Ave,,,FALSE,,5/10/2022,12/31/2022,Cancelled,4,34586.76,English,,0,0,0,0,0,0,TRUE,,,2022-05-10 20:14:07 UTC,Roberto,Gomez,,***-**-1752,male,9/30/1980,TRUE,Sofia,Gomez,,***-**-5858,female,7/2/2019,TRUE,Diego,Gomez,,***-**-5788,male,1/19/2018,TRUE,,,,,,,,,,,,,,,,,,,,,,,,,,,,,,,,,,,,,,,,,,,,,,,,,,,,,,,,,Yes,https://www.healthsherpa.com/access/394695086082,12/13/2022 19:14,$0.00 ,
Eloys,Segundo,,***-**-8968,male,12/23/1977,TRUE,21423 Virginia St,,San Benito,TX,78586,Cameron,FALSE,FALSE,FALSE,FALSE,2104154847,,Ambetter Balanced Care 32,none,Silver,Ambetter from Superior HealthPlan,7/1/2022,491.46,452,39.46,1,8700,8100,Yes,12/8/2021,"Borges, Mario",17420949,agent,,Cancelled,expired,,4133146885,10818867,Ambetter Balanced Care 32,491.46,29418TX0140101,21423 Virginia St,,,FALSE,,8/17/2022,12/31/2022,Cancelled,1,20004,Spanish,,1,0,0,0,0,0,TRUE,,,2021-12-08 20:26:24 UTC,,,,,,,,,,,,,,,,,,,,,,,,,,,,,,,,,,,,,,,,,,,,,,,,,,,,,,,,,,,,,,,,,,,,,,,,,,,,,,Yes,https://www.healthsherpa.com/access/243568136376,8/25/2022 21:12,$0.00 ,
Jorge,Abril Walteros,,***-**-7088,male,9/24/1969,TRUE,3025 Lasistor St,,Orlando,FL,32817,Orange,FALSE,FALSE,FALSE,FALSE,4076248620,recormedico@gmail.com,Ambetter Balanced Care 32,share94,Silver,Ambetter from Sunshine Health,1/1/2022,742.5,731,11.5,1,1575,0,Yes,12/8/2021,"Rodriguez, Yaneisy",17420949,agent_override,,Terminated,completed,,4147599037,12250344,Focused Silver,742.5,21663FL0130112,3025 Lasistor St,,,FALSE,,,12/31/2022,Cancelled,1,13500,Spanish,,0,0,1,0,0,0,TRUE,,,2021-12-08 20:56:53 UTC,,,,,,,,,,,,,,,,,,,,,,,,,,,,,,,,,,,,,,,,,,,,,,,,,,,,,,,,,,,,,,,,,,,,,,,,,,,,,,Yes,https://www.healthsherpa.com/access/149784845680,12/13/2022 19:14,$0.00 ,
MARIA,RAMIREZ PADILLA,,***-**-1611,female,10/14/1976,TRUE,510 Sharon Hill Ct,Trlr 510,Winter Haven,FL,33880-1050,Polk,FALSE,FALSE,FALSE,FALSE,8638778054,mariacarmen16@live.com,Ambetter Balanced Care 32,share94,Silver,Ambetter from Sunshine Health,1/1/2022,538.5,530,8.5,1,1575,0,Yes,12/8/2021,"Borges, Mario",17420949,agent,,Effectuated,action_needed,,4142412027,11068395,Focused Silver,538.5,21663FL0130112,510 Sharon Hill Ct,,,TRUE,12/8/2021,,12/31/2022,Effectuated,3,22000,Spanish,,1,0,0,0,0,0,FALSE,,,2021-12-08 21:37:14 UTC,,,,,,,,EFREN,MONTES,,***-**-1977,male,1/21/2003,FALSE,MARIA,MONTES,,***-**-8071,female,10/3/2007,FALSE,,,,,,,,,,,,,,,,,,,,,,,,,,,,,,,,,,,,,,,,,,,,,,,,,,,,,,,,,Yes,https://www.healthsherpa.com/access/748121630693,8/18/2022 15:37,$0.00 ,
LUIS,PALOMINO,,***-**-9703,male,9/17/1990,TRUE,12601 FM917,,Alvarado,TX,76009,Johnson,FALSE,FALSE,FALSE,FALSE,2142575329,PALOMINOFLORESLUISFELIPE@GMAIL.Com,Ambetter Balanced Care 30,share94,Silver,Ambetter from Superior HealthPlan,1/1/2022,456.65,456.65,0,1,625,625,Yes,12/8/2021,"Rodriguez, Yaneisy",17420949,agent_override,,Effectuated,expired,,4248567169,9243967,Clear Silver,456.65,29418TX0140096,12601 FM917,,,TRUE,3/7/2022,,12/31/2022,Effectuated,1,18012,Spanish,,0,1,0,0,0,0,TRUE,,,2022-03-07 17:13:07 UTC,,,,,,,,,,,,,,,,,,,,,,,,,,,,,,,,,,,,,,,,,,,,,,,,,,,,,,,,,,,,,,,,,,,,,,,,,,,,,,Yes,https://www.healthsherpa.com/access/805452060278,8/19/2022 17:12,$0.00 ,
Dunia,Chavez,,,female,4/15/1977,TRUE,5015 Cherrycrest Ln,Apt C,Charlotte,NC,28217,Mecklenburg,FALSE,FALSE,FALSE,FALSE,7043901739,duniachavez@yti.com,Blue Home Silver 5300 + 3 Free PCP with Novant Health,none,Silver,Blue Cross and Blue Shield of NC,1/1/2022,1037.74,1037.74,0,0,8700,5300,Yes,12/8/2021,"Rodriguez, Yaneisy",18141564,agent_healthsherpa_referral,,Effectuated,expired,,4138338911,5088394,Blue Home Silver 5300 + 3 Free PCP with Novant Health,1037.74,11512NC0340017,5015 Cherrycrest Ln,,,TRUE,3/7/2022,,9/30/2022,Effectuated,2,17916,Spanish,,0,3,0,0,0,0,TRUE,,,2022-03-07 16:35:53 UTC,Elder,Lotes,,,male,5/1/1977,TRUE,,,,,,,,,,,,,,,,,,,,,,,,,,,,,,,,,,,,,,,,,,,,,,,,,,,,,,,,,,,,,,,,,,,,,,,Yes,https://www.healthsherpa.com/access/147066724235,8/22/2022 22:27,$0.00 ,$25.00 
Angelica,Diaz,,***-**-9150,female,9/13/1962,TRUE,1302 N Shiloh Rd APT 266,,Garland,TX,75042,Dallas,FALSE,FALSE,FALSE,FALSE,2144905171,ad888341@gmail.com,MyBlue Health Bronze℠ 402,share94,Expanded Bronze,Blue Cross and Blue Shield of Texas,6/1/2022,684.89,684.89,0,1,8700,7400,Yes,12/8/2021,"Borges, Mario",17420949,agent,,Effectuated,,,4153938235,8504615,MyBlue Health Bronze 402,684.89,33602TX0860002,1302 N Shiloh Rd APT 266,,,TRUE,,,12/31/2022,Effectuated,1,14000,English,,0,0,0,0,0,0,FALSE,,,2021-12-30 17:56:52 UTC,,,,,,,,,,,,,,,,,,,,,,,,,,,,,,,,,,,,,,,,,,,,,,,,,,,,,,,,,,,,,,,,,,,,,,,,,,,,,,Yes,https://www.healthsherpa.com/access/119713124319,6/16/2022 16:46,$0.00 ,
Juan,Ramirez Bedoya,,***-**-8784,male,4/30/1978,TRUE,2123 Renaissance Blvd,Apt 105,Miramar,FL,33025-5689,Broward,FALSE,FALSE,FALSE,FALSE,9544947321,jfrb1@hotmail.com,Ambetter Select Silver 32,share94,Silver,Ambetter from Sunshine Health,2/1/2022,473.81,449,24.81,1,1575,0,Yes,12/8/2021,"Rodriguez, Yaneisy",18141564,agent,,Effectuated,completed,,4160276350,14853920,Focused SELECT Silver with Select Providers,473.81,86382FL0040009,2123 Renaissance Blvd,,,TRUE,,,12/31/2022,Effectuated,1,13220.04,Spanish,,0,0,1,0,0,0,TRUE,,,2021-12-08 23:45:10 UTC,,,,,,,,,,,,,,,,,,,,,,,,,,,,,,,,,,,,,,,,,,,,,,,,,,,,,,,,,,,,,,,,,,,,,,,,,,,,,,Yes,https://www.healthsherpa.com/access/569257732632,8/19/2022 15:03,$0.00 ,
Divan,Carrasco,,***-**-6086,male,3/11/2001,TRUE,915 W 26th St,,Odessa,TX,79763-2532,Ector,FALSE,FALSE,FALSE,FALSE,4327031720,olylpz71@gmail.com,Blue Advantage Silver HMO℠ 205,share94,Silver,Blue Cross and Blue Shield of Texas,1/1/2022,368.55,351,17.55,1,900,0,Yes,12/9/2021,"Rodriguez, Yaneisy",17420949,agent_override,,Effectuated,,,4249341068,9798517,Blue Advantage Silver HMO℠ 205,368.55,33602TX0460695,915 W 26th St,,,TRUE,1/6/2022,,12/31/2022,Effectuated,1,19000,Spanish,,0,0,0,0,0,0,FALSE,,,2021-12-09 15:17:08 UTC,,,,,,,,,,,,,,,,,,,,,,,,,,,,,,,,,,,,,,,,,,,,,,,,,,,,,,,,,,,,,,,,,,,,,,,,,,,,,,Yes,https://www.healthsherpa.com/access/117493091056,12/8/2022 15:29,$0.00 ,
Said,Hernandez Ramos,,***-**-5142,male,5/10/1988,TRUE,4418 Burkhardt Ave,,Dayton,OH,45431,Montgomery,FALSE,FALSE,FALSE,FALSE,9375454743,saidh1088@icloud.com,Ambetter Essential Care 1,none,Bronze,Ambetter from Buckeye Health Plan,1/1/2022,337.25,337.25,0,0,8600,8600,Yes,12/9/2021,"Borges, Mario",17420949,agent,,Effectuated,expired,,4250468515,2615670,Clear Bronze,337.25,41047OH0010043,4418 Burkhardt Ave,,,TRUE,3/7/2022,,9/30/2022,Effectuated,3,30012,Spanish,,0,2,0,0,0,0,TRUE,,,2022-03-07 21:39:15 UTC,Emma,Barahona de Hernandez,,,female,4/17/1990,FALSE,Arianna,Hernandez Barahona,,***-**-5791,female,12/12/2014,FALSE,,,,,,,,,,,,,,,,,,,,,,,,,,,,,,,,,,,,,,,,,,,,,,,,,,,,,,,,,,,,,,,,Yes,https://www.healthsherpa.com/access/527876704873,8/19/2022 21:12,$0.00 ,
Jesus,Ortiz Guzman,,***-**-9709,male,3/18/1984,TRUE,1010 N Orient St,,Fort Stockton,TX,79735,Pecos,FALSE,FALSE,FALSE,FALSE,9153094561,dananahomiz27@gmail.com,Blue Advantage Silver HMO℠ 205,share94,Silver,Blue Cross and Blue Shield of Texas,3/7/2022,985.3,985.3,0,1,900,0,Yes,12/9/2021,"Rodriguez, Yaneisy",17420949,agent_override,,Terminated,expired,,4130893261,8001259,Blue Advantage Silver HMO℠ 205,985.3,33602TX0460704,1010 N Orient St,,,FALSE,3/7/2022,6/6/2022,3/31/2022,Terminated,7,40200,Spanish,,0,1,0,0,0,0,FALSE,,,2022-03-07 17:39:48 UTC,Carla,Villalobos Dorado,,***-**-4625,female,11/2/1989,TRUE,Nicole,Ortiz Villalobos,,,female,2/9/2013,FALSE,Nathalie,Ortiz Villalobos,,,female,3/23/2012,FALSE,Jesus,Ortiz Villalobos,,,male,8/1/2015,FALSE,Naylett,Ortiz Villalobos,,,female,4/12/2017,FALSE,Naylea,Ortiz Villalobos,,,female,4/12/2017,FALSE,,,,,,,,,,,,,,,,,,,,,,,,,,,,,,,,,,,,Yes,https://www.healthsherpa.com/access/362836259496,9/28/2022 15:12,$0.00 ,
Hector,Franco Osorio,,***-**-2168,male,12/7/1962,TRUE,16522 SW 114th Ct,,Miami,FL,33157-2729,Miami-Dade,FALSE,FALSE,FALSE,FALSE,7864262666,hectorfranco14@yahoo.es,Ambetter Value Silver 32,share94,Silver,Ambetter from Sunshine Health,1/1/2022,937.96,913,24.96,1,1575,0,Yes,12/9/2021,"Rodriguez, Yaneisy",17420949,agent_override,,Effectuated,,,4146641695,13379652,Focused VALUE Silver,937.96,86382FL0050009,16522 SW 114th Ct,,,TRUE,5/10/2022,,12/31/2022,Effectuated,1,13200,Spanish,,0,0,0,0,0,0,TRUE,,,2022-05-10 19:54:59 UTC,,,,,,,,,,,,,,,,,,,,,,,,,,,,,,,,,,,,,,,,,,,,,,,,,,,,,,,,,,,,,,,,,,,,,,,,,,,,,,Yes,https://www.healthsherpa.com/access/959149341693,6/16/2022 16:27,$0.00 ,
Marina,Flores,,***-**-7076,female,10/20/1975,TRUE,623 HAYS AVE,,MOUNT PLEASANT,TX,75455,Titus,FALSE,FALSE,FALSE,FALSE,9033057837,sanchezmarina763@gmail.com,Blue Advantage Silver HMO℠ 205,share94,Silver,Blue Cross and Blue Shield of Texas,1/1/2022,610.47,610.47,0,1,900,0,Yes,12/9/2021,"Rodriguez, Yaneisy",17420949,agent_override,,Effectuated,,,4226201214,9847695,Blue Advantage Silver HMO℠ 205,610.47,33602TX0460704,623 HAYS AVE,,,TRUE,9/5/2022,,12/31/2022,Effectuated,6,36000,Spanish,,0,0,0,0,0,0,TRUE,,,2022-09-05 17:20:39 UTC,,,,,,,,Alondra,Garcia,,,female,6/9/2004,FALSE,Lia,Contreras,,,female,3/9/2010,FALSE,Nicole,Contreras,,,female,8/1/2014,FALSE,Marco,Garcia,,,male,5/22/2003,FALSE,Danna,Contreras,,,female,12/28/2012,FALSE,,,,,,,,,,,,,,,,,,,,,,,,,,,,,,,,,,,,Yes,https://www.healthsherpa.com/access/535396467158,9/5/2022 21:57,$0.00 ,
Maria,Medina Penaloza,,,female,5/20/1984,TRUE,8928 R and R Cir,,Kemp,TX,75143,Kaufman,FALSE,FALSE,FALSE,FALSE,4692158271,maria@yti.com,Blue Advantage Silver HMO℠ 205,share94,Silver,Blue Cross and Blue Shield of Texas,1/1/2022,1194.76,1194.76,0,0,900,0,Yes,12/9/2021,"Borges, Mario",17420949,agent,,Cancelled,expired,,4204145387,8165615,Blue Advantage Silver HMO℠ 205,1194.76,33602TX0460686,8928 R and R Cir,,,FALSE,,1/6/2022,12/31/2022,Cancelled,3,27000,Spanish,,0,3,3,0,0,0,TRUE,,,2021-12-09 19:32:25 UTC,,,,,,,,Azul,Rojo Penaloza,,,female,1/27/2010,TRUE,Froilan,Rojo Penaloza,,,male,1/27/2010,TRUE,,,,,,,,,,,,,,,,,,,,,,,,,,,,,,,,,,,,,,,,,,,,,,,,,,,,,,,,,Yes,https://www.healthsherpa.com/access/960295209958,8/22/2022 19:22,$0.00 ,
Juan,Rocha,,***-**-4242,male,9/4/1981,TRUE,2287 Stubbs School Rd,,Victoria,TX,77905,Victoria,FALSE,FALSE,FALSE,FALSE,3612122650,rochajuan620@gmail.com,Ambetter Balanced Care 30,share94,Silver,Ambetter from Superior HealthPlan,1/1/2022,543.85,543.85,0,0,625,625,Yes,12/9/2021,"Borges, Mario",17420949,agent,,Terminated,action_needed,,4129524827,9942466,Ambetter Balanced Care 30,543.85,29418TX0140097,2287 Stubbs School Rd,,,FALSE,,,12/31/2022,Cancelled,1,13008,Spanish,,3,0,0,0,0,0,TRUE,,,2021-12-09 21:01:57 UTC,,,,,,,,,,,,,,,,,,,,,,,,,,,,,,,,,,,,,,,,,,,,,,,,,,,,,,,,,,,,,,,,,,,,,,,,,,,,,,Yes,https://www.healthsherpa.com/access/320745471360,9/29/2022 20:35,$0.00 ,
Rocio,Correnti,,***-**-5733,female,4/17/1975,TRUE,18 Whistler Trce,,Ponte Vedra,FL,32081-8477,St. Johns,FALSE,FALSE,FALSE,FALSE,9546294247,Chio.correnti@hotmail.com,Ambetter Balanced Care 32,share94,Silver,Ambetter from Sunshine Health,1/1/2022,1762.8,1746,16.8,3,1575,0,Yes,12/9/2021,"Rodriguez, Yaneisy",17420949,agent_override,,Effectuated,completed,,4130510249,7911352,Focused Silver,1762.8,21663FL0130112,18 Whistler Trce,,,TRUE,,,12/31/2022,Effectuated,3,32000,Spanish,,0,0,3,0,0,0,TRUE,,,2021-12-09 21:59:27 UTC,,,,,,,,Claudia Ximena,Carpio Alcantara,,***-**-4738,female,3/18/2005,TRUE,Soledad,Delgado De La Cruz,,***-**-5447,female,9/18/1955,TRUE,,,,,,,,,,,,,,,,,,,,,,,,,,,,,,,,,,,,,,,,,,,,,,,,,,,,,,,,,Yes,https://www.healthsherpa.com/access/389880199255,8/19/2022 20:27,$0.00 ,
MARTIN,PORRAS,,***-**-8051,male,5/5/1989,TRUE,5502 North St,,Wimauma,FL,33598,Hillsborough,FALSE,FALSE,FALSE,FALSE,8137014519,,Ambetter Essential Care: $0 Medical Deductible,share94,Expanded Bronze,Ambetter from Sunshine Health,4/1/2022,399.07,399.07,0,1,8700,0,Yes,12/9/2021,"Rodriguez, Yaneisy",17420949,agent_override,,Effectuated,completed,,4148441938,14622075,Elite Bronze,399.07,21663FL0130106,5502 North St,,,TRUE,,,12/31/2022,Effectuated,1,15000,Spanish,,0,0,1,0,0,0,FALSE,,,2021-12-09 23:42:01 UTC,,,,,,,,,,,,,,,,,,,,,,,,,,,,,,,,,,,,,,,,,,,,,,,,,,,,,,,,,,,,,,,,,,,,,,,,,,,,,,Yes,https://www.healthsherpa.com/access/781646906082,6/16/2022 17:15,$0.00 ,
Roberto,Corrales Rodriguez,,***-**-7948,male,1/24/1971,TRUE,10868 Sakonnet River Dr,,Tampa,FL,33615-3380,Hillsborough,FALSE,FALSE,FALSE,FALSE,8135479498,rcorrales1971@gmail.com,Ambetter Balanced Care 32,share94,Silver,Ambetter from Sunshine Health,1/1/2022,1648.18,1622,26.18,3,1575,0,Yes,12/10/2021,"Rodriguez, Yaneisy",17420949,agent_override,,Effectuated,completed,,4135736025,9139380,Focused Silver,1648.18,21663FL0130112,10868 Sakonnet River Dr,,,TRUE,12/10/2021,,12/31/2022,Effectuated,3,30000,Spanish,,0,0,3,0,0,0,FALSE,,,2021-12-10 15:34:53 UTC,Gloria,Martinez,,***-**-5448,female,10/5/1970,TRUE,ROBERTO R,CORRALES MARTINEZ,,***-**-7085,male,12/28/2000,TRUE,,,,,,,,,,,,,,,,,,,,,,,,,,,,,,,,,,,,,,,,,,,,,,,,,,,,,,,,,,,,,,,,Yes,https://www.healthsherpa.com/access/327989471945,12/13/2022 22:51,$0.00 ,
Virginio,Benitez Carreon,,***-**-8456,male,1/31/1969,TRUE,2605 Studley Rd,,Charlotte,NC,28212-1562,Mecklenburg,FALSE,FALSE,FALSE,FALSE,7044916091,virginiobenitez@gmail.com,Blue Home Silver $0 Deductible-III with Novant Health,share94,Silver,Blue Cross and Blue Shield of NC,6/1/2022,795.73,757.7,38.03,1,650,0,Yes,12/10/2021,"Borges, Mario",17420949,agent_healthsherpa_referral,,PendingEffectuation,expired,,4126248259,5684437,Blue Home Silver 5300 + 3 Free PCP with Novant Health,795.73,11512NC0340017,2605 Studley Rd,,,TRUE,,,12/31/2022,Effectuated,4,34000,Spanish,,0,1,0,0,0,0,TRUE,,,2022-03-28 15:46:47 UTC,Bertha,Rodriguez,,,female,1/7/1971,FALSE,Alma,Benitez Menendez,,,female,9/7/2005,FALSE,Galia,Menendez,,,female,5/9/2005,FALSE,,,,,,,,,,,,,,,,,,,,,,,,,,,,,,,,,,,,,,,,,,,,,,,,,,,,,,,,,Yes,https://www.healthsherpa.com/access/382922947775,6/16/2022 17:05,$0.00 ,$140.00 
MAURO,IXQUIACTAP,,***-**-5638,male,1/22/1991,TRUE,930 Menchaca St,,San Antonio,TX,78207-1117,Bexar,FALSE,FALSE,FALSE,FALSE,4802417020,,Ambetter Value Silver 32,share73,Silver,Ambetter from Superior Health Plan,5/1/2022,1337.08,1207,130.08,4,6000,5100,Yes,12/10/2021,"Rodriguez, Yaneisy",17420949,agent_override,,Effectuated,completed,,4253454279,11024449,Focused VALUE Silver,1337.08,87226TX0080009,930 Menchaca St,,,TRUE,,,12/31/2022,Effectuated,4,53186,Spanish,,0,0,1,0,0,0,FALSE,,,2022-03-11 15:23:43 UTC,KRYSTAL,IXQUIACTAP,,***-**-0352,female,9/7/1985,TRUE,MARLENE,IXQUIACTAP,,***-**-4067,female,11/30/2004,TRUE,ALEXIS,IXQUIACTAP,,***-**-9794,male,9/20/2006,TRUE,,,,,,,,,,,,,,,,,,,,,,,,,,,,,,,,,,,,,,,,,,,,,,,,,,,,,,,,,Yes,https://www.healthsherpa.com/access/725737862127,8/18/2022 16:45,$0.00 ,
Antonio,Santiago Sanchez,,***-**-3470,male,9/2/1968,TRUE,659 Glynlea Rd,,Jacksonville,FL,32216,Duval,FALSE,FALSE,FALSE,FALSE,9048028164,,Ambetter Balanced Care 32,none,Silver,Ambetter from Sunshine Health,1/1/2022,1039.99,1023,16.99,2,8700,8100,Yes,12/10/2021,"Rodriguez, Yaneisy",17420949,agent_override,,Terminated,completed,,4147667552,9265370,Focused Silver,1039.99,21663FL0130112,659 Glynlea Rd,,,FALSE,2/13/2022,5/9/2022,2/28/2022,Terminated,2,18000,Spanish,,1,0,2,0,0,0,TRUE,,,2021-12-10 18:23:34 UTC,,,,,,,,Keishla,Santiago,,,female,10/29/2002,TRUE,,,,,,,,,,,,,,,,,,,,,,,,,,,,,,,,,,,,,,,,,,,,,,,,,,,,,,,,,,,,,,,,Yes,https://www.healthsherpa.com/access/718452424260,6/16/2022 16:45,$0.00 ,
Luis,Gomez,,***-**-6706,male,7/15/1962,TRUE,2418 N MacArthur Blvd,,Irving,TX,75062-9400,Dallas,FALSE,FALSE,FALSE,FALSE,4696882313,luisgomez1@mozej.com,Ambetter Value Silver 32,share94,Silver,Ambetter from Superior Health Plan,1/1/2022,886.33,804,82.33,1,1575,0,Yes,12/10/2021,"Borges, Mario",17420949,agent,,Effectuated,completed,,4206680722,9339927,Focused VALUE Silver,886.33,87226TX0060009,2418 N MacArthur Blvd,,,TRUE,5/10/2022,,12/31/2022,Effectuated,1,18000,Spanish,,0,0,1,0,0,0,FALSE,,,2022-05-10 18:33:11 UTC,,,,,,,,,,,,,,,,,,,,,,,,,,,,,,,,,,,,,,,,,,,,,,,,,,,,,,,,,,,,,,,,,,,,,,,,,,,,,,Yes,https://www.healthsherpa.com/access/255825050349,8/18/2022 21:33,$0.00 ,
JAVIER,SOTO,,***-**-4223,male,3/11/1967,TRUE,911 S Dallas St,,Midland,TX,79701,Midland,FALSE,FALSE,FALSE,FALSE,4326031087,,Blue Advantage Plus Gold℠ 203,share73,Gold,Blue Cross and Blue Shield of Texas,8/1/2022,1575.55,1509,66.55,3,8700,850,Yes,12/10/2021,"Borges, Mario",17420949,agent,,Effectuated,insufficient_documentation,,4254039971,11009573,Blue Advantage Plus Gold℠ 203,1575.55,33602TX0770146,911 S Dallas St,,,TRUE,,,12/31/2022,Effectuated,4,65004,Spanish,,1,1,1,0,0,0,FALSE,,,2022-03-14 15:08:56 UTC,MARIA,SOTO,,***-**-0712,female,8/15/1980,TRUE,FRIDA-ERANDI,SOTO,,***-**-5063,female,12/19/2006,TRUE,MARIELA,SOTO,,***-**-6288,female,10/26/2008,TRUE,,,,,,,,,,,,,,,,,,,,,,,,,,,,,,,,,,,,,,,,,,,,,,,,,,,,,,,,,Yes,https://www.healthsherpa.com/access/105455446584,8/18/2022 18:48,$0.00 ,
Luis,Cruz,,***-**-2048,male,3/15/1985,TRUE,222 S 14th St,,Haines City,FL,33844,Polk,FALSE,FALSE,FALSE,FALSE,8632361359,,Ambetter Essential Care: $0 Medical Deductible,share94,Expanded Bronze,Ambetter from Sunshine Health,1/1/2022,436.66,436.66,0,1,8700,0,Yes,12/10/2021,"Borges, Mario",17420949,agent,,Effectuated,completed,,4151488295,11081185,Elite Bronze,436.66,21663FL0130106,222 S 14th St,,,TRUE,12/23/2021,,12/31/2022,Effectuated,6,36000,Spanish,,0,0,1,0,0,0,TRUE,,,2021-12-10 21:18:12 UTC,VERONICA,CRUZ,,,female,12/13/1987,FALSE,Jose,Cruz,,,male,9/7/2005,FALSE,Jaime,Cruz,,,male,4/6/2007,FALSE,Lizbeth,Cruz,,,female,6/23/2013,FALSE,Joel,Cruz,,,male,4/29/2009,FALSE,,,,,,,,,,,,,,,,,,,,,,,,,,,,,,,,,,,,,,,,,,,Yes,https://www.healthsherpa.com/access/603217574995,6/16/2022 16:29,$0.00 ,
Ricardo,Madrid,,***-**-4797,male,6/3/1976,TRUE,2931 NW 49th St,,Miami,FL,33142-3556,Miami-Dade,FALSE,FALSE,FALSE,FALSE,7864770334,,Ambetter Value Silver 32,share94,Silver,Ambetter from Sunshine Health,8/1/2022,520.33,520.33,0,1,1575,0,Yes,12/10/2021,"Rodriguez, Yaneisy",18141564,agent,,Effectuated,completed,,4129673378,12973159,Focused VALUE Silver,520.33,86382FL0050009,2931 NW 49th St,,,TRUE,,,12/31/2022,Effectuated,1,15000,Spanish,,0,0,1,0,0,0,TRUE,,,2021-12-10 21:25:38 UTC,,,,,,,,,,,,,,,,,,,,,,,,,,,,,,,,,,,,,,,,,,,,,,,,,,,,,,,,,,,,,,,,,,,,,,,,,,,,,,Yes,https://www.healthsherpa.com/access/420169275425,8/22/2022 21:10,$0.00 ,
Mauricio,Pena,,,male,9/22/1995,TRUE,2711 N 10th St,,Tampa,FL,33605-2503,Hillsborough,FALSE,FALSE,FALSE,FALSE,8133272671,Penamauricio95@gmail.com,Ambetter Essential Care: $0 Medical Deductible,share94,Expanded Bronze,Ambetter from Sunshine Health,6/1/2022,345.44,345.44,0,1,8700,0,Yes,12/10/2021,"Rodriguez, Yaneisy",18141564,agent,,Effectuated,completed,,4146229307,14921153,Elite Bronze,345.44,21663FL0130106,2711 N 10th St,,,TRUE,,,12/31/2022,Effectuated,1,15000,Spanish,,0,0,2,0,0,0,FALSE,,,2022-02-28 15:07:50 UTC,,,,,,,,,,,,,,,,,,,,,,,,,,,,,,,,,,,,,,,,,,,,,,,,,,,,,,,,,,,,,,,,,,,,,,,,,,,,,,Yes,https://www.healthsherpa.com/access/33450512924,9/27/2022 17:45,$0.00 ,
Niola,Roche,,***-**-8613,female,5/7/1960,TRUE,3630 Sadge Ln,,Irving,TX,75062-8400,Dallas,FALSE,FALSE,FALSE,FALSE,2145547352,aloin7@yahoo.com,MyBlue Health Silver℠ 405,none,Silver,Blue Cross and Blue Shield of Texas,4/1/2022,933.72,868,65.72,1,8700,3550,Yes,12/10/2021,"Borges, Mario",17420949,agent,,Terminated,expired,,4129110950,9540124,MyBlue Health Silver 405,933.72,33602TX0860007,3630 Sadge Ln,,,FALSE,,6/16/2022,5/31/2022,Terminated,1,19296,Spanish,,0,1,1,0,0,0,TRUE,,,2021-12-10 21:58:22 UTC,,,,,,,,,,,,,,,,,,,,,,,,,,,,,,,,,,,,,,,,,,,,,,,,,,,,,,,,,,,,,,,,,,,,,,,,,,,,,,Yes,https://www.healthsherpa.com/access/862748935302,6/16/2022 16:07,$0.00 ,
Guadalupe,Lopez,,***-**-5573,female,12/12/1967,TRUE,7960 Topo Chico Cir Apt A,,Brownsville,TX,78526-1347,Cameron,FALSE,FALSE,FALSE,FALSE,9563460358,lupita.lopez121267@gmail.com,Ambetter Balanced Care 32 + Vision + Adult Dental,share73,Silver,Ambetter from Superior HealthPlan,3/1/2022,782.21,696,86.21,1,6000,5100,Yes,12/13/2021,"Rodriguez, Yaneisy",17420949,agent_override,,Terminated,expired,,4149624844,3914609,Ambetter Balanced Care 32 + Vision + Adult Dental,782.21,29418TX0160101,7960 Topo Chico Cir Apt A,,,FALSE,,5/9/2022,12/31/2022,Cancelled,2,19960,English,,0,2,0,0,0,0,FALSE,,,2022-03-29 15:54:15 UTC,Daniel,Lopez,,***-**-5557,male,12/19/1946,FALSE,Ruperto,Lopez,,,male,4/23/2004,TRUE,Francisco,Lopez,,***-**-6808,male,7/18/2010,TRUE,Ruperto,Lopez,,,male,10/28/1979,FALSE,,,,,,,,,,,,,,,,,,,,,,,,,,,,,,,,,,,,,,,,,,,,,,,,,,Yes,https://www.healthsherpa.com/access/658986832413,8/18/2022 19:53,$0.00 ,
Mariana M.,Leon,,***-**-7583,female,3/11/1964,TRUE,8720 SW 25th St,,Miami,FL,33165-2017,Miami-Dade,FALSE,FALSE,FALSE,FALSE,7863937779,mariypabli@mail.com,Ambetter Balanced Care 32,share94,Silver,Ambetter from Sunshine Health,2/1/2022,979.77,855,124.77,1,1575,0,Yes,12/13/2021,"Borges, Mario",18141564,agent_override,,Effectuated,,,4130519865,7882355,Focused Silver,979.77,21663FL0130113,8720 SW 25th St,,,TRUE,2/3/2022,,12/31/2022,Effectuated,2,26000,Spanish,,0,0,0,0,0,0,TRUE,,,2021-12-13 17:13:36 UTC,Pablo,Suarez,,,male,2/5/1953,FALSE,,,,,,,,,,,,,,,,,,,,,,,,,,,,,,,,,,,,,,,,,,,,,,,,,,,,,,,,,,,,,,,,,,,,,,,Yes,https://www.healthsherpa.com/access/170787343888,11/3/2022 22:40,$0.00 ,
Angel,Fonseca,,***-**-3847,male,12/17/1968,TRUE,1510 Pine St,,Orlando,FL,32824,Orange,FALSE,FALSE,FALSE,FALSE,4073257457,,Ambetter Balanced Care 32 + Vision + Adult Dental,none,Silver,Ambetter from Sunshine Health,1/1/2022,803.65,748,55.65,1,8700,8100,Yes,12/13/2021,"Rodriguez, Yaneisy",18141564,agent,,Terminated,completed,,4161714207,12746496,Focused Silver + Vision + Adult Dental,803.65,21663FL0150112,1510 Pine St,,,FALSE,,,12/31/2022,Cancelled,1,22008,Spanish,,0,0,1,0,0,0,TRUE,,,2021-12-13 16:57:49 UTC,,,,,,,,,,,,,,,,,,,,,,,,,,,,,,,,,,,,,,,,,,,,,,,,,,,,,,,,,,,,,,,,,,,,,,,,,,,,,,Yes,https://www.healthsherpa.com/access/758478767755,6/16/2022 16:53,$0.00 ,
Lorenzo,Poblete,,***-**-9708,male,5/6/1970,TRUE,860 NE 78th St,Apt 307,Miami,FL,33138,Miami-Dade,FALSE,FALSE,FALSE,FALSE,7862855644,lorenzoboss2002@yahoo.com,Ambetter Value Silver 11,share94,Silver,Ambetter from Sunshine Health,9/1/2022,705.04,685,20.04,1,1075,0,Yes,12/13/2021,"Borges, Mario",17420949,agent,,Effectuated,,,4143047761,13381092,Complete VALUE Silver,705.04,86382FL0050006,860 NE 78th St,,,TRUE,,,12/31/2022,Effectuated,1,16000,Spanish,,0,0,0,0,0,0,FALSE,,,2021-12-13 18:18:56 UTC,,,,,,,,,,,,,,,,,,,,,,,,,,,,,,,,,,,,,,,,,,,,,,,,,,,,,,,,,,,,,,,,,,,,,,,,,,,,,,Yes,https://www.healthsherpa.com/access/568490529272,11/7/2022 23:23,$0.00 ,
Ivan,Santiago,,***-**-6265,male,4/15/1957,TRUE,705 Brookhaven Ct Apt 101,,Springdale,AR,72764-6175,Benton,FALSE,FALSE,FALSE,FALSE,4795222585,Rev.ivansantiago@gmail.com,Ambetter Balanced Care 12,share94,Silver,Ambetter of Arkansas,1/1/2022,908.16,908.07,0.09,1,1400,0,Yes,12/13/2021,"Rodriguez, Yaneisy",17420949,agent_override,,Terminated,expired,,4155663484,3189397,Everyday Silver,908.16,62141AR0080012,705 Brookhaven Ct Apt 101,,,FALSE,3/7/2022,5/9/2022,1/31/2022,Terminated,1,18000,Spanish,,0,2,0,0,0,0,FALSE,,,2022-03-07 18:49:57 UTC,,,,,,,,,,,,,,,,,,,,,,,,,,,,,,,,,,,,,,,,,,,,,,,,,,,,,,,,,,,,,,,,,,,,,,,,,,,,,,Yes,https://www.healthsherpa.com/access/829828897064,7/31/2022 18:22,$0.00 ,
Miguel,Colin,,,male,6/29/1997,TRUE,3104 Avenue K NW,,Winter Haven,FL,33881-3903,Polk,FALSE,FALSE,FALSE,FALSE,8632471670,,Ambetter Essential Care: $0 Medical Deductible,share94,Expanded Bronze,Ambetter from Sunshine Health,9/1/2022,356.43,356.43,0,1,8700,0,Yes,12/13/2021,"Rodriguez, Yaneisy",18141564,agent,,Effectuated,completed,,4233497019,12084314,Elite Bronze,356.43,21663FL0130106,3104 Avenue K NW,,,TRUE,9/16/2022,,12/31/2022,Effectuated,2,18000,Spanish,,1,0,2,0,0,0,FALSE,,,2021-12-13 19:17:24 UTC,,,,,,,,Isabel,COLIN,,,female,7/20/2017,FALSE,,,,,,,,,,,,,,,,,,,,,,,,,,,,,,,,,,,,,,,,,,,,,,,,,,,,,,,,,,,,,,,,Yes,https://www.healthsherpa.com/access/926191649428,9/16/2022 13:10,$0.00 ,
Hugo,Sanchez,,***-**-9482,male,6/19/1964,TRUE,11000 Roger Dr,Apt A,New Orleans,LA,70128,Orleans,FALSE,FALSE,FALSE,FALSE,4692158914,hs6756127@gmail.com,Ambetter Balanced Care 32,none,Silver,Ambetter from Louisiana Healthcare Connections,8/1/2022,2007.48,1975,32.48,0,8700,8100,Yes,12/13/2021,"Rodriguez, Yaneisy",17420949,agent_override,,Effectuated,completed,,4261558703,4274539,Focused Silver,2007.48,61604LA0010012,11000 Roger Dr,,,TRUE,,,12/31/2022,Effectuated,3,32000,Spanish,,0,0,4,0,0,0,FALSE,,,2022-06-06 20:12:26 UTC,Roselis,Ordosgoitia Ruiz,,***-**-5680,female,10/29/1968,TRUE,Alejandra,Arias Ordosgoitia,,***-**-7613,female,2/1/2006,TRUE,,,,,,,,,,,,,,,,,,,,,,,,,,,,,,,,,,,,,,,,,,,,,,,,,,,,,,,,,,,,,,,,Yes,https://www.healthsherpa.com/access/449522269611,9/27/2022 16:48,$0.00 ,
HUMBERTO,LEAL RANGEL,,***-**-3618,male,5/7/1951,TRUE,625 Pine Ridge Dr,,Davenport,FL,33897,Polk,FALSE,FALSE,FALSE,FALSE,9082904609,libia.ro@hotmail.com,Ambetter Balanced Care 32,share94,Silver,Ambetter from Sunshine Health,1/1/2022,2190.18,2155,35.18,2,1575,0,Yes,12/13/2021,"Borges, Mario",17420949,agent,,Effectuated,,,4138042843,10625468,Focused Silver,2190.18,21663FL0130112,625 Pine Ridge Dr,,,TRUE,12/13/2021,,12/31/2022,Effectuated,2,20231,Spanish,,0,0,0,0,0,0,TRUE,,,2021-12-13 21:39:45 UTC,LIBIA,RODRIGUEZ ORTIZ,,***-**-2779,female,9/21/1959,TRUE,,,,,,,,,,,,,,,,,,,,,,,,,,,,,,,,,,,,,,,,,,,,,,,,,,,,,,,,,,,,,,,,,,,,,,,Yes,https://www.healthsherpa.com/access/330467856771,11/22/2022 14:13,$0.00 ,
J,Tello Hernandez,,***-**-9304,male,9/6/1964,TRUE,4 E Lagrande St,,Avon Park,FL,33825-2716,Highlands,FALSE,FALSE,FALSE,FALSE,8632572375,,Ambetter Essential Care: $0 Medical Deductible,share87,Expanded Bronze,Ambetter from Sunshine Health,2/1/2022,1563.37,1563.37,0,2,8700,0,Yes,12/13/2021,"Rodriguez, Yaneisy",17420949,agent_override,,Cancelled,completed,,4261874608,13978707,Elite Bronze,1563.37,21663FL0130106,4 E Lagrande St,,,FALSE,,1/10/2022,12/31/2022,Cancelled,2,30000,Spanish,,0,0,1,0,0,0,FALSE,,,2022-01-03 20:51:56 UTC,Fulgencia,Saenz Tello,,***-**-2511,female,5/11/1969,TRUE,,,,,,,,,,,,,,,,,,,,,,,,,,,,,,,,,,,,,,,,,,,,,,,,,,,,,,,,,,,,,,,,,,,,,,,Yes,https://www.healthsherpa.com/access/289228033233,8/19/2022 15:16,$0.00 ,
KIMBERLY,ASTUPINA GAMARRA,,***-**-4167,female,9/12/1996,TRUE,8001 SW 37th Ter,,Miami,FL,33155,Miami-Dade,FALSE,FALSE,FALSE,FALSE,7863462940,kim-sammy@hotmail.com,Ambetter Value Silver 32,share87,Silver,Ambetter from Sunshine Health,1/1/2022,361.78,328,33.78,1,2900,0,Yes,12/14/2021,"Borges, Mario",17420949,agent,,Effectuated,,,4135546954,12726153,Focused VALUE Silver,361.78,86382FL0050009,8001 SW 37th Ter,,,TRUE,2/3/2022,,12/31/2022,Effectuated,1,23400,English,,0,0,0,0,0,0,FALSE,,,2021-12-14 16:22:43 UTC,,,,,,,,,,,,,,,,,,,,,,,,,,,,,,,,,,,,,,,,,,,,,,,,,,,,,,,,,,,,,,,,,,,,,,,,,,,,,,Yes,https://www.healthsherpa.com/access/677190668710,6/16/2022 16:59,$0.00 ,
CYNTHIA,TRUJILLO,,***-**-9197,female,12/1/1975,TRUE,10306 Sagerock Dr,,Houston,TX,77089,Harris,FALSE,FALSE,FALSE,FALSE,8328823036,cindytrujillo1201@yahoo.com,MyBlue Health Silver℠ 405,share94,Silver,Blue Cross and Blue Shield of Texas,1/1/2022,763.48,717,46.48,2,1000,0,Yes,12/14/2021,"Borges, Mario",17420949,agent,,Terminated,completed,,4151277467,8564434,MyBlue Health Silver 405,763.48,33602TX0860008,10306 Sagerock Dr,,,FALSE,,2/7/2022,12/31/2022,Cancelled,5,38000,Spanish,,0,0,1,0,0,0,FALSE,,,2022-02-07 18:50:22 UTC,EDWARD,TRUJILLO,,***-**-6377,male,3/15/1965,FALSE,DAVID,TRUJILLO,,,male,4/8/2008,FALSE,ASHLY,TRUJILLO,,,female,1/3/2005,FALSE,MATTHEW,TRUJILLO,,***-**-7699,male,7/11/2002,TRUE,,,,,,,,,,,,,,,,,,,,,,,,,,,,,,,,,,,,,,,,,,,,,,,,,,Yes,https://www.healthsherpa.com/access/589214954205,6/16/2022 16:29,$0.00 ,
ROMAN,GONZALES,,***-**-2068,male,5/17/1976,TRUE,721 Imperial Lake Rd,,West Palm Beach,FL,33413,Palm Beach,FALSE,FALSE,FALSE,FALSE,5612526302,,"Aetna CVS Silver 2: $0 MinuteClinic Visits, Telehealth, South FL",share94,Silver,Aetna CVS Health,5/1/2022,983.24,958,25.24,2,1000,200,Yes,12/14/2021,"Rodriguez, Yaneisy",18141564,agent,,Effectuated,,,4145689789,14840566,Silver 2: Aetna network of doctors & hospitals + $0 walk-in & telemedicine via MinuteClinic at CVS,983.24,92120FL0080007,721 Imperial Lake Rd,,,TRUE,6/16/2022,,12/31/2022,Effectuated,6,31040,Spanish,,0,0,0,0,0,0,FALSE,,,2021-12-14 18:10:51 UTC,REINA,ANTUNEZ FUNEZ,,***-**-5832,female,6/18/1978,TRUE,Steve,Gonzalez,,,male,6/19/2001,FALSE,Zeyneth,Gonzales,,,female,1/9/2021,FALSE,Alexandra,Gonzales,,,female,2/18/2008,FALSE,Johnathan,Gonzales,,,male,4/9/2010,FALSE,,,,,,,,,,,,,,,,,,,,,,,,,,,,,,,,,,,,,,,,,,,Yes,https://www.healthsherpa.com/access/770892269025,8/18/2022 16:43,$0.00 ,
Adriana,Vanegas,,***-**-5314,female,10/8/1972,TRUE,7338 Bridgeview Dr,,Wesley Chapel,FL,33545-9104,Pasco,FALSE,FALSE,FALSE,FALSE,3052988215,adrianita119@hotmail.com,Ambetter Balanced Care 12,share94,Silver,Ambetter from Sunshine Health,1/1/2022,654.91,623,31.91,1,1400,0,Yes,12/14/2021,"Rodriguez, Yaneisy",17420949,agent_override,,Effectuated,completed,,4130787533,12479495,Everyday Silver,654.91,21663FL0130039,7338 Bridgeview Dr,,,TRUE,12/14/2021,,12/31/2022,Effectuated,1,13008,Spanish,,0,0,1,0,0,0,FALSE,,,2021-12-14 18:20:14 UTC,,,,,,,,,,,,,,,,,,,,,,,,,,,,,,,,,,,,,,,,,,,,,,,,,,,,,,,,,,,,,,,,,,,,,,,,,,,,,,Yes,https://www.healthsherpa.com/access/262267927691,6/16/2022 16:43,$0.00 ,
Niola,Roche,,***-**-8613,female,5/7/1960,TRUE,3630 Sadge Ln,,Irving,TX,75062-8400,Dallas,FALSE,FALSE,FALSE,FALSE,2145547352,aloin7@yahoo.com,MyBlue Health Silver℠ 405,share94,Silver,Blue Cross and Blue Shield of Texas,4/1/2022,933.72,868,65.72,1,1000,0,Yes,12/14/2021,"Borges, Mario",17420949,agent,,Terminated,expired,,4129110950,9540124,MyBlue Health Silver 405,933.72,33602TX0860007,3630 Sadge Ln,,,FALSE,,6/16/2022,5/31/2022,Terminated,1,19296,Spanish,,0,1,1,0,0,0,TRUE,,,2021-12-14 19:10:27 UTC,,,,,,,,,,,,,,,,,,,,,,,,,,,,,,,,,,,,,,,,,,,,,,,,,,,,,,,,,,,,,,,,,,,,,,,,,,,,,,Yes,https://www.healthsherpa.com/access/969029760944,6/16/2022 16:06,$0.00 ,
Astrid,Manco,,***-**-6817,female,4/14/1977,TRUE,2670 55TH TERRA SW,APT B,Naples,FL,34116,Collier,FALSE,FALSE,FALSE,FALSE,2396018026,astridmanco@hotmail.com,Ambetter Essential Care 22,share87,Expanded Bronze,Ambetter from Sunshine Health,8/1/2022,1448.08,1448.08,0,2,8700,2500,Yes,12/14/2021,"Borges, Mario",18141564,agent_override,,Effectuated,completed,,4145816233,14458664,Ambetter Essential Care 22,1448.08,21663FL0130102,2670 55TH TERRA SW,,,TRUE,,,12/31/2022,Effectuated,2,27000,Spanish,,0,0,2,0,0,0,FALSE,,,2022-02-01 21:43:54 UTC,Jorge,Zuluaga,,***-**-6988,male,8/9/1965,TRUE,ISABELLA,ZULUAGA,,,female,6/24/2006,FALSE,,,,,,,,,,,,,,,,,,,,,,,,,,,,,,,,,,,,,,,,,,,,,,,,,,,,,,,,,,,,,,,,Yes,https://www.healthsherpa.com/access/325945940691,8/17/2022 22:06,$0.00 ,
Kris,Lovera Villar,,***-**-2926,female,9/27/1994,TRUE,400 Century 21 Dr,Apt A25,Jacksonville,FL,32216,Duval,FALSE,FALSE,FALSE,FALSE,9047535240,krileyvillar@gmail.com,Ambetter Balanced Care 12,share94,Silver,Ambetter from Sunshine Health,1/1/2022,378.28,360,18.28,1,1400,0,Yes,12/14/2021,"Rodriguez, Yaneisy",17420949,agent_override,,Terminated,completed,,4145485129,12446680,Everyday Silver,378.28,21663FL0130039,400 Century 21 Dr,,,FALSE,12/14/2021,1/27/2022,1/19/2022,Terminated,2,25000,Spanish,,0,0,1,0,0,0,TRUE,,,2021-12-14 22:39:49 UTC,,,,,,,,Alay,De Los Santos,,,male,7/12/2015,FALSE,,,,,,,,,,,,,,,,,,,,,,,,,,,,,,,,,,,,,,,,,,,,,,,,,,,,,,,,,,,,,,,,Yes,https://www.healthsherpa.com/access/360340512178,8/19/2022 22:53,$0.00 ,
Raquel,Garcia,,***-**-7488,female,1/29/1992,TRUE,5909 E FM 40,5928,Lubbock,TX,79403,Lubbock,FALSE,FALSE,FALSE,FALSE,7136579375,Raquelesmeralda1@yahoo.com,Blue Advantage Silver HMO℠ 205,share94,Silver,Blue Cross and Blue Shield of Texas,1/1/2022,1026.89,1026.89,0,2,900,0,Yes,12/14/2021,"Rodriguez, Yaneisy",17420949,agent_override,,Effectuated,completed,,4149209589,8738855,Blue Advantage Silver HMO℠ 205,1026.89,33602TX0460692,5909 E FM 40,,,TRUE,12/14/2021,,12/31/2022,Effectuated,2,18000,Spanish,,0,0,2,0,0,0,TRUE,,,2021-12-14 22:50:13 UTC,Jose,Alvarez,,***-**-2750,male,12/27/1988,TRUE,,,,,,,,,,,,,,,,,,,,,,,,,,,,,,,,,,,,,,,,,,,,,,,,,,,,,,,,,,,,,,,,,,,,,,,Yes,https://www.healthsherpa.com/access/306535318784,8/22/2022 22:37,$0.00 ,
Jesus,Villagran,,***-**-4285,male,12/24/1972,TRUE,8221 Tierra Linda Ln,,Mission,TX,78574,Hidalgo,FALSE,FALSE,FALSE,FALSE,9563293459,jvillagran1224@gmail.com,Ambetter Virtual Access Bronze ($0 Virtual Primary Care + $0 Virtual Urgent Care + $0 Preferred Labs),share94,Expanded Bronze,Ambetter from Superior Health Plan,5/1/2022,1270.58,1270.58,0,3,8550,7000,Yes,12/14/2021,"Rodriguez, Yaneisy",17420949,agent_override,,Effectuated,expired,,4268471399,10477636,Ambetter Virtual Access Bronze ($0 Virtual Primary Care + $0 Virtual Urgent Care + $0 Preferred Labs),1270.58,87226TX0050001,8221 Tierra Linda Ln,,,TRUE,,,12/31/2022,Effectuated,4,35000,Spanish,,0,1,0,0,0,0,FALSE,,,2021-12-14 23:26:24 UTC,Maria,Villagran,,***-**-7535,female,11/25/1968,TRUE,Galed,Villagran,,***-**-7413,male,12/12/2003,TRUE,Odalys,Villagran,,***-**-1798,female,7/17/1996,TRUE,,,,,,,,,,,,,,,,,,,,,,,,,,,,,,,,,,,,,,,,,,,,,,,,,,,,,,,,,Yes,https://www.healthsherpa.com/access/943931860894,8/17/2022 22:39,$0.00 ,
Santos,Rubio,,,male,2/16/1973,TRUE,11722 N Evelyn Cir,,Houston,TX,77071-3402,Harris,FALSE,FALSE,FALSE,FALSE,2818469074,toriano.eljay@zooluck.org,"Aetna CVS Silver 2: $0 Walk-In Clinic Visits, Telehealth, Store Discounts, Houston",share94,Silver,Aetna CVS Health,12/1/2022,590.87,501,89.87,4,1000,200,Yes,12/14/2021,"Rodriguez, Yaneisy",17420949,agent_override,,PendingEffectuation,action_needed,,4131982129,12303199,Silver 2: Aetna network of doctors & hospitals + $0 Walk-in clinic + $0 Telehealth 24/7,590.87,58840TX0110015,11722 N Evelyn Cir,,,FALSE,,,12/31/2022,PendingEffectuation,4,31200,Spanish,,4,1,0,0,0,0,FALSE,,,2021-12-30 00:01:32 UTC,NURIA,GALEAS,,,female,10/13/1984,FALSE,GENESIS,RUBIO,,,female,4/28/2006,FALSE,ASTRID,RUBIO,,,female,8/3/2004,FALSE,,,,,,,,,,,,,,,,,,,,,,,,,,,,,,,,,,,,,,,,,,,,,,,,,,,,,,,,,Yes,https://www.healthsherpa.com/access/909273937097,11/28/2022 23:14,$0.00 ,
Luis,Leal Rodriguez,,***-**-1329,male,5/13/1995,TRUE,625 Pine Ridge Dr,,Davenport,FL,33897-3500,Polk,FALSE,FALSE,FALSE,FALSE,9082517826,lglealr1@gmail.com,Ambetter Essential Care 1 + Vision + Adult Dental,none,Bronze,Ambetter from Sunshine Health,4/1/2022,304.86,207,97.86,1,8600,8600,Yes,12/14/2021,"Rodriguez, Yaneisy",17420949,agent_override,,Effectuated,,,4144974381,10711805,Clear Bronze + Vision + Adult Dental,304.86,21663FL0150023,625 Pine Ridge Dr,,,TRUE,8/18/2022,,12/31/2022,Effectuated,1,37000,Spanish,,0,0,0,0,0,0,TRUE,,,2021-12-14 23:49:57 UTC,,,,,,,,,,,,,,,,,,,,,,,,,,,,,,,,,,,,,,,,,,,,,,,,,,,,,,,,,,,,,,,,,,,,,,,,,,,,,,Yes,https://www.healthsherpa.com/access/157549060618,11/22/2022 15:48,$0.00 ,
Gloria,Donato Huato,,***-**-1028,female,4/17/1968,TRUE,510 Mountain Crest Dr,,Gainesville,GA,30501-6536,Hall,FALSE,FALSE,FALSE,FALSE,7706543121,gloriahuato79@gmail.com,SoloCare Silver PPO (3 Free PCP Visits + $225 Specialty Drug Copay) 40017-01,,Silver,Alliant Health Plans,6/1/2022,736.1,732,4.1,1,,,Yes,12/20/2021,"Borges, Mario",17420949,agent,,Terminated,expired,,4145430727,3972895,SoloCare Silver PPO (3 Free PCP Visits + $225 Specialty Drug Copay) 40017-01,736.1,83761GA0040017,510 Mountain Crest Dr,,,FALSE,,8/17/2022,12/31/2022,Cancelled,3,30000,Spanish,,0,1,1,0,0,0,TRUE,,,2021-12-20 23:25:07 UTC,Genaro,Donato,,***-**-7197,male,12/2/1960,TRUE,Juliana,Donato,,,female,7/13/2008,FALSE,,,,,,,,,,,,,,,,,,,,,,,,,,,,,,,,,,,,,,,,,,,,,,,,,,,,,,,,,,,,,,,,Yes,https://www.healthsherpa.com/access/662999057812,8/17/2022 16:46,$0.00 ,
Marta,Rodriguez,,***-**-5116,female,4/5/1957,FALSE,2226 Miguel St,,Lakeland,FL,33801-6669,Polk,FALSE,FALSE,FALSE,FALSE,7878003966,A@COMCAST.COM,Ambetter Balanced Care 32,share94,Silver,Ambetter from Sunshine Health,7/1/2022,1118.77,1101,17.77,1,1575,0,Yes,12/14/2021,"Cieza, Patricia",469972,agent,,Effectuated,completed,,4147543500,3516057,Focused Silver,1118.77,21663FL0130112,2226 Miguel St,,,TRUE,,,12/31/2022,Effectuated,2,22596,Spanish,,0,0,2,0,0,0,TRUE,,,2021-12-15 07:08:46 UTC,Carmelo,Rodriguez,,***-**-4244,male,5/31/1956,TRUE,,,,,,,,,,,,,,,,,,,,,,,,,,,,,,,,,,,,,,,,,,,,,,,,,,,,,,,,,,,,,,,,,,,,,,,Yes,https://www.healthsherpa.com/access/372824668091,11/22/2022 17:44,$0.00 ,
GUSTAVO,TOVAR PEREZ,,***-**-2604,male,4/4/1978,TRUE,27916 Whales St,Apt 307,Wesley Chapel,FL,33544,Pasco,FALSE,FALSE,FALSE,FALSE,8139438178,GUSTOVAR@HOTMAIL.COM,Ambetter Balanced Care 32,share94,Silver,Ambetter from Sunshine Health,1/1/2022,2457.03,2419,38.03,4,1575,0,Yes,12/14/2021,"Cieza, Patricia",469972,agent,,Effectuated,completed,,4141213103,9033969,Focused Silver,2457.03,21663FL0130112,27916 Whales St,,,TRUE,12/15/2021,,12/31/2022,Effectuated,4,26508,Spanish,,0,0,4,0,0,0,TRUE,,,2021-12-15 07:53:34 UTC,JENNIFER,POLO UZCATEGUI,,***-**-8014,female,10/19/1975,TRUE,DIEGO,TOVAR POLO,,***-**-9103,male,5/2/2012,TRUE,MIRIAM,PEREZ DE TOVAR,,***-**-0492,female,5/17/1946,TRUE,,,,,,,,,,,,,,,,,,,,,,,,,,,,,,,,,,,,,,,,,,,,,,,,,,,,,,,,,Yes,https://www.healthsherpa.com/access/694288330132,12/14/2022 0:46,$0.00 ,
JARIMAR,DEL VALLE,,***-**-0942,female,8/19/1998,TRUE,3269 Royal Tern Dr,,Winter Haven,FL,33881,Polk,FALSE,FALSE,FALSE,FALSE,8635885871,,Ambetter Balanced Care 32,share94,Silver,Ambetter from Sunshine Health,1/1/2022,658.23,658.23,0,2,1575,0,Yes,12/15/2021,"Cieza, Patricia",469972,agent,,Effectuated,completed,,4143415183,11659379,Focused Silver,658.23,21663FL0130112,3269 Royal Tern Dr,,,TRUE,12/15/2021,,12/31/2022,Effectuated,2,18000,English,,0,0,2,0,0,0,TRUE,,,2021-12-15 08:35:16 UTC,,,,,,,,JOSIAN,DEL VALLE,,***-**-7479,male,4/9/2020,TRUE,,,,,,,,,,,,,,,,,,,,,,,,,,,,,,,,,,,,,,,,,,,,,,,,,,,,,,,,,,,,,,,,Yes,https://www.healthsherpa.com/access/899925904083,12/11/2022 16:09,$0.00 ,
Yailin,Ruiz,,***-**-4759,female,4/11/1991,TRUE,513 Twin Pines Ln,C,Auburndale,FL,33823,Polk,FALSE,FALSE,FALSE,FALSE,8635089400,ruizyailin929@gmail.com,Ambetter Balanced Care 32,share94,Silver,Ambetter from Sunshine Health,1/1/2022,423.27,417,6.27,1,1575,0,Yes,12/15/2021,"Borges, Mario",17420949,agent,,Effectuated,,,4149671976,10488915,Focused Silver,423.27,21663FL0130112,513 Twin Pines Ln,,,TRUE,12/15/2021,,12/31/2022,Effectuated,1,13200,Spanish,,0,0,0,0,0,0,TRUE,,,2021-12-15 15:59:22 UTC,,,,,,,,,,,,,,,,,,,,,,,,,,,,,,,,,,,,,,,,,,,,,,,,,,,,,,,,,,,,,,,,,,,,,,,,,,,,,,Yes,https://www.healthsherpa.com/access/835777803545,8/22/2022 18:19,$0.00 ,
Hugo,Diaz,,,male,3/6/1979,TRUE,7035 South Kansas Avenue,,Anahuac,TX,77514,Chambers,PO Box 2312,Anahuac,TX,77514-2312,4092674101,,Ambetter Balanced Care 30,none,Silver,Ambetter from Superior HealthPlan,3/10/2022,470.52,470.52,0,0,6100,6100,Yes,12/15/2021,"Rodriguez, Yaneisy",17420949,agent_override,,Effectuated,expired,,4272715560,9969892,Clear Silver,470.52,29418TX0140096,7035 South Kansas Avenue,,,TRUE,3/10/2022,,9/30/2022,Effectuated,1,13020,Spanish,,0,2,0,0,0,0,TRUE,,,2022-03-10 22:41:58 UTC,,,,,,,,,,,,,,,,,,,,,,,,,,,,,,,,,,,,,,,,,,,,,,,,,,,,,,,,,,,,,,,,,,,,,,,,,,,,,,Yes,https://www.healthsherpa.com/access/501109204932,9/27/2022 22:44,$0.00 ,
Juan,Arias Galeano,,***-**-6024,male,5/29/1962,TRUE,7523 Sand Lake Pointe Loop,Apt 205,Orlando,FL,32809,Orange,FALSE,FALSE,FALSE,FALSE,4076009367,galeanoarias62@gmail.com,AvMed Entrust Bronze 600 (2022),none,Expanded Bronze,"AvMed, Inc.",4/1/2022,1620.12,1620.12,0,2,7900,6500,Yes,12/15/2021,"Borges, Mario",17420949,agent,,Effectuated,,,4137057788,13793944,AvMed Entrust Bronze 600 (2023),1620.12,19898FL0340006,7523 Sand Lake Pointe Loop,,,TRUE,,,12/31/2022,Effectuated,2,60000,Spanish,,0,0,0,0,0,0,TRUE,,,2021-12-15 18:37:02 UTC,Magdalena,Restrepo Aguilar,,***-**-7084,female,8/27/1961,TRUE,,,,,,,,,,,,,,,,,,,,,,,,,,,,,,,,,,,,,,,,,,,,,,,,,,,,,,,,,,,,,,,,,,,,,,,Yes,https://www.healthsherpa.com/access/945779634775,9/27/2022 22:26,$0.00 ,
Jorge,Hinojos,,***-**-4560,male,10/5/1978,TRUE,1605 N Halter Ave,,Odessa,TX,79763,Ector,FALSE,FALSE,FALSE,FALSE,4324380840,jorgehinojosc@gmail.com,Blue Advantage Silver HMO℠ 205,share87,Silver,Blue Cross and Blue Shield of Texas,1/1/2022,515.59,488,27.59,1,2900,100,Yes,12/15/2021,"Borges, Mario",17420949,agent,,Effectuated,completed,,4131901179,7651036,Blue Advantage Silver HMO℠ 205,515.59,33602TX0460695,1605 N Halter Ave,,,TRUE,12/15/2021,,12/31/2022,Effectuated,1,20000,Spanish,,0,0,1,0,0,0,TRUE,,,2021-12-15 19:16:10 UTC,,,,,,,,,,,,,,,,,,,,,,,,,,,,,,,,,,,,,,,,,,,,,,,,,,,,,,,,,,,,,,,,,,,,,,,,,,,,,,Yes,https://www.healthsherpa.com/access/757381320696,11/2/2022 17:03,$0.00 ,
David,Dominguez Rabelo,,***-**-3392,male,1/14/1971,TRUE,26536 Acadia Ct,,Denham Springs,LA,70726-6151,Livingston,FALSE,FALSE,FALSE,FALSE,7863794751,madaisyp@gmail.com,Ambetter Balanced Care 32,,Silver,Ambetter from Louisiana Healthcare Connections,7/1/2022,1070.55,0,1070.55,1,,,Yes,12/15/2021,"Rodriguez, Yaneisy",17420949,agent_override,,Terminated,,,4274603626,4615983,Focused Silver,1070.55,61604LA0010012,26536 Acadia Ct,,,FALSE,,,12/31/2022,Cancelled,4,40000,Spanish,,0,0,0,0,0,0,FALSE,,,2021-12-15 19:38:08 UTC,Madaisy,Padron,,***-**-1229,female,11/1/1976,FALSE,Daniela,Rodriguez Padron,,***-**-8553,female,5/29/2002,TRUE,Giselle,Dominguez padron,,***-**-3411,female,6/3/2013,FALSE,Julio Luis,Padron,,,male,4/20/1953,FALSE,,,,,,,,,,,,,,,,,,,,,,,,,,,,,,,,,,,,,,,,,,,,,,,,,,Yes,https://www.healthsherpa.com/access/405828945436,9/27/2022 17:06,$0.00 ,
Claudia,Hurtado Huevara,,***-**-3022,female,10/23/1974,TRUE,110 County Rd,Apt/Lot 328,Cleveland,TX,77327,Liberty,FALSE,FALSE,FALSE,FALSE,2818062294,hurtadoclaudia75@gmail.com,Ambetter Balanced Care 32,,Silver,Ambetter from Superior HealthPlan,1/1/2022,573.79,470,103.79,1,,,Yes,12/15/2021,"Borges, Mario",17420949,agent,,Cancelled,expired,,4275671568,10384195,Focused Silver,573.79,29418TX0140100,110 County Rd,,,FALSE,12/23/2021,1/5/2022,12/31/2022,Cancelled,5,60000,Spanish,,0,1,1,0,0,0,FALSE,,,2021-12-15 21:55:14 UTC,Hugo,Rangel Estrada,,,male,2/23/1975,FALSE,Cristofer,Rangel,,,male,7/2/2005,FALSE,Itan,Rangel,,,male,12/16/2006,FALSE,Emmanuel,Rangel,,,male,8/22/2015,FALSE,,,,,,,,,,,,,,,,,,,,,,,,,,,,,,,,,,,,,,,,,,,,,,,,,,Yes,https://www.healthsherpa.com/access/202278193315,6/17/2022 14:43,$0.00 ,
LINA,BUSTOS ALVAREZ,,***-**-8964,female,1/30/1996,TRUE,1431 Glenwood Dr,,Stephenville,TX,76401-1619,Erath,FALSE,FALSE,FALSE,FALSE,3055609820,,Blue Advantage Silver HMO℠ 205,share94,Silver,Blue Cross and Blue Shield of Texas,2/1/2022,408.61,408.61,0,1,900,0,Yes,12/15/2021,"Rodriguez, Yaneisy",17420949,agent_override,,Effectuated,,,4276588499,10811565,Blue Advantage Silver HMO℠ 205,408.61,33602TX0460704,1431 Glenwood Dr,,,TRUE,,,12/31/2022,Effectuated,1,13000,Spanish,,0,0,0,0,0,0,FALSE,,,2021-12-15 23:02:40 UTC,,,,,,,,,,,,,,,,,,,,,,,,,,,,,,,,,,,,,,,,,,,,,,,,,,,,,,,,,,,,,,,,,,,,,,,,,,,,,,Yes,https://www.healthsherpa.com/access/570671933847,8/19/2022 17:07,$0.00 ,
AARON,PORTILLO,,***-**-1742,male,7/26/1995,TRUE,3939 Teasley Ln,TRAILA 182,Denton,TX,76210-8491,Denton,FALSE,FALSE,FALSE,FALSE,9403005890,,Ambetter Value Silver 32,share94,Silver,Ambetter from Superior Health Plan,1/1/2022,348.67,321,27.67,1,1575,0,Yes,12/15/2021,"Borges, Mario",17420949,agent,,Effectuated,,,4275570246,11196502,Focused VALUE Silver,348.67,87226TX0060009,3939 Teasley Ln,,,TRUE,2/13/2022,,12/31/2022,Effectuated,1,18000,Spanish,,0,0,0,0,0,0,FALSE,,,2021-12-15 23:06:24 UTC,,,,,,,,,,,,,,,,,,,,,,,,,,,,,,,,,,,,,,,,,,,,,,,,,,,,,,,,,,,,,,,,,,,,,,,,,,,,,,Yes,https://www.healthsherpa.com/access/11019687299,8/19/2022 21:10,$0.00 ,
JUAN,BUSTO,,***-**-7191,male,3/8/1968,TRUE,1431 Glenwood Dr,,Stephenville,TX,76401,Erath,FALSE,FALSE,FALSE,FALSE,3055723340,,Blue Advantage Silver HMO℠ 205,,Silver,Blue Cross and Blue Shield of Texas,2/1/2022,,1660.48,0,2,,,No,,"Borges, Mario",17420949,agent,,Effectuated,expired,,4276530933,10057525,Blue Advantage Silver HMO℠ 205,,33602TX0460704,1431 Glenwood Dr,,,TRUE,7/11/2022,,12/31/2022,Effectuated,2,41000,Spanish,,2,0,0,0,0,0,FALSE,,,2022-07-11 15:02:17 UTC,YUNIERS,ALVAREZ CASTRO,,***-**-6596,female,10/22/1968,TRUE,,,,,,,,,,,,,,,,,,,,,,,,,,,,,,,,,,,,,,,,,,,,,,,,,,,,,,,,,,,,,,,,,,,,,,,No,https://www.healthsherpa.com/access/58884024705,9/8/2022 18:16,$0.00 ,
YURI,BUSTO ALVAREZ,,***-**-3267,female,8/16/1992,TRUE,1431 Glenwood Dr,,Stephenville,TX,76401,Erath,FALSE,FALSE,FALSE,FALSE,3055723353,,Blue Advantage Silver HMO℠ 205,share94,Silver,Blue Cross and Blue Shield of Texas,5/1/2022,311.34,311.34,0,1,900,0,Yes,12/15/2021,"Rodriguez, Yaneisy",17420949,agent_override,,Effectuated,expired,,4276973095,11122329,Blue Advantage Silver HMO℠ 205,311.34,33602TX0460704,1431 Glenwood Dr,,,TRUE,,,12/31/2022,Effectuated,2,18000,Spanish,,0,2,0,0,0,0,FALSE,,,2022-03-14 17:07:02 UTC,,,,,,,,FARA,BUSTO ALVAREZ,,,female,6/8/2012,TRUE,,,,,,,,,,,,,,,,,,,,,,,,,,,,,,,,,,,,,,,,,,,,,,,,,,,,,,,,,,,,,,,,Yes,https://www.healthsherpa.com/access/970010011391,8/18/2022 16:53,$0.00 ,
Yazmin,Rodriguez,,***-**-5040,female,8/25/1981,TRUE,1078 Linden St,,Clermont,FL,34711-2841,Lake,PO Box 138062,Clermont,FL,34713-8062,4072854638,yandrian@hotmail.com,Ambetter Balanced Care 32,share94,Silver,Ambetter from Sunshine Health,4/1/2022,469.93,456,13.93,1,1575,0,Yes,12/15/2021,"Rodriguez, Yaneisy",18141564,agent,,Terminated,,,4276415472,10459933,Focused Silver,469.93,21663FL0130112,1078 Linden St,,,FALSE,,8/18/2022,5/31/2022,Terminated,1,14000,Spanish,,0,0,0,0,0,0,TRUE,,,2022-02-24 15:07:21 UTC,,,,,,,,,,,,,,,,,,,,,,,,,,,,,,,,,,,,,,,,,,,,,,,,,,,,,,,,,,,,,,,,,,,,,,,,,,,,,,Yes,https://www.healthsherpa.com/access/383614302139,11/9/2022 19:14,$0.00 ,
EDGAR,CARRILLO,,***-**-5798,male,11/14/1971,TRUE,8459 Lake Amhurst Trl,,Orlando,FL,32829,Orange,FALSE,FALSE,FALSE,FALSE,4046332229,carrilloe301@gmail.com,Ambetter Balanced Care 32,share94,Silver,Ambetter from Sunshine Health,1/1/2022,1183.36,1164,19.36,2,1575,0,Yes,12/15/2021,"Cieza, Patricia",469972,agent,,Effectuated,completed,,4133308297,10741896,Focused Silver,1183.36,21663FL0130112,8459 Lake Amhurst Trl,,,TRUE,12/16/2021,,12/31/2022,Effectuated,5,31092,Spanish,,0,0,1,0,0,0,TRUE,,,2021-12-16 04:44:29 UTC,JASBLEIDY,HERNANDEZ SOSA,,***-**-0814,female,3/23/1979,TRUE,Simon,Carrillo,,,male,6/1/2003,FALSE,Jeremy,Carrillo,,,male,1/19/2007,FALSE,Maximiliano,Carrillo,,,male,8/5/2016,FALSE,,,,,,,,,,,,,,,,,,,,,,,,,,,,,,,,,,,,,,,,,,,,,,,,,,Yes,https://www.healthsherpa.com/access/514939341564,1/14/2022 18:30,$0.00 ,
JACKELINE,RIVERA MARTINEZ,,***-**-5316,female,8/22/1972,TRUE,1205 Atlantic Ct,,Kissimmee,FL,34759,Polk,FALSE,FALSE,FALSE,FALSE,8635888076,jackelinerivera1472@gmail.com,Ambetter Balanced Care 32,share94,Silver,Ambetter from Sunshine Health,3/11/2022,636.21,626,10.21,1,1575,0,Yes,12/15/2021,"Borges, Mario",17420949,agent,,Terminated,expired,,4226149194,13500679,Focused Silver,636.21,21663FL0130112,1205 Atlantic Ct,,,FALSE,,3/11/2022,12/31/2022,Cancelled,1,13009.2,Spanish,,0,1,0,0,0,0,TRUE,,,2022-03-11 21:31:08 UTC,,,,,,,,,,,,,,,,,,,,,,,,,,,,,,,,,,,,,,,,,,,,,,,,,,,,,,,,,,,,,,,,,,,,,,,,,,,,,,Yes,https://www.healthsherpa.com/access/858655836861,8/18/2022 18:52,$0.00 ,
HECTOR,DEL VALLE,,***-**-4234,male,2/8/1960,TRUE,6183 Grey Heron Dr,,Winter Haven,FL,33881-7221,Polk,FALSE,FALSE,FALSE,FALSE,3525733077,,Ambetter Balanced Care 32,share87,Silver,Ambetter from Sunshine Health,1/1/2022,1047.92,1028,19.92,1,2900,0,Yes,12/15/2021,"Cieza, Patricia",469972,agent,,Effectuated,,,4141663640,4423629,Focused Silver,1047.92,21663FL0130112,6183 Grey Heron Dr,,,TRUE,12/16/2021,,12/31/2022,Effectuated,2,26800,Spanish,,0,0,0,0,0,0,TRUE,,,2021-12-16 05:39:20 UTC,ODETTE,COLLAZO,,,female,4/23/1960,FALSE,,,,,,,,,,,,,,,,,,,,,,,,,,,,,,,,,,,,,,,,,,,,,,,,,,,,,,,,,,,,,,,,,,,,,,,Yes,https://www.healthsherpa.com/access/484131842661,12/8/2022 18:05,$0.00 ,
Celerino,Lerdo,,,male,2/2/1968,TRUE,2945 Elena St,,Brownsville,TX,78521,Cameron,FALSE,FALSE,FALSE,FALSE,9564422422,,Blue Advantage Plus Bronze℠ 303,none,Expanded Bronze,Blue Cross and Blue Shield of Texas,3/11/2022,590.85,590.85,0,0,8700,5500,Yes,12/16/2021,"Rodriguez, Yaneisy",17420949,agent_override,,Effectuated,expired,,4152104583,8461099,Blue Advantage Plus Bronze℠ 303,590.85,33602TX0770188,2945 Elena St,,,TRUE,3/11/2022,,9/30/2022,Effectuated,1,22993.2,Spanish,,0,2,0,0,0,0,FALSE,,,2022-03-11 19:16:52 UTC,,,,,,,,,,,,,,,,,,,,,,,,,,,,,,,,,,,,,,,,,,,,,,,,,,,,,,,,,,,,,,,,,,,,,,,,,,,,,,Yes,https://www.healthsherpa.com/access/392183251525,9/27/2022 22:42,$0.00 ,
MA Sylvia,Ibarra de Trevino,,***-**-0988,female,5/14/1958,TRUE,1414 Chippawa Ln,,Pasadena,TX,77504,Harris,FALSE,FALSE,FALSE,FALSE,8322642351,sylviaibarra672@gmail.com,Ambetter Value Silver 32,share94,Silver,Ambetter from Superior Health Plan,1/1/2022,1615.19,1493,122.19,2,1575,0,Yes,12/16/2021,"Borges, Mario",17420949,agent,,Effectuated,,,4130709067,10096429,Focused VALUE Silver,1615.19,87226TX0100009,1414 Chippawa Ln,,,TRUE,1/27/2022,,12/31/2022,Effectuated,2,20040,Spanish,,0,0,0,0,0,0,TRUE,,,2021-12-22 16:01:06 UTC,Adolfo,Trevino,,***-**-7077,male,8/18/1967,TRUE,,,,,,,,,,,,,,,,,,,,,,,,,,,,,,,,,,,,,,,,,,,,,,,,,,,,,,,,,,,,,,,,,,,,,,,Yes,https://www.healthsherpa.com/access/144779505829,8/22/2022 19:39,$0.00 ,
JOSE,CERVANTES,,***-**-7155,male,9/15/1967,TRUE,1201 Stonegate Ct,,Bridgeport,TX,76426,Wise,FALSE,FALSE,FALSE,FALSE,9403894676,noemail@gmail.com,Ambetter Balanced Care 30,share94,Silver,Ambetter from Superior HealthPlan,1/1/2022,1879.41,1879.41,0,0,625,625,Yes,12/16/2021,"Borges, Mario",17420949,agent,,Cancelled,,,4280780960,8108728,Clear Silver,1879.41,29418TX0140096,1201 Stonegate Ct,,,FALSE,,1/5/2022,12/31/2022,Cancelled,5,45000,Spanish,,0,0,0,0,0,0,TRUE,,,2021-12-16 18:42:56 UTC,MARGARITA,CERVANTES,,***-**-0376,female,6/6/1973,TRUE,GIOVANY,CERVANTES,,,male,5/7/2012,FALSE,Joel,Cervantes,,,male,12/18/2004,FALSE,SELENA,CERVANTES,,***-**-9507,female,3/5/2000,TRUE,,,,,,,,,,,,,,,,,,,,,,,,,,,,,,,,,,,,,,,,,,,,,,,,,,Yes,https://www.healthsherpa.com/access/989100000463,8/19/2022 21:10,$0.00 ,
Bertha,Ortega,,,female,3/9/1969,TRUE,12954 W University Blvd,Trailer 10,Odessa,TX,79764,Ector,FALSE,FALSE,FALSE,FALSE,9154933078,berta@yti.com,Blue Advantage Gold HMO℠ 206,share94,Gold,Blue Cross and Blue Shield of Texas,8/1/2022,705.26,705.26,0,0,8700,750,Yes,12/16/2021,"Borges, Mario",17420949,agent,,Terminated,expired,,4135389393,8306441,Blue Advantage Gold HMO℠ 206,705.26,33602TX0460570,12954 W University Blvd,,,FALSE,,11/10/2022,9/30/2022,Terminated,3,22002,Spanish,,0,6,0,0,0,0,TRUE,,,2022-03-11 17:46:22 UTC,Kenneth,Ortega,,,male,9/22/1973,TRUE,Emily,Ortega,,,female,2/20/2008,TRUE,,,,,,,,,,,,,,,,,,,,,,,,,,,,,,,,,,,,,,,,,,,,,,,,,,,,,,,,,,,,,,,,Yes,https://www.healthsherpa.com/access/673440145289,11/14/2022 17:20,$0.00 ,
Jose,Gonzalez,,,male,9/29/1982,TRUE,3893 FM 2615,,Victoria,TX,77905,Victoria,FALSE,FALSE,FALSE,FALSE,3612122173,josegonzalez@yti.com,Ambetter Balanced Care 31,share94,Silver,Ambetter from Superior HealthPlan,1/1/2022,537.8,537.8,0,0,775,400,Yes,12/16/2021,"Rodriguez, Yaneisy",17420949,agent_override,,Terminated,expired,,4280537339,10715931,Ambetter Balanced Care 31,537.8,29418TX0140099,3893 FM 2615,,,FALSE,3/11/2022,5/9/2022,4/30/2022,Terminated,1,17005.2,Spanish,,0,2,0,0,0,0,FALSE,,,2022-03-11 18:12:45 UTC,,,,,,,,,,,,,,,,,,,,,,,,,,,,,,,,,,,,,,,,,,,,,,,,,,,,,,,,,,,,,,,,,,,,,,,,,,,,,,Yes,https://www.healthsherpa.com/access/867128324977,9/29/2022 16:10,$0.00 ,
Leonel,Perez Navarro,,,male,5/6/1991,TRUE,3007 Stanford Ave,,Pecos,TX,79772,Reeves,FALSE,FALSE,FALSE,FALSE,5124962625,leonelpereznavarro@yti.com,Blue Advantage Silver HMO℠ 205,none,Silver,Blue Cross and Blue Shield of Texas,1/1/2022,461.92,461.92,0,0,8700,2050,Yes,12/16/2021,"Rodriguez, Yaneisy",17420949,agent_override,,Effectuated,expired,,4281083509,8199442,Blue Advantage Silver HMO℠ 205,461.92,33602TX0460704,3007 Stanford Ave,,,TRUE,3/11/2022,,9/30/2022,Effectuated,1,13001,Spanish,,0,2,0,0,0,0,TRUE,,,2022-03-11 17:36:58 UTC,,,,,,,,,,,,,,,,,,,,,,,,,,,,,,,,,,,,,,,,,,,,,,,,,,,,,,,,,,,,,,,,,,,,,,,,,,,,,,Yes,https://www.healthsherpa.com/access/472043777816,9/29/2022 16:09,$0.00 ,
Maria,Rodriguez,,,female,12/13/1966,TRUE,1014 W County Road 137,,Midland,TX,79706,Midland,FALSE,FALSE,FALSE,FALSE,7132153254,maria@comcast.com,Blue Advantage Silver HMO℠ 205,share94,Silver,Blue Cross and Blue Shield of Texas,1/1/2022,804.74,804.74,0,0,900,0,Yes,12/16/2021,"Rodriguez, Yaneisy",17420949,agent_override,,Terminated,expired,,4280516361,7733310,Blue Advantage Silver HMO℠ 205,804.74,33602TX0460694,1014 W County Road 137,,,FALSE,3/11/2022,9/29/2022,6/30/2022,Terminated,1,13001,Spanish,,0,2,0,0,0,0,FALSE,,,2022-03-11 17:23:51 UTC,,,,,,,,,,,,,,,,,,,,,,,,,,,,,,,,,,,,,,,,,,,,,,,,,,,,,,,,,,,,,,,,,,,,,,,,,,,,,,Yes,https://www.healthsherpa.com/access/401824607825,9/29/2022 16:02,$0.00 ,
LAURA,FLORES,,,female,10/19/1993,TRUE,902 E Crockett St,,Beeville,TX,78102,Bee,FALSE,FALSE,FALSE,FALSE,3613187647,notiene@notiene.com,Blue Advantage Silver HMO℠ 205,share94,Silver,Blue Cross and Blue Shield of Texas,1/1/2022,442.39,442.39,0,0,900,0,Yes,12/17/2021,"Rodriguez, Yaneisy",17420949,agent_override,,Terminated,expired,,4137114571,8157349,Blue Advantage Silver HMO℠ 205,442.39,33602TX0460704,902 E Crockett St,,,FALSE,2/13/2022,5/9/2022,4/30/2022,Terminated,1,12996,Spanish,,0,1,0,0,0,0,TRUE,,,2021-12-17 16:21:05 UTC,,,,,,,,,,,,,,,,,,,,,,,,,,,,,,,,,,,,,,,,,,,,,,,,,,,,,,,,,,,,,,,,,,,,,,,,,,,,,,Yes,https://www.healthsherpa.com/access/51794343749,8/22/2022 16:51,$0.00 ,
Jose,Sorto,,***-**-8896,male,5/15/1965,TRUE,877 E House St Apt 307,,Alvin,TX,77511-2966,Brazoria,FALSE,FALSE,FALSE,FALSE,8327242315,josesorto06@yahoo.com,Blue Advantage Gold HMO℠ 206,share87,Gold,Blue Cross and Blue Shield of Texas,1/1/2022,2036.54,1719,317.54,2,8700,750,Yes,12/17/2021,"Rodriguez, Yaneisy",17420949,agent_override,,Cancelled,completed,,4139762984,8237890,Blue Advantage Gold HMO℠ 206,2036.54,33602TX0460563,877 E House St Apt 307,,,FALSE,,12/17/2021,12/31/2022,Cancelled,2,70000,Spanish,,0,0,2,0,0,0,TRUE,,,2021-12-17 21:35:05 UTC,Ana,Sorto,,***-**-5854,female,7/17/1968,TRUE,Bryan,Sorto,,***-**-9815,male,8/28/2000,TRUE,,,,,,,,,,,,,,,,,,,,,,,,,,,,,,,,,,,,,,,,,,,,,,,,,,,,,,,,,,,,,,,,Yes,https://www.healthsherpa.com/access/886463749777,8/1/2022 14:21,$0.00 ,
Sandra,Roman,,***-**-3626,female,7/25/1964,TRUE,1167 Jordan Loop,,Bryan,TX,77803-4325,Brazos,FALSE,FALSE,FALSE,FALSE,8323627451,sandra.bocanegra@ymail.com,Ambetter Balanced Care 30,share94,Silver,Ambetter from Superior HealthPlan,7/1/2022,897.18,895,2.18,1,625,625,Yes,12/20/2021,"Borges, Mario",17420949,agent,,PendingEffectuation,,,4285426949,11427774,Ambetter Balanced Care 30,897.18,29418TX0140097,1167 Jordan Loop,,,FALSE,,,12/31/2022,PendingEffectuation,1,15000,Spanish,,0,0,0,0,0,0,FALSE,,,2021-12-20 14:30:20 UTC,,,,,,,,,,,,,,,,,,,,,,,,,,,,,,,,,,,,,,,,,,,,,,,,,,,,,,,,,,,,,,,,,,,,,,,,,,,,,,Yes,https://www.healthsherpa.com/access/857787255014,8/17/2022 18:20,$0.00 ,
Jose,Hernandez Nieto,,***-**-6805,male,11/28/1968,TRUE,1443 County Road 340,,Cleveland,TX,77327-2548,Liberty,FALSE,FALSE,FALSE,FALSE,7134472073,,Ambetter Balanced Care 32,share94,Silver,Ambetter from Superior HealthPlan,3/1/2022,1404.55,1361,43.55,2,1575,0,Yes,12/20/2021,"Rodriguez, Yaneisy",17420949,agent_override,,Effectuated,completed,,4147822218,9660221,Focused Silver,1404.55,29418TX0140100,1443 County Road 340,,,TRUE,,,12/31/2022,Effectuated,4,38000,Spanish,,0,0,2,0,0,0,TRUE,,,2021-12-20 22:46:36 UTC,Blanca,Hernandez Saavedra,,***-**-4732,female,10/21/1971,TRUE,Noe,Hernandez Saavedra,,***-**-2973,male,10/14/2002,FALSE,Blanca,Hernandez Saavedra,,***-**-8247,female,2/10/2004,FALSE,Dario,Hernandez Saavedra,,,male,2/28/2001,TRUE,,,,,,,,,,,,,,,,,,,,,,,,,,,,,,,,,,,,,,,,,,,,,,,,,,Yes,https://www.healthsherpa.com/access/663687489146,8/18/2022 20:44,$0.00 ,
Ma Esther,Castro,,***-**-7688,female,10/2/1975,TRUE,1206 Hillsboro St,,Cleburne,TX,76033,Hood,FALSE,FALSE,FALSE,FALSE,8175666987,,Blue Advantage Silver HMO℠ 205,share94,Silver,Blue Cross and Blue Shield of Texas,1/1/2022,610.47,610.47,0,1,900,0,Yes,12/21/2021,"Borges, Mario",17420949,agent,,Terminated,completed,,4146051577,9005833,Blue Advantage Silver HMO℠ 205,610.47,33602TX0460704,1206 Hillsboro St,,,FALSE,,12/21/2021,12/31/2022,Cancelled,4,28008,Spanish,,0,0,1,0,0,0,TRUE,,,2021-12-21 17:08:02 UTC,,,,,,,,Deisy,Alvarez,,,female,9/4/2005,FALSE,Daneli,Alvarez,,,female,9/4/2005,FALSE,Cristal,Alvarez,,,female,9/28/2006,FALSE,,,,,,,,,,,,,,,,,,,,,,,,,,,,,,,,,,,,,,,,,,,,,,,,,,Yes,https://www.healthsherpa.com/access/374590765252,8/22/2022 19:52,$0.00 ,
Jose,Arias,,,male,12/20/1972,TRUE,309 S Franklin Ave,,Monahans,TX,79756,Ward,FALSE,FALSE,FALSE,FALSE,4693379826,fredylaura2028@hotmail.com,Blue Advantage Silver HMO℠ 205,share94,Silver,Blue Cross and Blue Shield of Texas,6/1/2022,694.31,694.31,0,1,900,0,Yes,12/21/2021,"Rodriguez, Yaneisy",17420949,agent_override,,Effectuated,expired,,4137208979,7695659,Blue Advantage Silver HMO℠ 205,694.31,33602TX0460704,309 S Franklin Ave,,,TRUE,,,12/31/2022,Effectuated,1,18000,Spanish,,2,0,0,0,0,0,FALSE,,,2021-12-21 17:06:49 UTC,,,,,,,,,,,,,,,,,,,,,,,,,,,,,,,,,,,,,,,,,,,,,,,,,,,,,,,,,,,,,,,,,,,,,,,,,,,,,,Yes,https://www.healthsherpa.com/access/7853228091,6/16/2022 17:00,$0.00 ,
Juan,Perez Mercado,,***-**-7076,male,12/23/1975,TRUE,1223 Floating Fountain Cir,Apto 201,Tampa,FL,33612-8835,Hillsborough,FALSE,FALSE,FALSE,FALSE,8133790200,,Ambetter Balanced Care 32,share94,Silver,Ambetter from Sunshine Health,1/1/2022,531.55,523,8.55,1,1575,0,Yes,12/21/2021,"Borges, Mario",17420949,agent,,Terminated,completed,,4135246274,14096420,Focused Silver,531.55,21663FL0130112,1223 Floating Fountain Cir,,,FALSE,,1/27/2022,12/31/2022,Cancelled,3,24000,Spanish,,0,0,3,0,0,0,TRUE,,,2021-12-21 18:52:23 UTC,Jessica,Lopez Suarez,,,female,1/13/1980,FALSE,Erick Miguel,Perez Lopez,,,male,10/27/2011,FALSE,,,,,,,,,,,,,,,,,,,,,,,,,,,,,,,,,,,,,,,,,,,,,,,,,,,,,,,,,,,,,,,,Yes,https://www.healthsherpa.com/access/116158975316,11/15/2022 18:57,$0.00 ,
Jose Nilo,Hernandez Flores,,***-**-7876,male,8/25/1971,TRUE,1322 La Gorce Dr,,Apopka,FL,32703,Orange,FALSE,FALSE,FALSE,FALSE,4074854138,josenilohernandezflores@gmail.com,Ambetter Balanced Care 32,share94,Silver,Ambetter from Sunshine Health,6/1/2022,679.36,669,10.36,1,1575,0,Yes,12/21/2021,"Borges, Mario",18141564,agent_override,,Effectuated,action_needed,,4131136983,13429159,Focused Silver,679.36,21663FL0130112,1322 La Gorce Dr,,,TRUE,9/27/2022,,12/31/2022,Effectuated,1,15000,Spanish,,2,0,0,0,0,0,TRUE,,,2021-12-21 20:43:01 UTC,,,,,,,,,,,,,,,,,,,,,,,,,,,,,,,,,,,,,,,,,,,,,,,,,,,,,,,,,,,,,,,,,,,,,,,,,,,,,,Yes,https://www.healthsherpa.com/access/242289376133,9/27/2022 18:18,$0.00 ,
Manuel,Figueroa Alvarado,,***-**-5243,male,6/9/1966,TRUE,5600 W Macdulla Dr,Traila,Willcox,AZ,85643,Cochise,FALSE,FALSE,FALSE,FALSE,5202542627,5202542627maria@gmail.com,Ambetter Balanced Care 31,share94,Silver,Ambetter,1/1/2022,873.19,873.19,0,1,775,400,Yes,12/21/2021,"Rodriguez, Yaneisy",17420949,agent_override,,Terminated,expired,,4154252938,2686570,Ambetter Balanced Care 31,873.19,91450AZ0080098,5600 W Macdulla Dr,,,FALSE,12/21/2021,2/13/2022,2/3/2022,Terminated,1,18000,Spanish,,0,1,0,0,0,0,TRUE,,,2021-12-21 20:59:36 UTC,,,,,,,,,,,,,,,,,,,,,,,,,,,,,,,,,,,,,,,,,,,,,,,,,,,,,,,,,,,,,,,,,,,,,,,,,,,,,,Yes,https://www.healthsherpa.com/access/294136765844,6/16/2022 16:46,$0.00 ,
Michelle,Valdez Rocha,,***-**-1738,female,8/5/1968,TRUE,2287 STUBBS SCHOOL RD,,Victoria,TX,77905,Goliad,FALSE,FALSE,FALSE,FALSE,3614338759,adriancvr2011@gmail.com,Blue Advantage Silver HMO℠ 205,share94,Silver,Blue Cross and Blue Shield of Texas,1/1/2022,882.2,870,12.2,1,900,0,Yes,12/21/2021,"Rodriguez, Yaneisy",17420949,agent_override,,Effectuated,,,4152938579,8836179,Blue Advantage Silver HMO℠ 205,882.2,33602TX0460701,2287 STUBBS SCHOOL RD,,,TRUE,,,12/31/2022,Effectuated,2,18000,English,,0,0,0,0,0,0,TRUE,,,2021-12-21 21:03:07 UTC,,,,,,,,Adrian,Valdez,,***-**-7202,male,7/8/2011,FALSE,,,,,,,,,,,,,,,,,,,,,,,,,,,,,,,,,,,,,,,,,,,,,,,,,,,,,,,,,,,,,,,,Yes,https://www.healthsherpa.com/access/981752299855,9/29/2022 15:39,$0.00 ,
Armando,Garcia,,***-**-1651,male,8/22/1962,TRUE,11914 Sunnyside Dr,,Baytown,TX,77523,Chambers,FALSE,FALSE,FALSE,FALSE,7138513371,armandogarcia2262@gmail.com,Ambetter Balanced Care 32,,Silver,Ambetter from Superior HealthPlan,1/1/2022,955.58,911,44.58,1,,,Yes,12/21/2021,"Rodriguez, Yaneisy",17420949,agent_override,,Terminated,completed,,4135163034,9109658,Focused Silver,955.58,29418TX0140100,11914 Sunnyside Dr,,,FALSE,,12/21/2021,12/31/2022,Cancelled,1,22000,Spanish,,0,0,1,0,0,0,FALSE,,,2021-12-21 21:26:21 UTC,,,,,,,,,,,,,,,,,,,,,,,,,,,,,,,,,,,,,,,,,,,,,,,,,,,,,,,,,,,,,,,,,,,,,,,,,,,,,,Yes,https://www.healthsherpa.com/access/313731035664,6/16/2022 17:01,$0.00 ,
Luis,Lopez,,***-**-8750,male,5/12/1975,TRUE,713 Rose St,Mobil Home Lote 39,Auburndale,FL,33823-4681,Polk,FALSE,FALSE,FALSE,FALSE,3213476444,Suamylopez4@gmail.com,Ambetter Essential Care: $0 Medical Deductible,none,Expanded Bronze,Ambetter from Sunshine Health,3/1/2022,532.51,0,532.51,1,8700,0,Yes,12/21/2021,"Borges, Mario",17420949,agent,,Terminated,,,4152153796,12122521,Elite Bronze,532.51,21663FL0130106,713 Rose St,,,FALSE,,,12/31/2022,Unknown,1,0,Spanish,,0,0,0,0,0,0,TRUE,,,2021-12-23 17:31:37 UTC,,,,,,,,,,,,,,,,,,,,,,,,,,,,,,,,,,,,,,,,,,,,,,,,,,,,,,,,,,,,,,,,,,,,,,,,,,,,,,Yes,https://www.healthsherpa.com/access/87068693844,8/18/2022 21:10,$0.00 ,
Juan,Serrano Provencio,,***-**-8366,male,3/23/1957,TRUE,10086 4th Street,PO BOX 862,Tornillo,TX,79853,El Paso,FALSE,FALSE,FALSE,FALSE,9152285399,Serranojuanm57@gmail.com,Ambetter Essential Care 1,,Bronze,Ambetter from Superior HealthPlan,1/1/2022,938.36,938.36,0,1,8600,8600,Yes,12/21/2021,"Borges, Mario",17420949,agent,,Terminated,completed,,4142674754,9506230,Ambetter Essential Care 1,938.36,29418TX0140006,10086 4th Street,,,FALSE,,12/21/2021,12/31/2022,Cancelled,1,13008,Spanish,,0,0,1,0,0,0,FALSE,,,2021-12-21 21:57:52 UTC,,,,,,,,,,,,,,,,,,,,,,,,,,,,,,,,,,,,,,,,,,,,,,,,,,,,,,,,,,,,,,,,,,,,,,,,,,,,,,Yes,https://www.healthsherpa.com/access/740834022493,6/16/2022 16:26,$0.00 ,
MARTHA,HERNANDEZ,,***-**-9643,female,1/29/1989,TRUE,1150 Cedar Ln,,Kaufman,TX,75142,Kaufman,FALSE,FALSE,FALSE,FALSE,4692301669,letymhdz@hotmail.com,Blue Advantage Plus Bronze℠ 303,none,Expanded Bronze,Blue Cross and Blue Shield of Texas,1/1/2022,1172.16,1172.16,0,3,8700,5500,Yes,12/21/2021,"Rodriguez, Yaneisy",17420949,agent_override,,Cancelled,completed,,4140124251,6306242,Blue Advantage Plus Bronze 303,1172.16,33602TX0770191,1150 Cedar Ln,,,FALSE,12/21/2021,1/11/2022,12/31/2022,Cancelled,3,64000,Spanish,,0,0,1,0,0,0,TRUE,,,2021-12-21 22:42:05 UTC,ARMANDO,HERNANDEZ,,***-**-8681,male,6/20/1987,TRUE,ARMANDO,HERNANDEZ,,***-**-4971,male,8/8/2008,TRUE,,,,,,,,,,,,,,,,,,,,,,,,,,,,,,,,,,,,,,,,,,,,,,,,,,,,,,,,,,,,,,,,Yes,https://www.healthsherpa.com/access/626376979031,8/22/2022 19:33,$0.00 ,
Tiburcio,Guerrero Nunez,,***-**-6513,male,8/11/1970,TRUE,1448 Co Rd 3301,,Jacksonville,TX,75766,Cherokee,FALSE,FALSE,FALSE,FALSE,7134449951,tiburcio@comcast.com,Blue Advantage Silver HMO℠ 205,share94,Silver,Blue Cross and Blue Shield of Texas,1/1/2022,1553.45,1553.45,0,2,900,0,Yes,12/22/2021,"Borges, Mario",17420949,agent,,Effectuated,completed,,4151348854,8613610,Blue Advantage Silver HMO℠ 205,1553.45,33602TX0460704,1448 Co Rd 3301,,,TRUE,1/6/2022,,12/31/2022,Effectuated,2,17460,Spanish,,0,0,2,0,0,0,TRUE,,,2021-12-22 16:50:09 UTC,Maria,Ochoa De Nunez,,***-**-5493,female,2/17/1969,TRUE,,,,,,,,,,,,,,,,,,,,,,,,,,,,,,,,,,,,,,,,,,,,,,,,,,,,,,,,,,,,,,,,,,,,,,,Yes,https://www.healthsherpa.com/access/669455991496,9/29/2022 18:35,$0.00 ,
Erika,Rivas,,,female,12/20/1987,TRUE,2209 S Baird St,,Midland,TX,79701,Midland,FALSE,FALSE,FALSE,FALSE,4329992521,erikarivas@gmail.com,Blue Advantage Silver HMO℠ 205,share94,Silver,Blue Cross and Blue Shield of Texas,1/1/2022,1024.16,1024.16,0,0,900,0,Yes,12/22/2021,"Borges, Mario",17420949,agent,,Terminated,expired,,4288507488,9212861,Blue Advantage Silver HMO℠ 205,1024.16,33602TX0460694,2209 S Baird St,,,FALSE,1/6/2022,5/9/2022,4/30/2022,Terminated,4,26800.08,Spanish,,0,4,0,0,0,0,TRUE,,,2021-12-22 17:48:49 UTC,,,,,,,,Maicol,Gonzales,,,male,11/26/2008,TRUE,Yefrid,Gonzales,,,male,10/9/2005,TRUE,Emmy,Hernandez,,,female,8/18/2019,FALSE,,,,,,,,,,,,,,,,,,,,,,,,,,,,,,,,,,,,,,,,,,,,,,,,,,Yes,https://www.healthsherpa.com/access/915488202302,8/22/2022 19:21,$0.00 ,
EDELIO,CANCIO MODINO,,***-**-1860,male,9/24/1957,TRUE,1131 E 6th Ave,,Hialeah,FL,33010-3613,Miami-Dade,FALSE,FALSE,FALSE,FALSE,7869705189,ediliocancio1957@gmail.com,Ambetter Value Silver 32,share94,Silver,Ambetter from Sunshine Health,1/1/2022,1081.01,1052,29.01,1,1575,0,Yes,12/22/2021,"Borges, Mario",17420949,agent,,Effectuated,,,4141198675,13352519,Focused VALUE Silver,1081.01,86382FL0050009,1131 E 6th Ave,,,TRUE,2/13/2022,,12/31/2022,Effectuated,1,18000,Spanish,,0,0,0,0,0,0,FALSE,,,2021-12-22 17:54:20 UTC,,,,,,,,,,,,,,,,,,,,,,,,,,,,,,,,,,,,,,,,,,,,,,,,,,,,,,,,,,,,,,,,,,,,,,,,,,,,,,Yes,https://www.healthsherpa.com/access/800646030203,8/17/2022 18:28,$0.00 ,
Wilfredo,Corchado,,***-**-0981,male,5/17/1990,TRUE,815 Walden Pond Dr,,Jackson,MS,39208-6728,Rankin,FALSE,FALSE,FALSE,FALSE,7694440202,w.corchado90@gmail.com,Ambetter Balanced Care 31 with Walgreens,none,Silver,Ambetter from Magnolia Health,9/1/2022,402.83,0,402.83,1,6450,5450,Yes,12/22/2021,"Rodriguez, Yaneisy",17420949,agent_override,,Effectuated,expired,,4289458440,3453825,Ambetter Balanced Care 31 with Walgreens,402.83,90714MS0010058,815 Walden Pond Dr,,,TRUE,,,12/31/2022,Effectuated,1,13000,Spanish,,0,1,0,0,0,0,TRUE,,,2021-12-22 18:05:51 UTC,,,,,,,,,,,,,,,,,,,,,,,,,,,,,,,,,,,,,,,,,,,,,,,,,,,,,,,,,,,,,,,,,,,,,,,,,,,,,,Yes,https://www.healthsherpa.com/access/343987711373,9/29/2022 15:28,$0.00 ,
David,Armendares,,***-**-5299,male,7/28/1991,TRUE,511 Alpines St,,Presidio,TX,79845,Presidio,PO Box 514,Presidio,TX,79845-0514,4322084174,,Blue Advantage Silver HMO℠ 205,share94,Silver,Blue Cross and Blue Shield of Texas,1/1/2022,461.92,461.92,0,1,900,0,Yes,12/22/2021,"Borges, Mario",17420949,agent,,Effectuated,expired,,4200708018,10151478,Blue Advantage Silver HMO℠ 205,461.92,33602TX0460704,511 Alpines St,,,TRUE,2/11/2022,,12/31/2022,Effectuated,1,14001,Spanish,,0,1,1,0,0,0,FALSE,,,2022-02-11 18:00:32 UTC,,,,,,,,,,,,,,,,,,,,,,,,,,,,,,,,,,,,,,,,,,,,,,,,,,,,,,,,,,,,,,,,,,,,,,,,,,,,,,Yes,https://www.healthsherpa.com/access/960308357364,6/16/2022 16:48,$0.00 ,
Emerita,Cruz Turcio,,***-**-5488,female,7/21/1977,TRUE,512 Rosalind Ter,,Locust Grove,GA,30248-6005,Henry,FALSE,FALSE,FALSE,FALSE,2816085020,emeritacruz5@gmail.com,Anthem Bronze Pathway X Guided Access HMO 5000,share94,Expanded Bronze,Blue Cross Blue Shield Healthcare Plan of Georgia,1/1/2022,426.59,426.59,0,1,8700,5000,Yes,12/22/2021,"Rodriguez, Yaneisy",17420949,agent_override,,Effectuated,completed,,4140348457,3953268,Anthem Bronze Pathway X Guided Access HMO 5000($0 Virtual PCP+$0 Select Drugs),426.59,49046GA0410120,512 Rosalind Ter,,,TRUE,12/22/2021,,12/31/2022,Effectuated,1,13008,Spanish,,0,0,1,0,0,0,TRUE,,,2021-12-22 19:26:04 UTC,,,,,,,,,,,,,,,,,,,,,,,,,,,,,,,,,,,,,,,,,,,,,,,,,,,,,,,,,,,,,,,,,,,,,,,,,,,,,,Yes,https://www.healthsherpa.com/access/886144690713,8/19/2022 22:12,$0.00 ,
Maria,Olivares,,***-**-7089,female,2/11/1968,TRUE,1307 E Oak Ave,,Midland,TX,79705-6817,Midland,FALSE,FALSE,FALSE,FALSE,6024348439,olivaresm50@icloud.com,Blue Advantage Silver HMO℠ 205,share87,Silver,Blue Cross and Blue Shield of Texas,3/1/2022,1012.25,1012.25,0,2,2900,100,Yes,12/22/2021,"Borges, Mario",17420949,agent,,Effectuated,,,4193220945,9881593,Blue Advantage Silver HMO℠ 205,1012.25,33602TX0460694,1307 E Oak Ave,,,TRUE,,,12/31/2022,Effectuated,2,28800,Spanish,,0,0,0,0,0,0,TRUE,,,2021-12-22 20:56:44 UTC,Fernando,Duran Lopez,,,male,3/17/1968,TRUE,Aaron,Duran,,***-**-6309,male,5/7/2007,TRUE,,,,,,,,,,,,,,,,,,,,,,,,,,,,,,,,,,,,,,,,,,,,,,,,,,,,,,,,,,,,,,,,Yes,https://www.healthsherpa.com/access/468072423578,11/14/2022 18:38,$0.00 ,
Obdulia,Fonseca,,***-**-1112,female,1/28/1979,TRUE,3206 Dreiser Pl,,Greensboro,NC,27405-4006,Guilford,FALSE,FALSE,FALSE,FALSE,3367092459,yuilacon8@hotmail.com,Blue Local Bronze 7000 + 3 Free PCP with Wake Forest Baptist Health,share73,Expanded Bronze,Blue Cross and Blue Shield of NC,3/1/2022,808.88,808.88,0,2,8700,7000,Yes,12/22/2021,"Rodriguez, Yaneisy",17420949,agent_override,,Effectuated,completed,,4132788610,1857204,Blue Local Bronze 7000 + 3 Free PCP with Wake Forest Baptist Health,808.88,11512NC0320029,3206 Dreiser Pl,,,TRUE,2/13/2022,,12/31/2022,Effectuated,5,67000,Spanish,,0,0,1,0,0,0,TRUE,,,2022-02-09 18:37:57 UTC,Juan,Rodriguez,,***-**-9596,male,5/10/1970,TRUE,Jorge,Prieto,,***-**-9065,male,2/15/2007,FALSE,Sebastian,Rodriguez,,***-**-6122,male,12/11/2016,FALSE,Camila,Rodriguez,,***-**-1539,female,7/4/2013,FALSE,,,,,,,,,,,,,,,,,,,,,,,,,,,,,,,,,,,,,,,,,,,,,,,,,,Yes,https://www.healthsherpa.com/access/451915007552,11/30/2022 21:01,$0.00 ,
Manuel,Castanon,,,male,3/27/1958,TRUE,9920 County Road 344,,Terrell,TX,75161,Kaufman,FALSE,FALSE,FALSE,FALSE,9723101069,cast2650@yahoo.com,Blue Advantage Plus Gold℠ 203,none,Gold,Blue Cross and Blue Shield of Texas,3/21/2022,1324.88,1324.88,0,0,8700,850,Yes,12/22/2021,"Rodriguez, Yaneisy",17420949,agent_override,,Terminated,expired,,4125486306,8496785,Blue Advantage Plus Gold℠ 203,1324.88,33602TX0770138,9920 County Road 344,,,FALSE,3/21/2022,5/9/2022,4/30/2022,Terminated,1,30001.2,Spanish,,0,2,0,0,0,0,TRUE,,,2022-03-21 15:26:46 UTC,,,,,,,,,,,,,,,,,,,,,,,,,,,,,,,,,,,,,,,,,,,,,,,,,,,,,,,,,,,,,,,,,,,,,,,,,,,,,,Yes,https://www.healthsherpa.com/access/185098589737,9/27/2022 22:31,$0.00 ,
Cristian,Castro,,***-**-3724,male,2/5/1990,TRUE,130 Argyle Gate Loop Rd,,Dundee,FL,33838,Polk,FALSE,FALSE,FALSE,FALSE,4073838625,cristiancoto68@icloud.com,Ambetter Essential Care: $0 Medical Deductible,share87,Expanded Bronze,Ambetter from Sunshine Health,5/1/2022,411.45,411.45,0,1,8700,0,Yes,12/22/2021,"Borges, Mario",17420949,agent,,Effectuated,expired,,4136082048,12644968,Elite Bronze,411.45,21663FL0130106,130 Argyle Gate Loop Rd,,,TRUE,,,12/31/2022,Effectuated,2,28000,Spanish,,0,1,0,0,0,0,TRUE,,,2021-12-22 22:39:47 UTC,Vanessa,Beaz Rosario,,,female,7/17/1978,TRUE,,,,,,,,,,,,,,,,,,,,,,,,,,,,,,,,,,,,,,,,,,,,,,,,,,,,,,,,,,,,,,,,,,,,,,,Yes,https://www.healthsherpa.com/access/887810508807,8/18/2022 16:47,$0.00 ,
Maria,Rodriguez,,***-**-4913,female,9/10/1957,TRUE,2318 Riceflower St,,Baytown,TX,77523,Chambers,FALSE,FALSE,FALSE,FALSE,8323158098,,Ambetter Balanced Care 29,share94,Silver,Ambetter from Superior HealthPlan,1/1/2022,1123.11,1067,56.11,1,1525,0,Yes,12/22/2021,"Borges, Mario",17420949,agent,,Terminated,completed,,4149285633,9734559,Ambetter Balanced Care 29,1123.11,29418TX0140072,2318 Riceflower St,,,FALSE,12/22/2021,5/9/2022,1/31/2022,Terminated,2,17500,Spanish,,0,0,1,0,0,0,TRUE,,,2021-12-22 22:53:22 UTC,RAUL,RODRIGUEZ,,***-**-0911,male,10/19/1954,FALSE,,,,,,,,,,,,,,,,,,,,,,,,,,,,,,,,,,,,,,,,,,,,,,,,,,,,,,,,,,,,,,,,,,,,,,,Yes,https://www.healthsherpa.com/access/859224479174,11/10/2022 20:52,$0.00 ,
Juana,Acosta,,***-**-5687,female,4/30/1977,TRUE,260 Sun Valley Dr,,royse,TX,75189,Rockwall,FALSE,FALSE,FALSE,FALSE,4694789002,juanaacosta3232@gmail.com,Ambetter Value Silver 31,share94,Silver,Ambetter from Superior Health Plan,7/1/2022,1830.54,1830.54,0,5,775,400,Yes,12/22/2021,"Rodriguez, Yaneisy",17420949,agent_override,,Effectuated,expired,,4218008546,9388676,Ambetter Value Silver 31,1830.54,87226TX0060008,260 Sun Valley Dr,,,TRUE,9/27/2022,,12/31/2022,Effectuated,5,35004,Spanish,,0,6,0,0,0,0,FALSE,,,2021-12-22 23:46:53 UTC,Juan,Medrano,,,male,1/27/1974,TRUE,David,Medrano,,,male,11/10/2007,TRUE,Abigail,Medrano,,,female,10/9/2011,TRUE,Jennifer,Medrano,,,female,4/6/2003,TRUE,,,,,,,,,,,,,,,,,,,,,,,,,,,,,,,,,,,,,,,,,,,,,,,,,,Yes,https://www.healthsherpa.com/access/229516676215,9/27/2022 17:04,$0.00 ,
Miguel,Machuca,,,male,4/23/1957,TRUE,6297 Sioux Fls,,Brownsville,TX,78521,Cameron,FALSE,FALSE,FALSE,FALSE,9565592819,mmachuca@yestoinsurance.com,Blue Advantage Gold HMO℠ 206,none,Gold,Blue Cross and Blue Shield of Texas,1/1/2022,947.97,947.97,0,0,8700,750,Yes,12/23/2021,"Borges, Mario",17420949,agent,,Terminated,expired,,4225428483,10113042,Blue Advantage Gold HMO℠ 206,947.97,33602TX0460558,6297 Sioux Fls,,,FALSE,1/5/2022,5/9/2022,4/30/2022,Terminated,1,13000,Spanish,,0,2,0,0,0,0,TRUE,,,2021-12-23 14:58:53 UTC,,,,,,,,,,,,,,,,,,,,,,,,,,,,,,,,,,,,,,,,,,,,,,,,,,,,,,,,,,,,,,,,,,,,,,,,,,,,,,Yes,https://www.healthsherpa.com/access/901650995809,8/19/2022 18:47,$0.00 ,
Jose,Restrepo Parra,,***-**-1789,male,9/10/1971,TRUE,15840 SW 146th Ter,,Miami,FL,33196-6732,Miami-Dade,FALSE,FALSE,FALSE,FALSE,3053009648,mariachaparro1221@gmail.com,Ambetter Value Silver 32,share87,Silver,Ambetter from Sunshine Health,1/1/2022,1232.72,1189,43.72,2,2900,0,Yes,12/23/2021,"Borges, Mario",17420949,agent,,Effectuated,completed,,4129787988,13793598,Focused VALUE Silver,1232.72,86382FL0050009,15840 SW 146th Ter,,,TRUE,2/3/2022,,12/31/2022,Effectuated,3,34968,Spanish,,0,0,1,0,0,0,TRUE,,,2021-12-23 15:35:23 UTC,Maria,Montes,,***-**-6858,female,12/21/1973,TRUE,Juan,Montes,,,male,11/21/2003,FALSE,,,,,,,,,,,,,,,,,,,,,,,,,,,,,,,,,,,,,,,,,,,,,,,,,,,,,,,,,,,,,,,,Yes,https://www.healthsherpa.com/access/275687011689,12/13/2022 18:56,$0.00 ,
Teodoro,Martinez,,,male,10/9/1995,TRUE,412 Crevasse St,,Lakeland,FL,33805,Polk,FALSE,FALSE,FALSE,FALSE,8637381617,,Ambetter Essential Care: $0 Medical Deductible,share94,Expanded Bronze,Ambetter from Sunshine Health,1/1/2022,363.53,363.53,0,1,8700,0,Yes,12/23/2021,"Rodriguez, Yaneisy",17420949,agent_override,,Effectuated,action_needed,,4132361133,11757307,Elite Bronze,363.53,21663FL0130106,412 Crevasse St,,,TRUE,5/10/2022,,12/31/2022,Effectuated,1,13008,Spanish,,1,0,0,0,0,0,FALSE,,,2022-05-10 20:20:57 UTC,,,,,,,,,,,,,,,,,,,,,,,,,,,,,,,,,,,,,,,,,,,,,,,,,,,,,,,,,,,,,,,,,,,,,,,,,,,,,,Yes,https://www.healthsherpa.com/access/368196257473,8/22/2022 18:13,$0.00 ,
Teresa,Martinez,,***-**-4896,female,4/18/2000,TRUE,400 Southwest Pkwy,apt #921,College Station,TX,77840-7147,Brazos,FALSE,FALSE,FALSE,FALSE,4698269436,martinez.teresa290@gmail.com,Blue Advantage Plus Bronze℠ 303,share94,Expanded Bronze,Blue Cross and Blue Shield of Texas,2/2/2022,356.07,356.07,0,1,8700,5500,Yes,12/23/2021,"Rodriguez, Yaneisy",17420949,agent_override,,Terminated,,,4132913264,10457483,Blue Advantage Plus Bronze℠ 303,356.07,33602TX0770189,400 Southwest Pkwy,,,FALSE,2/13/2022,3/2/2022,2/28/2022,Terminated,1,18000,English,,0,0,0,0,0,0,TRUE,,,2022-01-11 16:14:06 UTC,,,,,,,,,,,,,,,,,,,,,,,,,,,,,,,,,,,,,,,,,,,,,,,,,,,,,,,,,,,,,,,,,,,,,,,,,,,,,,Yes,https://www.healthsherpa.com/access/788462593586,9/28/2022 19:21,$0.00 ,
Jason,Calderon,,***-**-9411,male,6/13/1982,TRUE,2411 Trussit Ave,,Youngstown,OH,44505-2558,Mahoning,FALSE,FALSE,FALSE,FALSE,4074595836,calderon94111@gmail.com,Ambetter Balanced Care 12,share94,Silver,Ambetter from Buckeye Health Plan,3/1/2022,408.79,377,31.79,1,1400,0,Yes,12/23/2021,"Rodriguez, Yaneisy",17420949,agent_override,,Terminated,,,4163918711,3484299,Everyday Silver,408.79,41047OH0010027,2411 Trussit Ave,,,FALSE,4/30/2022,8/18/2022,5/31/2022,Terminated,1,17800,Spanish,,0,0,0,0,0,0,TRUE,,,2021-12-23 16:19:32 UTC,,,,,,,,,,,,,,,,,,,,,,,,,,,,,,,,,,,,,,,,,,,,,,,,,,,,,,,,,,,,,,,,,,,,,,,,,,,,,,Yes,https://www.healthsherpa.com/access/793977264774,8/18/2022 21:00,$0.00 ,
Elsa,Ramirez H.,,***-**-1676,female,4/7/1957,TRUE,115 E Turnbo Rd,,Harker Heights,TX,76548-2410,Bell,FALSE,FALSE,FALSE,FALSE,2547687940,elsaramirez0657@gmail.com,Ambetter Balanced Care 32,share94,Silver,Ambetter from Superior HealthPlan,5/1/2022,1133.81,1097,36.81,1,1575,0,Yes,12/23/2021,"Rodriguez, Yaneisy",17420949,agent_override,,Terminated,expired,,4124289169,11038629,Focused Silver,1133.81,29418TX0140100,115 E Turnbo Rd,,,FALSE,,8/18/2022,8/1/2022,Terminated,2,17500,Spanish,,0,1,1,0,0,0,TRUE,,,2022-01-12 20:48:31 UTC,Felix,Martinez,,***-**-6031,male,7/10/1943,FALSE,,,,,,,,,,,,,,,,,,,,,,,,,,,,,,,,,,,,,,,,,,,,,,,,,,,,,,,,,,,,,,,,,,,,,,,Yes,https://www.healthsherpa.com/access/200773126579,9/6/2022 21:35,$0.00 ,
Raul,Lopez,,***-**-4405,male,7/31/1998,TRUE,606 NW 7TH Ave,,Homestead,FL,33030,Miami-Dade,FALSE,FALSE,FALSE,FALSE,7863721696,,Ambetter Value Bronze: $0 Medical Deductible,share94,Expanded Bronze,Ambetter from Sunshine Health,9/1/2022,343.01,343.01,0,1,8700,0,Yes,12/23/2021,"Borges, Mario",18141564,agent_override,,Effectuated,action_needed,,4289851246,15039840,Elite VALUE Bronze,343.01,86382FL0050005,606 NW 7TH Ave,,,TRUE,,,12/31/2022,Effectuated,1,17000,Spanish,,1,1,0,0,0,0,FALSE,,,2021-12-23 20:36:45 UTC,,,,,,,,,,,,,,,,,,,,,,,,,,,,,,,,,,,,,,,,,,,,,,,,,,,,,,,,,,,,,,,,,,,,,,,,,,,,,,Yes,https://www.healthsherpa.com/access/664783797838,11/10/2022 21:32,$0.00 ,
LAURA,GUERRA,,***-**-3550,female,11/20/1971,TRUE,8812 Norton St Apt A,,El Paso,TX,79904-1957,El Paso,FALSE,FALSE,FALSE,FALSE,9154712516,laura262212@gmail.com,Ambetter Balanced Care 32 + Vision,share94,Silver,Ambetter from Superior HealthPlan,9/1/2022,1257.22,1138,119.22,2,1575,0,Yes,12/23/2021,"Rodriguez, Yaneisy",17420949,agent_override,,Effectuated,,,4136838300,7693911,Ambetter Balanced Care 32 + Vision,1257.22,29418TX0150100,8812 Norton St Apt A,,,TRUE,,,12/31/2022,Effectuated,3,26508,Spanish,,0,0,0,0,0,0,FALSE,,,2021-12-23 22:35:58 UTC,PABLO,GUERRA GOMEZ,,***-**-7502,male,10/31/1972,TRUE,JESSICA,GUERRA MARTINEZ,,***-**-5364,female,7/10/1998,TRUE,GAEL,GUERRA,,,male,12/9/2004,FALSE,,,,,,,,,,,,,,,,,,,,,,,,,,,,,,,,,,,,,,,,,,,,,,,,,,,,,,,,,Yes,https://www.healthsherpa.com/access/684441042310,8/19/2022 21:28,$0.00 ,
VIRIDIANA,ALVARADO,,***-**-2336,female,2/19/1983,TRUE,4950 Woodstone Dr,Apt 717,San Antonio,TX,78230-1186,Bexar,FALSE,FALSE,FALSE,FALSE,2103156521,VIRY_050@HOTMAIL.COM,Ambetter Value Silver 32,none,Silver,Ambetter from Superior Health Plan,1/1/2022,707.02,682,25.02,0,8700,8100,Yes,12/23/2021,"Rodriguez, Yaneisy",17420949,agent_override,,Effectuated,,,4150879207,10704634,Focused VALUE Silver,707.02,87226TX0080009,4950 Woodstone Dr,,,TRUE,2/3/2022,,12/31/2022,Effectuated,3,21980,Spanish,,0,0,0,0,0,0,FALSE,,,2021-12-23 22:40:22 UTC,,,,,,,,LUIS,VALLEJO,,***-**-3399,male,10/18/2003,TRUE,XIMENA,VALLEJO ALVARADO,,***-**-0156,female,12/3/2008,FALSE,,,,,,,,,,,,,,,,,,,,,,,,,,,,,,,,,,,,,,,,,,,,,,,,,,,,,,,,,Yes,https://www.healthsherpa.com/access/167071139067,8/19/2022 16:52,$0.00 ,
Miriam,Melgar Lopez,,,female,6/4/1987,TRUE,12629 Sabal Park Dr,Apt 305,Pineville,NC,28134-6582,Mecklenburg,FALSE,FALSE,FALSE,FALSE,9803122687,nilzonorellana@gmail.con,Blue Home Silver 5300 + 3 Free PCP with Novant Health,,Silver,Blue Cross and Blue Shield of NC,1/1/2022,735.04,735.04,0,0,,,Yes,12/23/2021,"Rodriguez, Yaneisy",17420949,agent_override,,Terminated,expired,,4290628371,6195126,Blue Home Silver 5300 + 3 Free PCP with Novant Health,735.04,11512NC0340017,12629 Sabal Park Dr,,,FALSE,1/5/2022,2/3/2022,1/31/2022,Terminated,2,17800.08,Spanish,,0,2,0,0,0,0,FALSE,,,2021-12-23 23:09:38 UTC,,,,,,,,Joan,Alvarado Melgar,,,male,4/25/2008,TRUE,,,,,,,,,,,,,,,,,,,,,,,,,,,,,,,,,,,,,,,,,,,,,,,,,,,,,,,,,,,,,,,,Yes,https://www.healthsherpa.com/access/603724985064,8/19/2022 18:31,$0.00 ,
Elsa,Linares,,***-**-8306,female,4/3/1969,TRUE,313 Meadowhill Dr,,Garland,TX,75043,Dallas,FALSE,FALSE,FALSE,FALSE,9723332195,eglinares1@icloud.com,MyBlue Health Bronze℠ 402,share94,Expanded Bronze,Blue Cross and Blue Shield of Texas,1/1/2022,513.6,513.6,0,1,8700,7400,Yes,12/23/2021,"Rodriguez, Yaneisy",17420949,agent_override,,Effectuated,,,4240044406,9826122,MyBlue Health Bronze 402,513.6,33602TX0860002,313 Meadowhill Dr,,,TRUE,12/23/2021,,12/31/2022,Effectuated,2,18000,Spanish,,0,0,0,0,0,0,FALSE,,,2021-12-23 23:51:23 UTC,,,,,,,,Oscar,Villalta,,,male,12/21/2001,FALSE,,,,,,,,,,,,,,,,,,,,,,,,,,,,,,,,,,,,,,,,,,,,,,,,,,,,,,,,,,,,,,,,Yes,https://www.healthsherpa.com/access/126302352121,6/16/2022 16:44,$0.00 ,
Casimiro,Luisjuan Vazques,,,male,3/9/1957,TRUE,2364 Fourth St,,Gainesville,GA,30504-5929,Hall,FALSE,FALSE,FALSE,FALSE,6783166381,casi21@live.com,Anthem Bronze Pathway X HMO 6000,,Expanded Bronze,Blue Cross Blue Shield Healthcare Plan of Georgia,1/1/2022,1527.84,1527.84,0,0,8700,6000,Yes,12/27/2021,"Rodriguez, Yaneisy",17420949,agent_override,,Terminated,expired,,4140750736,5314017,Anthem Bronze Pathway X HMO 6000($0 Virtual PCP+$0 Select Drugs),1527.84,49046GA0410022,2364 Fourth St,,,FALSE,1/5/2022,1/26/2022,1/25/2022,Terminated,2,30000,Spanish,,0,3,0,0,0,0,FALSE,,,2021-12-27 16:04:08 UTC,Maria,Luisjuan Gonzales,,,female,5/1/1953,TRUE,,,,,,,,,,,,,,,,,,,,,,,,,,,,,,,,,,,,,,,,,,,,,,,,,,,,,,,,,,,,,,,,,,,,,,,Yes,https://www.healthsherpa.com/access/908369076442,11/30/2022 21:38,$0.00 ,
Escaniel,Rodriguez Olivas,,***-**-7010,male,9/25/1960,TRUE,1006 Center Ave,Casa,Odessa,TX,79761,Ector,FALSE,FALSE,FALSE,FALSE,4326643482,escanielrodriguez@gmail.com,Blue Advantage Silver HMO℠ 205,none,Silver,Blue Cross and Blue Shield of Texas,10/1/2022,1091.6,1039,52.6,0,8700,2050,Yes,12/27/2021,"Borges, Mario",17420949,agent,,PendingEffectuation,,,4131135772,8258321,Blue Advantage Silver HMO℠ 205,1091.6,33602TX0460695,1006 Center Ave,,,FALSE,,,12/31/2022,PendingEffectuation,1,19008,Spanish,,0,0,0,0,0,0,TRUE,,,2021-12-27 17:53:21 UTC,,,,,,,,,,,,,,,,,,,,,,,,,,,,,,,,,,,,,,,,,,,,,,,,,,,,,,,,,,,,,,,,,,,,,,,,,,,,,,Yes,https://www.healthsherpa.com/access/856398109183,9/27/2022 18:15,$0.00 ,
MARIA,GUTIERREZ,,***-**-3427,female,1/3/1959,TRUE,1264 County Road 6723,,Natalia,TX,78059-2503,Medina,FALSE,FALSE,FALSE,FALSE,2104733721,monis59mlg@gmail.com,Ambetter Balanced Care 32,share94,Silver,Ambetter from Superior HealthPlan,2/1/2022,1142.34,1137,5.34,1,1575,0,Yes,12/27/2021,"Rodriguez, Yaneisy",17420949,agent_override,,Effectuated,,,4150616290,7198769,Ambetter Balanced Care 32,1142.34,29418TX0140101,1264 County Road 6723,,,TRUE,12/27/2021,,12/31/2022,Effectuated,2,18000,Spanish,,0,0,0,0,0,0,FALSE,,,2021-12-27 18:03:01 UTC,Alvaro,Gutierrez,,,male,2/19/1954,FALSE,,,,,,,,,,,,,,,,,,,,,,,,,,,,,,,,,,,,,,,,,,,,,,,,,,,,,,,,,,,,,,,,,,,,,,,Yes,https://www.healthsherpa.com/access/609629754332,8/19/2022 17:31,$0.00 ,
Melkin,Ayala Guevara,,***-**-7077,male,4/18/1989,TRUE,2963 Magnolia St,,Fort Myers,FL,33901-6012,Lee,FALSE,FALSE,FALSE,FALSE,2392047421,Ayalaguevara2017@gmail.com,"Ambetter Essential Care: $1,500 Medical Deductible",share87,Expanded Bronze,Ambetter from Sunshine Health,8/1/2022,471.69,0,471.69,1,8700,1500,Yes,12/27/2021,"Rodriguez, Yaneisy",17420949,agent_override,,Terminated,expired,,4132859839,13456574,"Ambetter Essential Care: $1,500 Medical Deductible",471.69,21663FL0130104,2963 Magnolia St,,,FALSE,,,12/31/2022,Unknown,4,40008,Spanish,,0,7,1,0,0,0,FALSE,,,2022-02-01 22:27:44 UTC,Keidy,Rodriguez Mejia,,,female,11/21/1988,TRUE,Brianny,Ayala Rodriguez,,,female,7/18/2014,TRUE,Joshua,Ayala Rodriguez,,,female,3/10/2011,TRUE,,,,,,,,,,,,,,,,,,,,,,,,,,,,,,,,,,,,,,,,,,,,,,,,,,,,,,,,,Yes,https://www.healthsherpa.com/access/801701069243,11/22/2022 19:51,$0.00 ,
Gloria,Santos,,***-**-7138,female,10/6/1964,TRUE,29721 SW 158th Pl,,Homestead,FL,33033,Miami-Dade,FALSE,FALSE,FALSE,FALSE,7868181552,ivy.yasmine@gmail.com,Ambetter Value Silver 32,share94,Silver,Ambetter from Sunshine Health,1/1/2022,1681.71,1636,45.71,2,1575,0,Yes,12/27/2021,"Borges, Mario",17420949,agent,,Terminated,completed,,4150482409,9859353,Focused VALUE Silver,1681.71,86382FL0050009,29721 SW 158th Pl,,,FALSE,,12/27/2021,12/31/2022,Cancelled,2,18000,Spanish,,0,0,1,0,0,0,TRUE,,,2021-12-27 18:15:47 UTC,Jose,Alvarado Ortega,,***-**-3047,male,5/15/1966,TRUE,,,,,,,,,,,,,,,,,,,,,,,,,,,,,,,,,,,,,,,,,,,,,,,,,,,,,,,,,,,,,,,,,,,,,,,Yes,https://www.healthsherpa.com/access/386958293802,8/22/2022 20:39,$0.00 ,
Eddy,Hernandez Chavez,,***-**-9130,female,2/2/1960,TRUE,17050 Imperial Valley Dr,apt 19,Houston,TX,77038,Harris,FALSE,FALSE,FALSE,FALSE,7139271704,ESPER54@GMAIL.COM,MyBlue Health Silver℠ 405,,Silver,Blue Cross and Blue Shield of Texas,1/1/2022,878.88,825,53.88,0,,,Yes,12/27/2021,"Borges, Mario",17420949,agent,,Cancelled,insufficient_documentation,,4161952383,9913670,MyBlue Health Silver 405,878.88,33602TX0860008,17050 Imperial Valley Dr,,,FALSE,,2/3/2022,12/31/2022,Cancelled,3,28000,Spanish,,1,0,0,0,0,0,TRUE,,,2021-12-27 20:48:44 UTC,,,,,,,,Hector,Murillo Ortiz,,,male,8/13/2013,FALSE,Matheus,Murillo Ortiz,,,male,9/12/2019,FALSE,,,,,,,,,,,,,,,,,,,,,,,,,,,,,,,,,,,,,,,,,,,,,,,,,,,,,,,,,Yes,https://www.healthsherpa.com/access/734374352502,8/22/2022 22:34,$0.00 ,
CAROLINA,PLACENCIA DE RODRIGUEZ,,***-**-2420,female,2/22/1976,TRUE,566 Hummingbird Ct,,Kissimmee,FL,34759-4433,Polk,FALSE,FALSE,FALSE,FALSE,407-925-5573,c_placencia.castillo@hotmail.com,Ambetter Balanced Care 32,share94,Silver,Ambetter from Sunshine Health,1/1/2022,538.5,530,8.5,1,1575,0,Yes,12/27/2021,"Rodriguez, Yaneisy",17420949,agent_override,,Effectuated,,,4160722833,7734688,Focused Silver,538.5,21663FL0130112,566 Hummingbird Ct,,,TRUE,1/27/2022,,12/31/2022,Effectuated,3,28000,Spanish,,0,0,0,0,0,0,TRUE,,,2021-12-27 21:06:27 UTC,,,,,,,,,,,,,,,,,,,,,,,,,,,,,,,,,,,,,,,,,,,,,,,,,,,,,,,,,,,,,,,,,,,,,,,,,,,,,,Yes,https://www.healthsherpa.com/access/520122278602,11/3/2022 14:38,$0.00 ,
Hector,Torres Fernandez,,***-**-0927,male,9/7/1997,TRUE,11370 SW 7th St,,Miami,FL,33174-1122,Miami-Dade,FALSE,FALSE,FALSE,FALSE,2605829167,hector97torres@outlook.es,Ambetter Value Silver 32,none,Silver,Ambetter from Sunshine Health,1/1/2022,360.35,351,9.35,0,8700,8100,Yes,12/27/2021,"Rodriguez, Yaneisy",17420949,agent_override,,Effectuated,completed,,4132828073,13322417,Focused VALUE Silver,360.35,86382FL0050009,11370 SW 7th St,,,TRUE,2/13/2022,,12/31/2022,Effectuated,1,13000,Spanish,,0,0,1,0,0,0,FALSE,,,2021-12-27 21:26:00 UTC,,,,,,,,,,,,,,,,,,,,,,,,,,,,,,,,,,,,,,,,,,,,,,,,,,,,,,,,,,,,,,,,,,,,,,,,,,,,,,Yes,https://www.healthsherpa.com/access/142242722734,7/21/2022 23:14,$0.00 ,
Miguel,Vasquez,,,male,7/28/1961,TRUE,1121 Old FM 440 Rd,Apt 7101,Killeen,TX,76549-1239,Bell,FALSE,FALSE,FALSE,FALSE,863-934-1908,mvas2144549@gmail.com,Ambetter Balanced Care 30,,Silver,Ambetter from Superior HealthPlan,1/1/2022,992.21,992.21,0,1,,,Yes,12/27/2021,"Borges, Mario",17420949,agent,,Terminated,expired,,4297096274,8646290,Clear Silver,992.21,29418TX0140096,1121 Old FM 440 Rd,,,FALSE,1/5/2022,1/27/2022,1/25/2022,Terminated,1,15000,,,2,0,0,0,0,0,FALSE,,,2021-12-27 21:47:18 UTC,,,,,,,,,,,,,,,,,,,,,,,,,,,,,,,,,,,,,,,,,,,,,,,,,,,,,,,,,,,,,,,,,,,,,,,,,,,,,,Yes,https://www.healthsherpa.com/access/589627509104,6/16/2022 16:29,$0.00 ,
Marlene,Arrieta,,***-**-7464,female,9/23/1955,TRUE,14720 Westerly Dr,Apt. 2309,Winter Garden,FL,34787-8351,Orange,FALSE,FALSE,FALSE,FALSE,4697209292,marlenearrieta86@gmail.com,Ambetter Balanced Care 32,share94,Silver,Ambetter from Sunshine Health,2/1/2022,1141.13,1123,18.13,1,1575,0,Yes,12/27/2021,"Rodriguez, Yaneisy",17420949,agent_override,,Effectuated,completed,,4150589021,10739423,Focused Silver,1141.13,21663FL0130112,14720 Westerly Dr,,,TRUE,,,12/31/2022,Effectuated,1,15000,Spanish,,0,0,1,0,0,0,FALSE,,,2021-12-27 21:49:12 UTC,,,,,,,,,,,,,,,,,,,,,,,,,,,,,,,,,,,,,,,,,,,,,,,,,,,,,,,,,,,,,,,,,,,,,,,,,,,,,,Yes,https://www.healthsherpa.com/access/520267426788,9/28/2022 20:32,$0.00 ,
ISAAC,VILLAURRUTIA ALFONSO,,***-**-7284,male,8/23/1963,TRUE,5605 NW 7th St Apt A314,,Miami,FL,33126-3634,Miami-Dade,FALSE,FALSE,FALSE,FALSE,7869075542,felipeisaac568@gmail.com,AvMed Entrust Silver 350 (2022),share94,Silver,"AvMed, Inc.",2/1/2022,909.52,894,15.52,1,1000,0,Yes,12/27/2021,"Rodriguez, Yaneisy",17420949,agent_override,,Effectuated,,,4139828443,13971632,AvMed Entrust Silver 350 (2023),909.52,19898FL0340003,5605 NW 7th St Apt A314,,,TRUE,,,9/30/2022,Effectuated,2,24000,Spanish,,0,0,0,0,0,0,FALSE,,,2021-12-27 22:12:03 UTC,MAGALY,GARCIA CUELLO,,***-**-8347,female,8/1/1956,FALSE,,,,,,,,,,,,,,,,,,,,,,,,,,,,,,,,,,,,,,,,,,,,,,,,,,,,,,,,,,,,,,,,,,,,,,,Yes,https://www.healthsherpa.com/access/371195791326,9/28/2022 20:31,$0.00 ,
MIGUEL,RUIZ PLANA,,,male,4/3/1973,TRUE,4000 24TH ST N LOT 4 ST,LOT 562,PETERSBURG,FL,33714,Pinellas,FALSE,FALSE,FALSE,FALSE,7275636218,MIGUELRUIZ690@YAHOO.COM,Ambetter Balanced Care 32,,Silver,Ambetter from Sunshine Health,6/1/2022,626.1,614,12.1,0,,,Yes,12/27/2021,"Rodriguez, Yaneisy",17420949,agent_override,,Terminated,expired,,4153207107,14803937,Focused Silver,626.1,21663FL0130112,4000 24TH ST N LOT 4 ST,,,FALSE,,9/27/2022,12/31/2022,Cancelled,1,13992,Spanish,,0,2,0,0,0,0,FALSE,,,2021-12-27 22:45:30 UTC,,,,,,,,,,,,,,,,,,,,,,,,,,,,,,,,,,,,,,,,,,,,,,,,,,,,,,,,,,,,,,,,,,,,,,,,,,,,,,Yes,https://www.healthsherpa.com/access/193437478509,9/27/2022 18:02,$0.00 ,
LIVAN,ALVAREZ TARGARONA,,***-**-9818,male,9/14/1977,TRUE,11150 SW 196th St,Apt D 309,Cutler Bay,FL,33157-8336,Miami-Dade,FALSE,FALSE,FALSE,FALSE,7862508530,livanalvarez62@yahoo.com,Ambetter Balanced Care 32,share94,Silver,Ambetter from Sunshine Health,8/1/2022,561.65,490,71.65,1,1575,0,Yes,12/28/2021,"Borges, Mario",17420949,agent,,Effectuated,completed,,4136535208,5923816,Focused Silver,561.65,21663FL0130113,11150 SW 196th St,,,TRUE,,,12/31/2022,Effectuated,1,17400,Spanish,,0,0,1,0,0,0,TRUE,,,2021-12-28 15:30:04 UTC,MAIBET,DIAZ HERNANDEZ,,***-**-7980,female,2/12/1982,TRUE,CESAR,ALVAREZ DIAZ,,,male,10/23/2006,TRUE,,,,,,,,,,,,,,,,,,,,,,,,,,,,,,,,,,,,,,,,,,,,,,,,,,,,,,,,,,,,,,,,Yes,https://www.healthsherpa.com/access/480297037999,11/2/2022 17:30,$0.00 ,
Maria,Rojas,,***-**-8901,female,7/21/1966,TRUE,4363 County Road 323,,Valley View,TX,76272-3022,Cooke,FALSE,FALSE,FALSE,FALSE,4693152670,rojasleti.70@gmail.com,Blue Advantage Silver HMO℠ 205,none,Silver,Blue Cross and Blue Shield of Texas,8/1/2022,3349.45,3349.45,0,1,8700,2050,Yes,12/28/2021,"Rodriguez, Yaneisy",17420949,agent_override,,PendingEffectuation,expired,,4301816586,10838425,Blue Advantage Silver HMO℠ 205,3349.45,33602TX0460704,4363 County Road 323,,,FALSE,,,12/31/2022,PendingEffectuation,2,18000.2,Spanish,,1,1,1,0,0,0,FALSE,,,2022-05-03 21:20:59 UTC,Efrain,Rodriguez Fierro,,***-**-3575,male,4/3/1953,TRUE,,,,,,,,,,,,,,,,,,,,,,,,,,,,,,,,,,,,,,,,,,,,,,,,,,,,,,,,,,,,,,,,,,,,,,,Yes,https://www.healthsherpa.com/access/464213400602,8/17/2022 17:14,$0.00 ,
Any,Medina Hernandez,,***-**-4480,female,2/14/1974,TRUE,126 SW 5th Ct,,Dania Beach,FL,33004-3513,Broward,FALSE,FALSE,FALSE,FALSE,3059634926,,Ambetter Select Silver 11,share87,Silver,Ambetter from Sunshine Health,2/15/2022,938.84,837,101.84,2,2900,0,Yes,12/28/2021,"Insurance, Yes to",17420949,agent_override,,Effectuated,completed,,4142276287,13710259,Complete SELECT Silver with Select Providers,938.84,86382FL0040006,126 SW 5th Ct,,,TRUE,2/15/2022,,12/31/2022,Effectuated,3,34900,Spanish,,0,0,2,0,0,0,FALSE,,,2022-02-15 17:09:40 UTC,Julio,Miranda,,,male,12/17/1936,FALSE,Melvin,Medina,,***-**-8657,male,2/16/2000,TRUE,,,,,,,,,,,,,,,,,,,,,,,,,,,,,,,,,,,,,,,,,,,,,,,,,,,,,,,,,,,,,,,,Yes,https://www.healthsherpa.com/access/643961093906,5/26/2022 19:23,$0.00 ,
Daniel,Tello,,,male,6/8/1998,TRUE,4 E Lagrande St,,Avon Park,FL,33825-2716,Highlands,FALSE,FALSE,FALSE,FALSE,8634432691,Daniel.tel13@yahoo.com,Ambetter Essential Care: $0 Medical Deductible,share94,Expanded Bronze,Ambetter from Sunshine Health,1/1/2022,356.21,356.21,0,0,8700,0,Yes,12/28/2021,"Rodriguez, Yaneisy",17420949,agent_override,,Terminated,expired,,4302150681,14006893,Elite Bronze,356.21,21663FL0130106,4 E Lagrande St,,,FALSE,3/21/2022,5/9/2022,4/30/2022,Terminated,1,13000,Spanish,,0,2,0,0,0,0,FALSE,,,2022-03-21 17:42:43 UTC,,,,,,,,,,,,,,,,,,,,,,,,,,,,,,,,,,,,,,,,,,,,,,,,,,,,,,,,,,,,,,,,,,,,,,,,,,,,,,Yes,https://www.healthsherpa.com/access/569054254085,8/22/2022 18:20,$0.00 ,
cynthia,hernandez,,***-**-7574,female,8/29/1990,TRUE,14222 Heritage Cir,4-109,Farmers Branch,TX,75234-3312,Dallas,FALSE,FALSE,FALSE,FALSE,2145175795,cynthern@outlook.com,MyBlue Health Silver℠ 405,share94,Silver,Blue Cross and Blue Shield of Texas,1/1/2022,639.32,595,44.32,2,1000,0,Yes,12/29/2021,"Borges, Mario",17420949,agent,,Effectuated,,,4148518181,7901131,MyBlue Health Silver 405,639.32,33602TX0860007,14222 Heritage Cir,,,TRUE,12/29/2021,,12/31/2022,Effectuated,2,18000,Spanish,,0,0,0,0,0,0,FALSE,,,2021-12-29 14:52:54 UTC,,,,,,,,Olivianahel,Garcia,,***-**-0957,female,1/29/2015,TRUE,,,,,,,,,,,,,,,,,,,,,,,,,,,,,,,,,,,,,,,,,,,,,,,,,,,,,,,,,,,,,,,,Yes,https://www.healthsherpa.com/access/250262859239,9/29/2022 18:22,$0.00 ,
Salvador,Martinez,,***-**-0460,male,12/24/1973,TRUE,23200 Forest North Dr,apt 1405,Kingwood,TX,77339-2089,Montgomery,FALSE,FALSE,FALSE,FALSE,7137751694,smsrecords2019@gmail.com,Blue Advantage Silver HMO℠ 205,,Silver,Blue Cross and Blue Shield of Texas,1/1/2022,656.96,495,161.96,0,,,Yes,1/3/2022,"Rodriguez, Yaneisy",17420949,agent_override,,Cancelled,,,4308116198,11241008,Blue Advantage Silver HMO℠ 205,656.96,33602TX0460688,23200 Forest North Dr,,,FALSE,,2/13/2022,12/31/2022,Cancelled,1,15000,Spanish,,0,0,0,0,0,0,FALSE,,,2022-01-03 19:02:55 UTC,,,,,,,,,,,,,,,,,,,,,,,,,,,,,,,,,,,,,,,,,,,,,,,,,,,,,,,,,,,,,,,,,,,,,,,,,,,,,,Yes,https://www.healthsherpa.com/access/42620498475,8/22/2022 22:36,$0.00 ,
Erick,Benitez  Menendez,,,male,9/27/2001,TRUE,2605 Studley Rd,,Charlotte,NC,28212-1562,Mecklenburg,FALSE,FALSE,FALSE,FALSE,7044916091,virginiobenites@gmail.com,Blue Home Silver 5300 + 3 Free PCP with Novant Health,,Silver,Blue Cross and Blue Shield of NC,2/1/2022,360.28,360.28,0,0,,,Yes,1/4/2022,"Rodriguez, Yaneisy",17420949,agent_override,,Terminated,expired,,4312759670,6163758,Blue Home Silver 5300 + 3 Free PCP with Novant Health,360.28,11512NC0340017,2605 Studley Rd,,,FALSE,1/6/2022,6/16/2022,5/31/2022,Terminated,1,13000,Spanish,,0,2,0,0,0,0,FALSE,,,2022-01-04 16:14:55 UTC,,,,,,,,,,,,,,,,,,,,,,,,,,,,,,,,,,,,,,,,,,,,,,,,,,,,,,,,,,,,,,,,,,,,,,,,,,,,,,Yes,https://www.healthsherpa.com/access/705814923955,8/19/2022 16:28,$0.00 ,
FRANCIS,RODRIGUEZ,,***-**-7728,female,5/26/1973,TRUE,5922 Ricker Park Cir,,Katy,TX,77449-2020,Harris,FALSE,FALSE,FALSE,FALSE,3464045584,rodriguez.francis74@yahoo.com,Ambetter Balanced Care 32,share94,Silver,Ambetter from Superior HealthPlan,9/1/2022,626.29,501,125.29,1,1575,0,Yes,1/10/2022,"Borges, Mario",17420949,agent,,Effectuated,,,4134496599,7556404,Focused Silver,626.29,29418TX0140100,5922 Ricker Park Cir,,,TRUE,8/18/2022,,12/31/2022,Effectuated,2,20000,Spanish,,0,0,0,0,0,0,TRUE,,,2022-08-16 20:39:51 UTC,VICTOR,RODRIGUEZ RODRIGUEZ,,***-**-3766,male,4/12/1957,FALSE,,,,,,,,,,,,,,,,,,,,,,,,,,,,,,,,,,,,,,,,,,,,,,,,,,,,,,,,,,,,,,,,,,,,,,,Yes,https://www.healthsherpa.com/access/696738908830,8/18/2022 17:14,$0.00 ,
Jorge,Gomez Alvarez,,***-**-5429,male,10/20/1999,TRUE,2541 Wadeview Loop,,Saint Cloud,FL,34769,Osceola,FALSE,FALSE,FALSE,FALSE,4076939225,jorge@yti.com,Ambetter Balanced Care 12,share94,Silver,Ambetter from Sunshine Health,1/1/2022,391.57,360,31.57,1,1400,0,Yes,3/29/2022,"Rodriguez, Yaneisy",17420949,agent_override,,Effectuated,,,4132844302,11376180,Everyday Silver,391.57,21663FL0130039,2541 Wadeview Loop,,,TRUE,3/29/2022,,12/31/2022,Effectuated,1,18700,Spanish,,0,0,0,0,0,0,TRUE,,,2022-03-29 18:24:50 UTC,,,,,,,,,,,,,,,,,,,,,,,,,,,,,,,,,,,,,,,,,,,,,,,,,,,,,,,,,,,,,,,,,,,,,,,,,,,,,,Yes,https://www.healthsherpa.com/access/268674024853,6/16/2022 17:06,$0.00 ,
Fausto,Tello Hernandez,,***-**-9304,male,9/6/1964,TRUE,4 E Lagrande St,,Avon Park,FL,33825,Highlands,FALSE,FALSE,FALSE,FALSE,8632572375,,Ambetter Essential Care: $0 Medical Deductible,share94,Expanded Bronze,Ambetter from Sunshine Health,2/1/2022,1563.37,1563.37,0,2,8700,0,Yes,1/11/2022,"Borges, Mario",17420949,agent,,Terminated,expired,,4146908211,10809609,Elite Bronze,1563.37,21663FL0130106,4 E Lagrande St,,,FALSE,,,1/29/2022,Terminated,2,20400,Spanish,,0,2,1,0,0,0,FALSE,,,2022-01-11 21:12:28 UTC,Fulgencia,Tello,,***-**-2511,female,5/11/1969,TRUE,,,,,,,,,,,,,,,,,,,,,,,,,,,,,,,,,,,,,,,,,,,,,,,,,,,,,,,,,,,,,,,,,,,,,,,Yes,https://www.healthsherpa.com/access/631193402521,8/19/2022 15:16,$0.00 ,
LUZ,SANCHEZ,,***-**-5798,female,6/1/1971,TRUE,27 Hearthwick Rd,,Tomball,TX,77375,Harris,FALSE,FALSE,FALSE,FALSE,9367037909,sanchez_luzelena@yahoo.com,MyBlue Health Silver℠ 405,share94,Silver,Blue Cross and Blue Shield of Texas,6/1/2022,1074.68,1052,22.68,3,1000,0,Yes,1/14/2022,"Borges, Mario",17420949,agent,,Effectuated,completed,,4199420117,10917504,MyBlue Health Silver 405,1074.68,33602TX0860008,27 Hearthwick Rd,,,TRUE,5/3/2022,,12/31/2022,Effectuated,4,26820,Spanish,,0,0,2,0,0,0,FALSE,,,2022-05-03 18:52:41 UTC,Leonardo,Orbegozo,,,male,10/20/1969,TRUE,Juan,Orbegozo,,***-**-6756,male,8/26/2004,TRUE,Daniel,Orbegozo Sanchez,,***-**-8100,male,4/12/2007,TRUE,,,,,,,,,,,,,,,,,,,,,,,,,,,,,,,,,,,,,,,,,,,,,,,,,,,,,,,,,Yes,https://www.healthsherpa.com/access/592364834134,11/30/2022 19:38,$0.00 ,
Steven,Rodriguez,,***-**-7945,male,6/6/2001,TRUE,5922 Ricker Park Cir,,Katy,TX,77449-2020,Harris,FALSE,FALSE,FALSE,FALSE,346-404-5589,steveen675@gmail.com,Ambetter Value Silver 32,,Silver,Ambetter from Superior Health Plan,2/1/2022,307.99,285,22.99,1,,,Yes,1/17/2022,"Borges, Mario",17420949,agent,,Terminated,,,4353882758,10197326,Focused VALUE Silver,307.99,87226TX0100009,5922 Ricker Park Cir,,,FALSE,1/27/2022,4/8/2022,3/23/2022,Terminated,1,14400,,,0,0,0,0,0,0,FALSE,,,2022-01-17 14:07:52 UTC,,,,,,,,,,,,,,,,,,,,,,,,,,,,,,,,,,,,,,,,,,,,,,,,,,,,,,,,,,,,,,,,,,,,,,,,,,,,,,Yes,https://www.healthsherpa.com/access/762035784698,6/16/2022 17:02,$0.00 ,
Luis,Matla,,***-**-5082,male,4/26/1964,TRUE,8327 Willow Path,Trailer,Tomball,TX,77375-5490,Harris,FALSE,FALSE,FALSE,FALSE,8322729157,BENIVAZQUEZ26@GMAIL.COM,MyBlue Health Bronze℠ 402,share94,Expanded Bronze,Blue Cross and Blue Shield of Texas,5/1/2022,630.52,630.52,0,1,8700,7400,Yes,1/24/2022,"Rodriguez, Yaneisy",17420949,agent_override,,Effectuated,completed,,4359111212,11002684,MyBlue Health Bronze 402,630.52,33602TX0860005,8327 Willow Path,,,TRUE,,,12/31/2022,Effectuated,3,30000,Spanish,,1,0,3,0,0,0,FALSE,,,2022-01-24 20:55:36 UTC,Benita,Vazquez,,,female,10/8/1980,FALSE,Luis,Matla,,,male,3/19/2009,FALSE,,,,,,,,,,,,,,,,,,,,,,,,,,,,,,,,,,,,,,,,,,,,,,,,,,,,,,,,,,,,,,,,Yes,https://www.healthsherpa.com/access/952818616829,8/18/2022 15:17,$0.00 ,
Jose,Ornelas,,,male,3/19/1976,FALSE,1206 Mesquite St,,Big Spring,TX,79720-3922,Howard,FALSE,FALSE,FALSE,FALSE,8326097970,aliciabrivera8@icloud.com,Blue Advantage Silver HMO℠ 205,share94,Silver,Blue Cross and Blue Shield of Texas,2/16/2022,972.28,972.28,0,5,900,0,Yes,5/30/2022,"Borges, Mario",17420949,agent,,Effectuated,action_needed,,4239539020,9362059,Blue Advantage Silver HMO℠ 205,972.28,33602TX0460704,1206 Mesquite St,,,TRUE,5/30/2022,,12/31/2022,Effectuated,6,45001,Spanish,,1,0,0,0,0,0,TRUE,,,2022-05-30 15:02:54 UTC,,,,,,,,Paris,Ornelas,,***-**-4817,female,2/18/2013,TRUE,Jackelin,Ornelas,,***-**-2746,female,9/3/2005,TRUE,Brandon,Ornelas,,***-**-0900,male,2/18/2013,TRUE,Stephen,Calderon,,***-**-9622,male,10/6/2007,TRUE,Allison,Ornelas,,***-**-1624,female,12/14/2010,TRUE,,,,,,,,,,,,,,,,,,,,,,,,,,,,,,,,,,,,Yes,https://www.healthsherpa.com/access/352834110683,6/16/2022 16:16,$0.00 ,
Yamileth,Balanta,,***-**-9224,female,8/7/1972,TRUE,5137 Taos Dr,,Abilene,TX,79605,Taylor,FALSE,FALSE,FALSE,FALSE,3257335749,yamilethbalanta10@gmail.com,Blue Advantage Silver HMO℠ 205,share94,Silver,Blue Cross and Blue Shield of Texas,2/1/2022,2523.21,2498,25.21,4,900,0,Yes,7/5/2022,"Rodriguez, Yaneisy",17420949,agent_override,,Effectuated,,,4124246815,2473103,Blue Advantage Silver HMO℠ 205,2523.21,33602TX0460553,5137 Taos Dr,,,TRUE,7/5/2022,,12/31/2022,Effectuated,4,35332.8,Spanish,,0,0,0,0,0,0,TRUE,,,2022-07-05 20:21:43 UTC,Huber,Lozano,,***-**-9223,male,11/10/1962,TRUE,Santiago,Lozano,,***-**-7601,male,3/22/2009,TRUE,Esteban,Lozano,,***-**-1754,male,10/2/2006,TRUE,,,,,,,,,,,,,,,,,,,,,,,,,,,,,,,,,,,,,,,,,,,,,,,,,,,,,,,,,Yes,https://www.healthsherpa.com/access/124709125885,9/19/2022 18:34,$0.00 ,
Sebastian,Castanon Castanon,,***-**-1082,male,12/5/1981,TRUE,1468 SE 15 TH AVE,Trailer,Arcadia,FL,34266,DeSoto,FALSE,FALSE,FALSE,FALSE,8632458037,sebastian@yti.com,"Ambetter Essential Care: $1,500 Medical Deductible",share94,Expanded Bronze,Ambetter from Sunshine Health,3/1/2022,864.79,864.79,0,0,8700,1500,Yes,2/16/2022,"Borges, Mario",17420949,agent,,Terminated,expired,,4153337235,12664910,"Ambetter Essential Care: $1,500 Medical Deductible",864.79,21663FL0130104,1468 SE 15 TH AVE,,,FALSE,2/21/2022,5/9/2022,3/7/2022,Terminated,2,18000,Spanish,,0,4,0,0,0,0,TRUE,,,2022-02-21 15:56:41 UTC,Paloma,Betancourt,,***-**-4777,female,4/13/1990,TRUE,,,,,,,,,,,,,,,,,,,,,,,,,,,,,,,,,,,,,,,,,,,,,,,,,,,,,,,,,,,,,,,,,,,,,,,Yes,https://www.healthsherpa.com/access/15487572180,8/18/2022 20:05,$0.00 ,
Esther,Morales,,***-**-3259,female,11/20/1962,TRUE,2174 W Myakka Rd,,Avon Park,FL,33825-9591,Highlands,FALSE,FALSE,FALSE,FALSE,3055024439,narelo43@hotmail.com,Ambetter Balanced Care 32,share94,Silver,Ambetter from Sunshine Health,7/1/2022,973.99,958,15.99,1,1575,0,Yes,2/4/2022,"Rodriguez, Yaneisy",17420949,agent_override,,PendingEffectuation,completed,,4139349006,14539057,Focused Silver,973.99,21663FL0130112,2174 W Myakka Rd,,,FALSE,,,12/31/2022,PendingEffectuation,1,13008,Spanish,,0,0,1,0,0,0,TRUE,,,2022-06-29 16:37:32 UTC,,,,,,,,,,,,,,,,,,,,,,,,,,,,,,,,,,,,,,,,,,,,,,,,,,,,,,,,,,,,,,,,,,,,,,,,,,,,,,Yes,https://www.healthsherpa.com/access/284339241857,6/29/2022 16:37,$0.00 ,
OLGA,TERRAZAS,,***-**-7731,female,12/17/1967,TRUE,5310 Castle Cv,,San Antonio,TX,78242-3028,Bexar,FALSE,FALSE,FALSE,FALSE,210-409-1779,olga.terrazas12@hotmail.com,Ambetter Value Silver 32,share94,Silver,Ambetter from Superior Health Plan,1/1/2022,699.16,667,32.16,1,1575,0,Yes,2/7/2022,"Rodriguez, Yaneisy",17420949,agent_override,,Effectuated,expired,,4140776402,9638121,Focused VALUE Silver,699.16,87226TX0080009,5310 Castle Cv,,,TRUE,2/7/2022,,12/31/2022,Effectuated,2,17000,,,0,1,3,0,0,0,FALSE,,,2022-02-07 15:55:51 UTC,,,,,,,,GEOVANY JESUS,MERAZ,,,male,9/7/2001,TRUE,,,,,,,,,,,,,,,,,,,,,,,,,,,,,,,,,,,,,,,,,,,,,,,,,,,,,,,,,,,,,,,,Yes,https://www.healthsherpa.com/access/976955732006,11/17/2022 19:06,$0.00 ,
Niola,Roche,,***-**-8613,female,5/7/1960,TRUE,3630 Sadge Ln,,Irving,TX,75062-8400,Dallas,FALSE,FALSE,FALSE,FALSE,2145547352,aloin7@yahoo.com,MyBlue Health Silver℠ 405,share94,Silver,Blue Cross and Blue Shield of Texas,4/1/2022,933.72,868,65.72,1,1000,0,Yes,2/10/2022,"Rodriguez, Yaneisy",17420949,agent_override,,Terminated,expired,,4129110950,9540124,MyBlue Health Silver 405,933.72,33602TX0860007,3630 Sadge Ln,,,FALSE,5/9/2022,6/16/2022,5/31/2022,Terminated,1,19296,Spanish,,0,1,1,0,0,0,FALSE,,,2022-02-10 20:47:44 UTC,,,,,,,,,,,,,,,,,,,,,,,,,,,,,,,,,,,,,,,,,,,,,,,,,,,,,,,,,,,,,,,,,,,,,,,,,,,,,,Yes,https://www.healthsherpa.com/access/635010045841,6/16/2022 17:15,$0.00 ,
Heraclio,Bustillos,,***-**-2407,male,1/9/1964,TRUE,284 Lomita St,,Del Rio,TX,78840,Val Verde,FALSE,FALSE,FALSE,FALSE,8303133855,annettebustillos@hotmail.com,Blue Advantage Silver HMO℠ 205,share94,Silver,Blue Cross and Blue Shield of Texas,7/1/2022,2904.22,2904.22,0,1,900,0,Yes,2/16/2022,"Rodriguez, Yaneisy",17420949,agent_override,,Terminated,expired,,4226629121,10027137,Blue Advantage Silver HMO℠ 205,2904.22,33602TX0460704,284 Lomita St,,,FALSE,,,10/1/2022,Cancelled,3,27001,Spanish,,0,5,0,0,0,0,TRUE,,,2022-03-14 15:43:06 UTC,Rosa,Bustillos,,***-**-0444,female,12/6/1968,TRUE,Natalia,Sanchez,,,female,8/20/2007,FALSE,,,,,,,,,,,,,,,,,,,,,,,,,,,,,,,,,,,,,,,,,,,,,,,,,,,,,,,,,,,,,,,,Yes,https://www.healthsherpa.com/access/64894261123,11/4/2022 21:28,$0.00 ,
Pedro,Chavarria Bonilla,,***-**-4744,male,12/20/1993,TRUE,2244 SW Morris Dr,,Lees Summit,MO,64082-4131,Jackson,FALSE,FALSE,FALSE,FALSE,9137171779,erikaestokes@gmail.com,Ambetter Balanced Care 32,share94,Silver,Ambetter HomeState Health,3/1/2022,382.66,372,10.66,1,1575,0,Yes,2/16/2022,"Rodriguez, Yaneisy",17420949,agent_override,,Terminated,expired,,4218200709,3244543,Focused Silver,382.66,99723MO0090059,2244 SW Morris Dr,,,FALSE,3/2/2022,9/28/2022,6/30/2022,Terminated,3,31000,Spanish,,0,3,0,0,0,0,FALSE,,,2022-02-16 23:00:28 UTC,,,,,,,,Itan,Chavarria,,,male,1/13/2019,FALSE,Novaly,Chavarria,,,female,4/23/2020,FALSE,,,,,,,,,,,,,,,,,,,,,,,,,,,,,,,,,,,,,,,,,,,,,,,,,,,,,,,,,Yes,https://www.healthsherpa.com/access/426199685922,9/28/2022 15:36,$0.00 ,
Alejandro,Chavarria Bonilla,,***-**-9411,male,12/23/1999,TRUE,2244 SW Morris Dr,,Lees Summit,MO,64082-4131,Jackson,FALSE,FALSE,FALSE,FALSE,9137171779,erikaestokes@gmail.com,Ambetter Balanced Care 32,share94,Silver,Ambetter HomeState Health,3/1/2022,352.04,342,10.04,0,1575,0,Yes,2/17/2022,"Borges, Mario",17420949,agent,,Terminated,expired,,4218435611,2455692,Focused Silver,352.04,99723MO0090059,2244 SW Morris Dr,,,FALSE,,2/17/2022,12/31/2022,Cancelled,2,25000,Spanish,,0,2,0,0,0,0,FALSE,,,2022-02-17 20:08:09 UTC,,,,,,,,Jiana,Chavarria,,,female,1/24/2021,FALSE,,,,,,,,,,,,,,,,,,,,,,,,,,,,,,,,,,,,,,,,,,,,,,,,,,,,,,,,,,,,,,,,Yes,https://www.healthsherpa.com/access/596791403867,9/28/2022 15:35,$0.00 ,
Marcial,Gutierrez,,***-**-6195,male,6/9/1966,TRUE,1305 N Washington Ave,,Karnes City,TX,78118,Karnes,FALSE,FALSE,FALSE,FALSE,5129951194,GutierrezMarcial@gmail.com,Blue Advantage Gold HMO℠ 206,,Gold,Blue Cross and Blue Shield of Texas,3/1/2022,855.11,855.11,0,0,8700,750,Yes,2/18/2022,"Borges, Mario",17420949,agent,,Terminated,expired,,4194801532,9082610,Blue Advantage Gold HMO℠ 206,855.11,33602TX0460579,1305 N Washington Ave,,,FALSE,2/24/2022,6/16/2022,5/31/2022,Terminated,1,25000,Spanish,,0,2,0,0,0,0,FALSE,,,2022-02-18 19:28:11 UTC,,,,,,,,,,,,,,,,,,,,,,,,,,,,,,,,,,,,,,,,,,,,,,,,,,,,,,,,,,,,,,,,,,,,,,,,,,,,,,Yes,https://www.healthsherpa.com/access/322547491148,8/18/2022 20:51,$0.00 ,
Jessica,Maldonado,,***-**-0178,female,9/11/1982,TRUE,11119 Carrizo Dr,,Laredo,TX,78045-7369,Webb,FALSE,FALSE,FALSE,FALSE,7875601527,jessunderscore07m@yahoo.com,Ambetter Balanced Care 32,share87,Silver,Ambetter from Superior HealthPlan,4/1/2022,702.35,610,92.35,2,2900,0,Yes,3/1/2022,"Rodriguez, Yaneisy",17420949,agent_override,,Effectuated,completed,,4387442713,10922437,Focused Silver,702.35,29418TX0140100,11119 Carrizo Dr,,,TRUE,3/24/2022,,12/31/2022,Effectuated,4,52000,Spanish,,0,0,4,0,0,0,FALSE,,,2022-03-01 17:58:23 UTC,Jose,Matos,,,male,3/20/1989,FALSE,Chloe,Matos,,***-**-0130,female,11/2/2014,TRUE,Carlos,Velez,,,male,3/13/2014,FALSE,,,,,,,,,,,,,,,,,,,,,,,,,,,,,,,,,,,,,,,,,,,,,,,,,,,,,,,,,Yes,https://www.healthsherpa.com/access/66336053734,8/18/2022 17:45,$0.00 ,
Rosalinda,Guerra,,***-**-1173,female,10/28/1969,TRUE,1424 SE Tangelo Dr,,Arcadia,FL,34266,DeSoto,FALSE,FALSE,FALSE,FALSE,8634731314,remigioroman1082@gmail.com,Ambetter Balanced Care 32,share94,Silver,Ambetter from Sunshine Health,4/1/2022,772.06,760,12.06,1,1575,0,Yes,3/8/2022,"Rodriguez, Yaneisy",17420949,agent_override,,Effectuated,completed,,4392918083,11697632,Focused Silver,772.06,21663FL0130112,1424 SE Tangelo Dr,,,TRUE,5/30/2022,,12/31/2022,Effectuated,2,21001.2,Spanish,,1,0,1,0,0,0,FALSE,,,2022-05-30 14:36:21 UTC,Remigio,Roman,,,male,10/21/1983,FALSE,,,,,,,,,,,,,,,,,,,,,,,,,,,,,,,,,,,,,,,,,,,,,,,,,,,,,,,,,,,,,,,,,,,,,,,Yes,https://www.healthsherpa.com/access/618881592794,11/16/2022 16:05,$0.00 ,
Maria,Rojas,,***-**-8901,female,7/21/1966,TRUE,4363 County Road 323,,Valley View,TX,76272-3022,Cooke,FALSE,FALSE,FALSE,FALSE,4693152670,rojasleti.70@gmail.com,Blue Advantage Silver HMO℠ 205,share94,Silver,Blue Cross and Blue Shield of Texas,8/1/2022,2128.51,2128.51,0,2,900,0,Yes,3/16/2022,"Borges, Mario",17420949,agent,,Effectuated,expired,,4301816586,10838425,Blue Advantage Silver HMO℠ 205,2128.51,33602TX0460704,4363 County Road 323,,,TRUE,7/25/2022,,12/31/2022,Effectuated,2,18000.2,Spanish,,2,1,1,0,0,0,FALSE,,,2022-07-25 16:31:26 UTC,Efrain,Rodriguez Fierro,,***-**-3575,male,4/3/1953,TRUE,,,,,,,,,,,,,,,,,,,,,,,,,,,,,,,,,,,,,,,,,,,,,,,,,,,,,,,,,,,,,,,,,,,,,,,Yes,https://www.healthsherpa.com/access/848956937628,7/25/2022 16:31,$0.00 ,
Yazmin,Rodriguez,,***-**-5040,female,8/25/1981,TRUE,1078 Linden St,,Clermont,FL,34711-2841,Lake,PO Box 138062,Clermont,FL,34713-8062,407-285-4638,yandrian@hotmail.com,Ambetter Balanced Care 32,share94,Silver,Ambetter from Sunshine Health,4/1/2022,469.93,456,13.93,1,1575,0,Yes,3/31/2022,"Borges, Mario",17420949,agent,,Terminated,,,4276415472,10459933,Focused Silver,469.93,21663FL0130112,1078 Linden St,,,FALSE,4/7/2022,8/18/2022,5/31/2022,Terminated,1,14000,Spanish,,0,0,0,0,0,0,TRUE,,,2022-03-31 17:52:56 UTC,,,,,,,,,,,,,,,,,,,,,,,,,,,,,,,,,,,,,,,,,,,,,,,,,,,,,,,,,,,,,,,,,,,,,,,,,,,,,,Yes,https://www.healthsherpa.com/access/137775445357,12/2/2022 17:32,$0.00 ,
Elsa,Ramirez H.,,***-**-1676,female,4/7/1957,TRUE,115 E Turnbo Rd,,Harker Heights,TX,76548-2410,Bell,FALSE,FALSE,FALSE,FALSE,2547687940,elsaramirez0657@gmail.com,Ambetter Balanced Care 32,share94,Silver,Ambetter from Superior HealthPlan,5/1/2022,1133.81,1097,36.81,1,1575,0,Yes,4/11/2022,"Borges, Mario",17420949,agent,,Terminated,expired,,4124289169,11038629,Focused Silver,1133.81,29418TX0140100,115 E Turnbo Rd,,,FALSE,5/10/2022,8/18/2022,8/1/2022,Terminated,2,17500,Spanish,,0,1,1,0,0,0,FALSE,,,2022-05-10 20:30:55 UTC,Felix,Martinez,,***-**-6031,male,7/10/1943,FALSE,,,,,,,,,,,,,,,,,,,,,,,,,,,,,,,,,,,,,,,,,,,,,,,,,,,,,,,,,,,,,,,,,,,,,,,Yes,https://www.healthsherpa.com/access/351943412512,9/6/2022 21:34,$0.00 ,
Maria,Cano,,***-**-1117,female,1/3/1967,TRUE,868 N Paddock St,,Stephenville,TX,76401-3131,Erath,FALSE,FALSE,FALSE,FALSE,2544136443,elenacano68@gmail.com,Blue Advantage Plus Silver℠ 605,none,Silver,Blue Cross and Blue Shield of Texas,5/1/2022,2125.03,1734,391.03,2,8700,0,Yes,4/18/2022,"Borges, Mario",17420949,agent,,Effectuated,completed,,4417341572,1026620,Blue Advantage Plus Silver℠ 605,2125.03,33602TX0770312,868 N Paddock St,,,TRUE,4/25/2022,,12/31/2022,Effectuated,2,60000,Spanish,,0,0,1,0,0,0,FALSE,,,2022-04-18 21:57:18 UTC,Jose A,Cano Junior,,***-**-8677,male,8/1/1964,TRUE,,,,,,,,,,,,,,,,,,,,,,,,,,,,,,,,,,,,,,,,,,,,,,,,,,,,,,,,,,,,,,,,,,,,,,,Yes,https://www.healthsherpa.com/access/261801662621,8/23/2022 16:10,$0.00 ,
Natalia,Quintero,,,female,4/26/2000,TRUE,4769 Coral Castle Dr,,Kissimmee,FL,34746-6759,Osceola,FALSE,FALSE,FALSE,FALSE,3218304962,nataliaquintero@gmail.com,Ambetter Balanced Care 32,,Silver,Ambetter from Sunshine Health,5/1/2022,378.47,360,18.47,0,,,Yes,4/22/2022,"Rodriguez, Yaneisy",17420949,agent_override,,Terminated,expired,,4420273946,14166881,Focused Silver,378.47,21663FL0130112,4769 Coral Castle Dr,,,FALSE,,6/16/2022,6/10/2022,Terminated,1,13000,Spanish,,0,2,0,0,0,0,FALSE,,,2022-04-22 17:49:31 UTC,,,,,,,,,,,,,,,,,,,,,,,,,,,,,,,,,,,,,,,,,,,,,,,,,,,,,,,,,,,,,,,,,,,,,,,,,,,,,,Yes,https://www.healthsherpa.com/access/195597631162,8/31/2022 16:32,$0.00 ,
Gladis,Garcia,,***-**-6350,female,5/14/1961,FALSE,602 Avenue L,,South Houston,TX,77587-5010,Harris,FALSE,FALSE,FALSE,FALSE,713-702-0057,ggarcia602@yahoo.com,Ambetter Value Silver 32,share87,Silver,Ambetter from Superior Health Plan,5/1/2022,1209.73,1049,160.73,2,2900,0,Yes,4/29/2022,"Borges, Mario",17420949,agent,,Terminated,,,4151062657,8013346,Focused VALUE Silver,1209.73,87226TX0100009,602 Avenue L,,,FALSE,,5/10/2022,5/2/2022,Cancelled,3,43492,,,0,0,0,0,0,0,FALSE,,,2022-04-29 15:58:29 UTC,,,,,,,,Stephanie,Garcia,,***-**-1574,female,6/6/1998,TRUE,Raul,Garcia,,***-**-6023,male,12/29/1960,TRUE,,,,,,,,,,,,,,,,,,,,,,,,,,,,,,,,,,,,,,,,,,,,,,,,,,,,,,,,,Yes,https://www.healthsherpa.com/access/284538162654,12/2/2022 22:21,$0.00 ,
Belen,Cuevas,,,female,3/29/1994,TRUE,2575 W 24th St Apt 103,,Yuma,AZ,85364-6064,Yuma,FALSE,FALSE,FALSE,FALSE,8182337016,belencuevas@hotmail.com,Blue EverydayHealth Silver 5 (2 Free Visits with Designated PCP),share87,Silver,"Blue Cross Blue Shield of Arizona,",5/1/2022,590.29,590,0.29,0,2850,0,Yes,4/30/2022,"Borges, Mario",,agent_healthsherpa_referral,,Terminated,expired,,4423696180,3421696,Blue EverydayHealth Silver (2 Free Visits with Designated PCP),590.29,53901AZ1420014,2575 W 24th St Apt 103,,,FALSE,6/16/2022,9/27/2022,8/31/2022,Terminated,1,19500,English,,0,2,0,0,0,0,TRUE,,,2022-04-30 16:15:23 UTC,,,,,,,,,,,,,,,,,,,,,,,,,,,,,,,,,,,,,,,,,,,,,,,,,,,,,,,,,,,,,,,,,,,,,,,,,,,,,,Yes,https://www.healthsherpa.com/access/821705736589,9/27/2022 18:40,$0.00 ,$50.00 
David,Esquilin Corteguera,,***-**-4388,male,7/29/1977,TRUE,3512 Kathy Ct,,Lakeland,FL,33810,Polk,FALSE,FALSE,FALSE,FALSE,863-215-2864,davidesquilin37@gmail.com,Ambetter Essential Care: $0 Medical Deductible,share94,Expanded Bronze,Ambetter from Sunshine Health,1/1/2022,495.94,495.94,0,1,8700,0,Yes,5/10/2022,"Rodriguez, Yaneisy",17420949,agent_override,,,,,4137933517,11183160,Elite Bronze,495.94,21663FL0130106,3512 Kathy Ct,,,TRUE,5/10/2022,,12/31/2022,Effectuated,1,18000,,,0,0,0,0,0,0,FALSE,,,2022-05-10 20:18:47 UTC,,,,,,,,,,,,,,,,,,,,,,,,,,,,,,,,,,,,,,,,,,,,,,,,,,,,,,,,,,,,,,,,,,,,,,,,,,,,,,Yes,https://www.healthsherpa.com/access/843940564263,8/19/2022 17:44,$0.00 ,
Alexandra,Roman Nguyen,,***-**-1553,female,7/28/1991,TRUE,1811 Yellowhouse Cir,Apt. C,College Station,TX,77840-6815,Brazos,FALSE,FALSE,FALSE,FALSE,9795876567,alexandraroman@mozej.com,Ambetter Balanced Care 32,,Silver,Ambetter from Superior HealthPlan,2/1/2022,1014.27,1013,1.27,3,,,Yes,5/10/2022,"Rodriguez, Yaneisy",17420949,agent_override,,Terminated,expired,,4221898108,9102452,Ambetter Balanced Care 32,1014.27,29418TX0140101,1811 Yellowhouse Cir,,,FALSE,5/10/2022,8/18/2022,7/1/2022,Terminated,3,21960,Spanish,,0,2,0,0,0,0,FALSE,,,2022-05-10 20:38:33 UTC,,,,,,,,Nevaeh,Nguyen,,,female,6/7/2011,TRUE,Noah,Nguyen,,,male,3/29/2016,TRUE,,,,,,,,,,,,,,,,,,,,,,,,,,,,,,,,,,,,,,,,,,,,,,,,,,,,,,,,,Yes,https://www.healthsherpa.com/access/849889576460,8/18/2022 22:44,$0.00 ,
VICTOR,SALAZAR,,***-**-6864,male,3/6/1959,TRUE,16015 1st St,,Channelview,TX,77530-4331,Harris,FALSE,FALSE,FALSE,FALSE,7135625354,tuasesorsalud2019@gmail.com,MyBlue Health Bronze℠ 402,share87,Expanded Bronze,Blue Cross and Blue Shield of Texas,5/1/2022,977.95,977.95,0,2,8700,7400,Yes,6/6/2022,"Rodriguez, Yaneisy",17420949,agent_override,,Effectuated,completed,,4125256386,11316907,MyBlue Health Bronze 402,977.95,33602TX0860005,16015 1st St,,,TRUE,6/6/2022,,12/31/2022,Effectuated,3,33000,Spanish,,0,0,1,0,0,0,FALSE,,,2022-06-06 15:17:38 UTC,Carolina,Salazar,,,female,11/5/1965,FALSE,Martin,Salazar,,***-**-2431,male,12/30/2000,TRUE,,,,,,,,,,,,,,,,,,,,,,,,,,,,,,,,,,,,,,,,,,,,,,,,,,,,,,,,,,,,,,,,Yes,https://www.healthsherpa.com/access/812238884932,6/16/2022 16:29,$0.00 ,
Cynthia,Ramirez,,***-**-3065,female,9/24/1998,TRUE,166 NW 5th St,trailar,Premont,TX,78375,Jim Wells,PO Box 1538,Premont,TX,78375-1538,3616607591,,Blue Advantage Silver HMO℠ 205,share94,Silver,Blue Cross and Blue Shield of Texas,7/1/2022,406.98,406.98,0,1,900,0,Yes,6/30/2022,"Rodriguez, Yaneisy",17420949,agent_override,,Effectuated,expired,,4455507386,11476241,Blue Advantage Silver HMO℠ 205,406.98,33602TX0460704,166 NW 5th St,,,TRUE,8/17/2022,,12/31/2022,Effectuated,1,13001,Spanish,,1,0,0,0,0,0,FALSE,,,2022-06-30 14:28:22 UTC,,,,,,,,,,,,,,,,,,,,,,,,,,,,,,,,,,,,,,,,,,,,,,,,,,,,,,,,,,,,,,,,,,,,,,,,,,,,,,Yes,https://www.healthsherpa.com/access/321223172696,9/19/2022 17:15,$0.00 ,
Alma,Alvarado Sierra,,,female,10/12/1991,TRUE,12632 Sabal Park Dr Apt 205,,Pineville,NC,28134,Mecklenburg,FALSE,FALSE,FALSE,FALSE,6828042809,alma.lidia1991@icloud.com,Blue Home Silver 5300 + 3 Free PCP with Novant Health,,Silver,Blue Cross and Blue Shield of NC,8/1/2022,989.84,989.84,0,3,,,Yes,7/1/2022,"Rodriguez, Yaneisy",18141564,agent_healthsherpa_referral,,Terminated,expired,,4456305759,4918843,Blue Home Silver 5300 + 3 Free PCP with Novant Health,989.84,11512NC0340017,12632 Sabal Park Dr Apt 205,,,FALSE,8/11/2022,9/19/2022,8/17/2022,Terminated,3,22000,Spanish,,4,0,0,0,0,0,FALSE,,,2022-08-11 17:51:17 UTC,,,,,,,,Johana,Reyes Alvarado,,,female,4/30/2013,TRUE,Luis,Reyes Alvarado,,,male,10/19/2009,TRUE,,,,,,,,,,,,,,,,,,,,,,,,,,,,,,,,,,,,,,,,,,,,,,,,,,,,,,,,,Yes,https://www.healthsherpa.com/access/790359390074,11/14/2022 22:37,$0.00 ,$25.00 
Hector,Roman Rodriguez,,***-**-0471,male,3/17/1992,TRUE,7015 S Rockwell St Apt 1,,Chicago,IL,60629-1975,Cook,FALSE,FALSE,FALSE,FALSE,4074562095,hr7569550@gmail.com,Ambetter Balanced Care 32,share94,Silver, Ambetter of Illinois,8/1/2022,284.26,276,8.26,1,1575,0,Yes,7/1/2022,"Rodriguez, Yaneisy",17420949,agent_override,,Terminated,,,4136726417,3433916,Focused Silver,284.26,27833IL0140063,7015 S Rockwell St Apt 1,,,FALSE,,9/19/2022,12/31/2022,Cancelled,1,19000,Spanish,,0,0,0,0,0,0,FALSE,,,2022-07-01 19:17:42 UTC,,,,,,,,,,,,,,,,,,,,,,,,,,,,,,,,,,,,,,,,,,,,,,,,,,,,,,,,,,,,,,,,,,,,,,,,,,,,,,Yes,https://www.healthsherpa.com/access/400409170416,9/19/2022 17:47,$0.00 ,
Silvia,Baldera Martinez,,,female,2/10/1981,TRUE,1306 Mobile St Big,,Spring,TX,79720,Howard,FALSE,FALSE,FALSE,FALSE,9152418151,,Blue Advantage Silver HMO℠ 205,share94,Silver,Blue Cross and Blue Shield of Texas,8/1/2022,529.89,529.89,0,1,900,0,Yes,7/4/2022,"Borges, Mario",17420949,agent,,Effectuated,action_needed,,4145120704,8608580,Blue Advantage Silver HMO℠ 205,529.89,33602TX0460704,1306 Mobile St Big,,,TRUE,8/1/2022,,12/31/2022,Effectuated,2,18013.2,Spanish,,1,1,0,0,0,0,FALSE,,,2022-07-04 17:24:03 UTC,,,,,,,,Vanessa,Ruiz Baldera,,,female,2/12/2008,FALSE,,,,,,,,,,,,,,,,,,,,,,,,,,,,,,,,,,,,,,,,,,,,,,,,,,,,,,,,,,,,,,,,Yes,https://www.healthsherpa.com/access/730940064790,9/29/2022 18:11,$0.00 ,
Jesus,Rios Balderas,,***-**-8167,male,6/18/1961,TRUE,205 Cll Benito Juarez,,Sonora,TX,76950,Sutton,FALSE,FALSE,FALSE,FALSE,3252262774,INFINITYLIFEHEALTH@GMAIL.COM,Blue Advantage Silver HMO℠ 205,share94,Silver,Blue Cross and Blue Shield of Texas,8/1/2022,1104.55,1104.55,0,1,900,0,Yes,7/6/2022,"Borges, Mario",17420949,agent,,Effectuated,expired,,4148891188,10460757,Blue Advantage Silver HMO℠ 205,1104.55,33602TX0460704,205 Cll Benito Juarez,,,TRUE,,,12/31/2022,Effectuated,1,13000,Spanish,,0,1,0,0,0,0,TRUE,,,2022-07-06 19:59:07 UTC,,,,,,,,,,,,,,,,,,,,,,,,,,,,,,,,,,,,,,,,,,,,,,,,,,,,,,,,,,,,,,,,,,,,,,,,,,,,,,Yes,https://www.healthsherpa.com/access/824345229721,9/19/2022 21:46,$0.00 ,
Joaquin,Gonzalez,,***-**-7897,male,9/6/1971,TRUE,180 Cleveland Ave,,Winter Haven,FL,33881-9076,Polk,FALSE,FALSE,FALSE,FALSE,4079146357,gonzalezjoaquin049@gmail.com,Ambetter Balanced Care 32,share94,Silver,Ambetter from Sunshine Health,6/1/2022,666.04,656,10.04,1,1575,0,Yes,7/6/2022,"Borges, Mario",17420949,agent,,Effectuated,,,4400680216,10470407,Focused Silver,666.04,21663FL0130112,180 Cleveland Ave,,,TRUE,7/6/2022,,12/31/2022,Effectuated,1,18000,Spanish,,0,0,0,0,0,0,TRUE,,,2022-07-06 23:54:48 UTC,,,,,,,,,,,,,,,,,,,,,,,,,,,,,,,,,,,,,,,,,,,,,,,,,,,,,,,,,,,,,,,,,,,,,,,,,,,,,,Yes,https://www.healthsherpa.com/access/588189166366,9/19/2022 21:44,$0.00 ,
Maria,Becerra,,,female,5/11/1959,TRUE,805 N Texas Ave,,Big Lake,TX,76932,Reagan,FALSE,FALSE,FALSE,FALSE,3252260771,,Blue Advantage Silver HMO℠ 205,share94,Silver,Blue Cross and Blue Shield of Texas,8/1/2022,1201.41,1201.41,0,1,900,0,Yes,7/11/2022,"Rodriguez, Yaneisy",17420949,agent_override,,Effectuated,expired,,4461408090,11343902,Blue Advantage Silver HMO℠ 205,1201.41,33602TX0460704,805 N Texas Ave,,,TRUE,8/11/2022,,12/31/2022,Effectuated,2,17500.2,Spanish,,2,0,0,0,0,0,FALSE,,,2022-07-11 17:51:17 UTC,,,,,,,,Daniel,Zabala,,,male,10/3/2015,FALSE,,,,,,,,,,,,,,,,,,,,,,,,,,,,,,,,,,,,,,,,,,,,,,,,,,,,,,,,,,,,,,,,Yes,https://www.healthsherpa.com/access/54524438197,9/23/2022 18:47,$0.00 ,
ERIC,VILLA ESPINOZA,,***-**-1831,male,2/3/1989,TRUE,511 Alpines St,,Presidio,TX,79845,Presidio,FALSE,FALSE,FALSE,FALSE,4322084174,,Blue Advantage Silver HMO℠ 205,share94,Silver,Blue Cross and Blue Shield of Texas,2/11/2022,481.46,481.46,0,1,900,0,Yes,7/15/2022,"Borges, Mario",17420949,agent,,Effectuated,action_needed,,4131782431,8903881,Blue Advantage Silver HMO℠ 205,481.46,33602TX0460704,511 Alpines St,,,TRUE,7/15/2022,,12/31/2022,Effectuated,1,13051.2,Spanish,,1,0,0,0,0,0,FALSE,,,2022-07-15 20:09:50 UTC,,,,,,,,,,,,,,,,,,,,,,,,,,,,,,,,,,,,,,,,,,,,,,,,,,,,,,,,,,,,,,,,,,,,,,,,,,,,,,Yes,https://www.healthsherpa.com/access/508068605771,9/20/2022 16:22,$0.00 ,
Luz,Michel,,,female,5/11/1962,TRUE,6457 S Mozart St,2do Piso,Chicago,IL,60629-2831,Cook,FALSE,FALSE,FALSE,FALSE,7733674936,,Ambetter Essential Care 5,share87,Expanded Bronze, Ambetter of Illinois,8/1/2022,613.75,612.52,1.23,1,8700,8300,Yes,7/18/2022,"Rodriguez, Yaneisy",17420949,agent_override,,Effectuated,expired,,4464203734,3692624,Everyday Bronze,613.75,27833IL0140016,6457 S Mozart St,,,TRUE,7/30/2022,,12/31/2022,Effectuated,1,25741,Spanish,,2,0,0,0,0,0,FALSE,,,2022-07-18 16:03:11 UTC,,,,,,,,,,,,,,,,,,,,,,,,,,,,,,,,,,,,,,,,,,,,,,,,,,,,,,,,,,,,,,,,,,,,,,,,,,,,,,Yes,https://www.healthsherpa.com/access/808487444814,9/20/2022 16:36,$0.00 ,
Oscar,Bonilla,,***-**-2754,male,5/9/1971,TRUE,2028 Suanne Dr,,Tyler,TX,75701-4843,Smith,FALSE,FALSE,FALSE,FALSE,9037055303,mariabonilla1969@gmail.com,Blue Advantage Gold HMO℠ 206,share73,Gold,Blue Cross and Blue Shield of Texas,8/1/2022,668.99,663,5.99,1,8700,750,Yes,7/20/2022,"Borges, Mario",17420949,agent,,Effectuated,completed,,4465251046,11090677,Blue Advantage Gold HMO℠ 206,668.99,33602TX0460575,2028 Suanne Dr,,,TRUE,7/25/2022,,12/31/2022,Effectuated,1,26000,Spanish,,0,0,1,0,0,0,FALSE,,,2022-07-20 16:26:19 UTC,,,,,,,,,,,,,,,,,,,,,,,,,,,,,,,,,,,,,,,,,,,,,,,,,,,,,,,,,,,,,,,,,,,,,,,,,,,,,,Yes,https://www.healthsherpa.com/access/882550699619,9/21/2022 16:50,$0.00 ,
Shedai,Sauceda,,,female,5/20/2003,TRUE,1503 Enron St,,Edinburg,TX,78542,Hidalgo,FALSE,FALSE,FALSE,FALSE,9563425278,shedai.sauceda08@icloud.com,Blue Advantage Bronze HMO℠ 204,share87,Expanded Bronze,Blue Cross and Blue Shield of Texas,8/1/2022,261.57,261.57,0,1,8700,6000,Yes,7/26/2022,"Borges, Mario",17420949,agent,,Effectuated,expired,,4468011948,11549834,Blue Advantage Bronze HMO℠ 204,261.57,33602TX0460718,1503 Enron St,,,TRUE,8/1/2022,,12/31/2022,Effectuated,1,22009.2,Spanish,,2,0,0,0,0,0,FALSE,,,2022-07-26 17:41:24 UTC,,,,,,,,,,,,,,,,,,,,,,,,,,,,,,,,,,,,,,,,,,,,,,,,,,,,,,,,,,,,,,,,,,,,,,,,,,,,,,Yes,https://www.healthsherpa.com/access/381436372591,9/20/2022 17:00,$0.00 ,
Emiliano,Ramirez Gonzalez,,***-**-3825,male,8/8/1957,TRUE,304 Monterrey Ave,PBox15044,Zapata,TX,78076,Zapata,FALSE,FALSE,FALSE,FALSE,9562655866,,Blue Advantage Silver HMO℠ 205,share94,Silver,Blue Cross and Blue Shield of Texas,8/1/2022,1603.91,1603.91,0,2,900,0,Yes,7/27/2022,"Borges, Mario",17420949,agent,,Effectuated,action_needed,,4469537391,10866868,Blue Advantage Silver HMO℠ 205,1603.91,33602TX0460704,304 Monterrey Ave,,,TRUE,8/1/2022,,12/31/2022,Effectuated,2,25009.2,Spanish,,3,0,0,0,0,0,FALSE,,,2022-07-27 22:22:09 UTC,,,,,,,,Cristy,Segovia Ramirez,,,female,4/4/2003,TRUE,,,,,,,,,,,,,,,,,,,,,,,,,,,,,,,,,,,,,,,,,,,,,,,,,,,,,,,,,,,,,,,,Yes,https://www.healthsherpa.com/access/43118012672,9/20/2022 17:32,$0.00 ,
Griselda,Vargas Escareno,,***-**-5149,female,8/22/1975,TRUE,411 Griner St Apt 3,,Del Rio,TX,78840,Val Verde,FALSE,FALSE,FALSE,FALSE,2103165700,griselda59903@gmail.com,Blue Advantage Silver HMO℠ 205,share94,Silver,Blue Cross and Blue Shield of Texas,8/1/2022,610.47,610.47,0,1,900,0,Yes,7/28/2022,"Borges, Mario",17420949,agent,,Cancelled,action_needed,,4470258806,11438248,Blue Advantage Silver HMO℠ 205,610.47,33602TX0460704,411 Griner St Apt 3,,,FALSE,8/1/2022,11/10/2022,12/31/2022,Cancelled,2,20000,Spanish,,1,0,0,0,0,0,FALSE,,,2022-07-28 22:22:43 UTC,,,,,,,,Julian,Garcia Vargas,,,male,6/6/2010,FALSE,,,,,,,,,,,,,,,,,,,,,,,,,,,,,,,,,,,,,,,,,,,,,,,,,,,,,,,,,,,,,,,,Yes,https://www.healthsherpa.com/access/470655119485,11/10/2022 22:21,$0.00 ,
BLANCA,TREVINO,,***-**-4597,female,2/19/1965,TRUE,2104 EL SALVADOR ST,,WESLACO,TX,78596,Hidalgo,FALSE,FALSE,FALSE,FALSE,956-373-7573,blancatrevino1965@gmail.com,Blue Advantage Gold HMO℠ 206,share87,Gold,Blue Cross and Blue Shield of Texas,8/1/2022,821.18,780,41.18,1,8700,750,Yes,7/29/2022,"Borges, Mario",17420949,agent,,Effectuated,,,4146496902,9743160,Blue Advantage Gold HMO℠ 206,821.18,33602TX0460568,2104 EL SALVADOR ST,,,TRUE,8/9/2022,,12/31/2022,Effectuated,2,28600,,,0,0,0,0,0,0,FALSE,,,2022-07-29 23:41:51 UTC,,,,,,,,,,,,,,,,,,,,,,,,,,,,,,,,,,,,,,,,,,,,,,,,,,,,,,,,,,,,,,,,,,,,,,,,,,,,,,Yes,https://www.healthsherpa.com/access/64933215300,9/20/2022 18:53,$0.00 ,
Mitzy,Carrasco,,,female,10/25/2001,TRUE,21 Donald Cir,,Odessa,TX,79764,Ector,FALSE,FALSE,FALSE,FALSE,4322444514,santosmitzy224@gmail.com,Blue Advantage Gold HMO℠ 206,share94,Gold,Blue Cross and Blue Shield of Texas,9/1/2022,626.86,626.86,0,2,8700,750,Yes,8/8/2022,"Borges, Mario",17420949,agent,,Effectuated,action_needed,,4476477006,11373506,Blue Advantage Gold HMO℠ 206,626.86,33602TX0460570,21 Donald Cir,,,TRUE,8/11/2022,,12/31/2022,Effectuated,2,20001,Spanish,,3,0,0,0,0,0,FALSE,,,2022-08-08 20:11:51 UTC,,,,,,,,Betsy,Santos,,,female,5/19/2018,TRUE,,,,,,,,,,,,,,,,,,,,,,,,,,,,,,,,,,,,,,,,,,,,,,,,,,,,,,,,,,,,,,,,Yes,https://www.healthsherpa.com/access/793177411604,10/3/2022 20:41,$0.00 ,
Virginia,Cafferatta,,***-**-7850,female,2/3/1951,TRUE,505 S Travis Ave,,Cleveland,TX,77327-4937,Liberty,FALSE,FALSE,FALSE,FALSE,8325260653,victoria.cafferatta@icloud.com,Ambetter Balanced Care 32,share87,Silver,Ambetter from Superior HealthPlan,9/1/2022,1101.31,1067,34.31,1,2900,0,Yes,8/9/2022,"Rodriguez, Yaneisy",17420949,agent_override,,Effectuated,action_needed,,4477331621,11440730,Focused Silver,1101.31,29418TX0140100,505 S Travis Ave,,,TRUE,8/11/2022,,12/31/2022,Effectuated,1,19321.2,Spanish,,2,0,0,0,0,0,FALSE,,,2022-08-09 17:27:57 UTC,,,,,,,,,,,,,,,,,,,,,,,,,,,,,,,,,,,,,,,,,,,,,,,,,,,,,,,,,,,,,,,,,,,,,,,,,,,,,,Yes,https://www.healthsherpa.com/access/961708411395,10/3/2022 20:50,$0.00 ,
Anaissa,Armendariz,,***-**-5393,female,1/22/1993,TRUE,9881 W 18th St,,Odessa,TX,79763-6716,Ector,FALSE,FALSE,FALSE,FALSE,4322084157,,Blue Advantage Silver HMO℠ 205,share94,Silver,Blue Cross and Blue Shield of Texas,10/1/2022,425.17,405,20.17,1,900,0,Yes,8/18/2022,"Borges, Mario",17420949,agent,,Effectuated,action_needed,,4481621625,10669604,Blue Advantage Silver HMO℠ 205,425.17,33602TX0460695,9881 W 18th St,,,TRUE,10/21/2022,,12/31/2022,Effectuated,3,22009.2,Spanish,,3,0,0,0,0,0,FALSE,,,2022-09-22 18:21:35 UTC,,,,,,,,Axel,Rodriguez Armendariz,,,male,10/10/2017,FALSE,Angelina,Rodriguez Armendariz,,,female,3/18/2019,FALSE,,,,,,,,,,,,,,,,,,,,,,,,,,,,,,,,,,,,,,,,,,,,,,,,,,,,,,,,,Yes,https://www.healthsherpa.com/access/620062744617,11/8/2022 21:48,$0.00 ,
Manuel,Garcia Vallez,,***-**-1337,male,6/5/1969,TRUE,508 E 35th St,,Odessa,TX,79762-7511,Ector,FALSE,FALSE,FALSE,FALSE,4323072476,ticogarzia5040@gmail.com,Blue Advantage Silver HMO℠ 205,share94,Silver,Blue Cross and Blue Shield of Texas,9/1/2022,775.1,738,37.1,1,900,0,Yes,8/18/2022,"Borges, Mario",17420949,agent,,Effectuated,insufficient_documentation,,4481577043,11539619,Blue Advantage Silver HMO℠ 205,775.1,33602TX0460695,508 E 35th St,,,TRUE,8/26/2022,,12/31/2022,Effectuated,1,19009.2,Spanish,,1,0,1,0,0,0,FALSE,,,2022-08-18 16:23:47 UTC,,,,,,,,,,,,,,,,,,,,,,,,,,,,,,,,,,,,,,,,,,,,,,,,,,,,,,,,,,,,,,,,,,,,,,,,,,,,,,Yes,https://www.healthsherpa.com/access/712268632974,10/17/2022 20:53,$0.00 ,
JULIAN,ISAOLA LEIVA,,***-**-0130,male,2/20/1963,TRUE,9733 Alabama St,,Bonita Springs,FL,34135-4526,Lee,FALSE,FALSE,FALSE,FALSE,2398889595,,"Ambetter Essential Care: $1,500 Medical Deductible",share94,Expanded Bronze,Ambetter from Sunshine Health,11/1/2022,1037.87,1037.87,0,1,8700,1500,Yes,8/29/2022,"Borges, Mario",17420949,agent,,Effectuated,action_needed,,4160156064,14850870,"Ambetter Essential Care: $1,500 Medical Deductible",1037.87,21663FL0130104,9733 Alabama St,,,TRUE,10/7/2022,,12/31/2022,Effectuated,1,18001,Spanish,,1,0,1,0,0,0,FALSE,,,2022-10-04 18:50:17 UTC,,,,,,,,,,,,,,,,,,,,,,,,,,,,,,,,,,,,,,,,,,,,,,,,,,,,,,,,,,,,,,,,,,,,,,,,,,,,,,Yes,https://www.healthsherpa.com/access/877833191008,10/7/2022 15:33,$0.00 ,
ANIEL,SANCHEZ DOMINGUEZ,,***-**-6254,male,10/27/1979,TRUE,7806 Barnhill Dr,,Humble,TX,77338-1810,Harris,FALSE,FALSE,FALSE,FALSE,7862735304,anielpincho27@gmail.com,Ambetter Value Silver 32,share94,Silver,Ambetter from Superior Health Plan,11/1/2022,781.08,739,42.08,2,1575,0,Yes,9/28/2022,"Borges, Mario",17420949,agent,,Effectuated,completed,,4130702367,10815791,Focused VALUE Silver,781.08,87226TX0100009,7806 Barnhill Dr,,,TRUE,10/4/2022,,12/31/2022,Effectuated,3,24000,Spanish,,0,0,2,0,0,0,TRUE,,,2022-10-04 22:11:58 UTC,YANDIAR,FERNANDEZ GONZALEZ,,***-**-4488,female,4/2/1991,TRUE,Bianca,Sanchez Fernandez,,,female,9/10/2020,FALSE,,,,,,,,,,,,,,,,,,,,,,,,,,,,,,,,,,,,,,,,,,,,,,,,,,,,,,,,,,,,,,,,Yes,https://www.healthsherpa.com/access/799800529140,11/22/2022 15:16,$0.00 ,
Yesenia,Sanchez,,***-**-5353,female,7/2/1971,TRUE,9881 W 18th St,,Odessa,TX,79763-6716,Ector,FALSE,FALSE,FALSE,FALSE,4322084157,yeseniasanchezc29@gmail.com,Blue Advantage Silver HMO℠ 205,share94,Silver,Blue Cross and Blue Shield of Texas,11/1/2022,708.61,675,33.61,1,900,0,Yes,10/5/2022,"Borges, Mario",17420949,agent,,Effectuated,,,4465352906,11192380,Blue Advantage Silver HMO℠ 205,708.61,33602TX0460695,9881 W 18th St,,,TRUE,10/17/2022,,12/31/2022,Effectuated,2,17700,Spanish,,0,0,0,0,0,0,FALSE,,,2022-10-17 20:34:19 UTC,,,,,,,,Angelique,Sanchez,,,male,10/14/2012,FALSE,,,,,,,,,,,,,,,,,,,,,,,,,,,,,,,,,,,,,,,,,,,,,,,,,,,,,,,,,,,,,,,,Yes,https://www.healthsherpa.com/access/611690137009,12/8/2022 21:25,$0.00 ,
Victor,Armendariz,,***-**-3894,male,2/6/1992,TRUE,9881 W 18th St,,Odessa,TX,79763-6716,Ector,FALSE,FALSE,FALSE,FALSE,4322084157,,Blue Advantage Silver HMO℠ 205,share94,Silver,Blue Cross and Blue Shield of Texas,10/1/2022,431.24,411,20.24,1,900,0,Yes,10/18/2022,"Borges, Mario",17420949,agent,,Effectuated,action_needed,,4479104458,8828006,Blue Advantage Silver HMO℠ 205,431.24,33602TX0460695,9881 W 18th St,,,TRUE,10/24/2022,,12/31/2022,Effectuated,1,14016,Spanish,,1,0,0,0,0,0,FALSE,,,2022-10-19 01:48:57 UTC,,,,,,,,,,,,,,,,,,,,,,,,,,,,,,,,,,,,,,,,,,,,,,,,,,,,,,,,,,,,,,,,,,,,,,,,,,,,,,Yes,https://www.healthsherpa.com/access/321753873736,11/8/2022 21:42,$0.00 ,
David,Reynoso Atayde,,***-**-3614,male,5/12/1968,TRUE,600 N Grand St,,Presidio,TX,79845-4490,Presidio,PO Box 781,Presidio,TX,79845-0781,432-703-0872,,Blue Advantage Plus Silver℠ 202,share94,Silver,Blue Cross and Blue Shield of Texas,11/1/2022,955.68,955.68,0,1,750,0,Yes,10/27/2022,"Borges, Mario",17420949,agent,,PendingEffectuation,action_needed,,4592875246,12287343,Blue Advantage Plus Silver℠ 202,955.68,33602TX0770181,600 N Grand St,,,FALSE,,,12/31/2022,PendingEffectuation,1,14000.04,,,1,0,0,0,0,0,FALSE,,,2022-10-27 20:05:16 UTC,,,,,,,,,,,,,,,,,,,,,,,,,,,,,,,,,,,,,,,,,,,,,,,,,,,,,,,,,,,,,,,,,,,,,,,,,,,,,,Yes,https://www.healthsherpa.com/access/424045778271,10/27/2022 20:05,$0.00 ,
